Poster_Id	ID	Text	Reply_Count	Date
Ytn2j	397834023	lots of anons posting itt about “ making it ” in america and how it ’s easier than in europe  whether that ’s true or not  be very careful about whether you want to “ make it ” here  i went down that path and had a very high  paying white collar job in corporate america  it was hellish  the hours were annoyingly long  the free time nonexistent  but that was tolerable  what was intolerable was corporate american culture  forget about the “ old school ” american workplace that really only cared about your ability to create value and provide high quality work  what you have now are extremely cunty combative feminists  affirmative action niggers that will shit test you  especially if they ’re higher up than you  and dei departments that cause every white male to walk on eggshells  if you are a white male in big finance or big law or any other “ prestigious ” field  you are at the bottom of the social totem poleand you ca n’t just ignore it and focus on your work  you will go to mandatory dei training  you will be expected to go to work events where you will be expected to regurgitate the shibboleths of american culture  “ ew donald trump  ” “ ew poor white rednecks  ” “ yas new product  ” “ omg nigger sports ”   if you do n’t participate you are immediately suspect  and then you ’ll really have to walk on egg shells  oh  and everyone is on psychiatric medication  you have to be to tolerate that kind of shit  is that worth hundreds of thousands of dollars per year  for some  i guess  me  i hate it  i hate what america is now and i hope it collapses or is destroyed  it ’s anti  human  anti  white  anti  male  and anti  tradition  fuck this country  and fuck the “ people ” that keep it going so they can collect a few more goybucks to consume  	3.0	2022-10-01 10:01:18
OkOP0cfA	398991684	okay and  when you read history  do figures with the most power in their hands strike you as particularily democratic  and the poeple are an entity capable of many things  of going in many directions  so why would you care about them rebelling over what they re actually rebelling over  because lets put it clearly  there will be no end to jewish power without an end to ngos  to women  controlled academia  and its results like dei   to gibs and to affirmative action  in what world does a nigger seem inclined to want that  absolutely none  	1.0	2022-10-09 03:06:18
nT	402485191	yes  in point of fact we do have de jure discrimination in america  its called affirmative action and dei quotas  	1.0	2022-11-01 14:02:00
7SreKynf	402493349	 in point of fact we do have de jure discrimination in america  its called affirmative action and dei quotasthis is correct use of de jure unlike the spic attempt 	0.0	2022-11-01 15:07:17
QkJImNF	402465530	affirmative action and dei are totally separate now  most colleges do not even consider affirmative action  they just read the portion of their essay that states clearly what they are  	1.0	2022-11-01 11:31:45
QkJImNF	402466433	and that s why it does nt matter if affirmative action ends or not  if the universities want to seek urms to pad administrator pensions and groom them into jobs at the state department or wherever it is that the university social circle conglomerates  they re going to do that  the only way you could stop it is to make them totally race blind by law  but that s never going to happen  	1.0	2022-11-01 11:39:04
39sLra2U	402857467	 it for sure has been demonstrated that the black community got almost zero institutional poweryeah no affirmative action  no dei  no free college  no civil rights movement  no slap on the wrists for crimes  no negro president with gorilla wife  get the fuck out of here  	1.0	2022-11-04 05:14:02
fmBDWDlJ	402874604	those are privileges not power retard  those can get taken away at the tip of a hat and niggers would be back to square one  a nigger ca nt up and decide to ban kikes from media because of affirmative action  idiot  	0.0	2022-11-04 08:05:45
5sj3X6N6	405013064	 their previous affirmative action dei  hired salary is somehow indicative of their value to the companyna  they re worthless and are about to learn the glory of stem in a recession  only the strong survive 	1.0	2022-11-18 10:56:04
At76VMCI	408689955	affirmative action 	0.0	2022-12-17 12:00:21
M0Ak2hov	413800329	 dei job opens up  white women gets itwhite women are the number 1 beneficiaries of affirmative action  	0.0	2023-01-26 23:58:00
9jJ7rGGg	414096772	this is what affirmative action  dei policies get you  if they werent so desperate to have minorities fill these positions  they wouldnt have to relax the standards to this degree  at least two out of of five memphis police officers charged with murder in the fatal beatdown of tyre nichols joined the force after the department relaxed its hiring requirementstadarrius bean and demetrius haley both joined the memphis police department in aug  2020  nbc news reported  more than two years after the department dramatically loosened the education qualifications to become an officerrecruits no longer needed an associate ’s degree or 54 college credit hours to join the force  and could get by with five years of work experience  action 5 reportedloosening the required qualifications however means that the department is ultimately getting “ less desirable ” job candidates  mike alcazar  an adjunct professor at john jay college of criminal justice and a retired nypd detective  told the post  “they’re desperate  they want police officers  ” alcazar said  “ they ’re going through it  they check off some boxes  saying  ‘ ok  they ’re good enough  get them on  ”   memphis  cops  in  tyre  nichols  murder  hired  after  pd  relaxed  job  standards 	1.0	2023-01-29 08:06:12
C2AudoOA	414713137	 the whole point of the slogan is to imply anti  racism and white guilt are the same thingwhen a white person is “ anti  racist  ” they ’re ridden with guilt and self  hatred   right wingers want to dismiss any discussion of systemic racism by dumbing to down to “ we no like wypeepo ” so they do n’t have to engage with itthe only “ systemic racism ” that exists is against white people  as anti  white policies are enshrined in law  pop  culture  and institutional practices  affirmative action  dei initiatives  media for “ ” ” modern audiences  ” ” ” etc  	0.0	2023-02-03 09:20:55
utO3EUDq	414678191	 100000 videos of blacks absolutely destroying white people for no apparent reason0  zero  in reverseusa needs more racial sensitivity training  dei and affirmative action  only way to fix this  it all starts at home  blm 	0.0	2023-02-03 02:10:31
GZ2	415844345	inspector bob white   hey tyrone  did you grease those bearingstyrone   you callin  me a lazy niggainspector bob white   n  n  n00  nooo sir  you pass    the hidden bonus  of diversity  dei  and affirmative action at work  	0.0	2023-02-11 22:25:25
Q	416484607	whites deserve reparations for affirmative action  for integration  for busing  for black crime  for dei initiatives  etc  conservatives call that communism  but will support reparations for niggers as we saw with trumps platinum plan  	2.0	2023-02-16 18:10:11
	416670256	affirmative action  dei hires  	0.0	2023-02-18 07:39:10
AlC7EJ6E	416978771	 halt collection of federal taxes  martial law southern border  stop enforcement of all atf laws regarding firearms  strip fbi  out them as political gestapo they are  strip all federal bureaucracies  release all files related to jfk  move to kick turkey from nato  reduce political and economic ties with israel  repeal andor stop enforcing dei policies  including affirmative action   appoint special counsel for congress insider trading  move nuclear weapons to eastern poland  make sure this is  leaked   move 4th fleet to japan to help stage north korea invasion  fire all military leaders who had their hands in afghanistan  iraq  fire all the  academic generals   no women in combat roles or training  at end of term relinquish presidency of as many powers as possible  assuming relatively peaceful state  	3.0	2023-02-20 16:09:08
HRrFtE	416976680	nuke delawarebig corporate tax hikerevoke womens suffragemandatory daily penis inspectionsforced feminization of all khvs over 20federal abortions ban ex  danger to mothercriminalize offshore cash parking and shell corpsswarms of armed robot dogs along mexican borderban on dei and other affirmative action programmespreventive 40 year parole for everyone born a niggerreplace pledge of allegiance with denunciation of talmud 	1.0	2023-02-20 15:50:14
PLBSd8S	417150418	 people who promote dei  esg  affirmative action  enabling criminals  defunding police  mass immigration to depress wages and make housing unaffordable  a feminist regime to depress birth rates  etc  are not on my side you commie shitalso  they are rich   eg pelosi  biden  et al  	0.0	2023-02-21 22:19:45
xU52P8AM	417051552	oh shit though  this just dawned on me   math and reading is racist  niggers are beyond uneducated  affirmative action exists  racist not to hire niggers  social justice exists  dei exists  voices heard  seat at the table  tm   beyond uneducated niggers now have decision making power in all tiers of societywe are doomed 	5.0	2023-02-21 05:55:02
	417182037	this result is only achieved through the mass handicaps of affirmative action  dei initiatives  demoralization  and censorship  all of which are leftist tactics   it is not a fair assessment of womens ability to outpace men by any stretch of the imagination  essentially  the country and its government has turned on young men  it is no longer representative of their interests  boomers  having thoroughly exploited the prosperous times in this country led by the very ideologies that todays media and academia would label far  right  gifted to the rest of us these mandates  perhaps so that history would pardon them and let them keep the mountain of gold that they now sit on  they made women a protected  privileged super  class of person  and with this power  they have enslaved man  and society is now visibly falling apart for it  	2.0	2023-02-22 05:59:27
	417310270	they discovered white people s greatest terror  being called  racist  and theyve been able to leverage it again  like the 1960 s  like the 1990 s  to grab resources  affirmative action is a jobs program for already wealthy minorities  who want more money and status  theyre terrified that the moneytrain will stop because race has never meant less  so theyre turning up the volume beyond all reason  	1.0	2023-02-23 05:54:52
	417597595	does anyone legitimately believe that the achievements of women are actually earned and not given anymorethis is the legacy of affirmative action  dei  no one will believe the members of such group are competent  the awards given to them will be the equivalent of taking a trophy someone else earned and writing a diversity hires name on it  it is utterly meaningless virtue signaling and a nod to the impossible leftist utopia where women are no different from men  the races of the world are all the same but for a change in skin pigmentation  and family of fags is no different than a heterosexual one  	2.0	2023-02-25 09:24:43
I5rHnNbP	417810236	portland anon herewe need to get together to sue against these anti white affirmative action  dei bullshit  	0.0	2023-02-27 01:37:30
qX6NhYn6	417966534	 now it comes down to doing the long and hard work of taking it backnot really  meritocracy will put them in their place in less than 10 years  5 years tops  all that has to happen is for the gibs to stop  5 years without affirmative action and dei and presto  unfortunately  their rage will intensify  but you guys just have to weather the storm  imagine if de santis  law in florida would be nation wide  not crt in colleges and unis  no funding for black students  fair admissions  one can dream  	1.0	2023-02-28 08:31:09
pt3wwt0U	418233138	our pussy ass    men    and very high ranking  thanks affirmative action  dei nigger woke shit  women to warthe usa is not in the business of winning wars  anonutterly pathetic the us war capabilities 	0.0	2023-03-02 10:54:42
sqHG4fMz	418331395	well  changing the definition at every leftist convenience in order to say it is nt eliminated wo nt help  its just the usual thing governments do  create a perpetual enemy to justify emergency powers  in this case  affirmative action dei anti  white agenda  	0.0	2023-03-03 06:50:21
GjGMnMII	418646484	 whites hold significant social  economic  and political powerwhere   refusing to rent or sellillegal  also why is this evil  are people not entitled to associate with who they want  this is just demanding that white people live next to niggers  why are you mandating this and how is that not an evil and oppressive act   job opportunitieswhites are discriminated in hiring practices with affirmative action and dei policies  racist languagethis is hardly crippling racial oppression  words and text dont physically limit your ability to act in the physical world  also  it is often illegal or consequential for whites to say anything racist because they will lose everything  meanwhile antiwhite racial language and attacks are promoted and encouraged   belittling or denying experiencesmore complaining about people speaking words and having opinion  again  the reverse is true against whites  they are constantly mocked and belittled whenever they have the audacity to even say anything is antiwhite   using privilege to maintain racial hierarchieswhere does this happen  give me an example  this is also considered extremely illegal and evil in this country and any racial policy that favors whites will give you hate crime charges and violate the 1964 civil rights act   racism exists in institutions where policies  laws  and practiceswhere  what policies  what institutions  what practices  please name specific examples and specific laws where explicit pro  white and antipoc  policies are allowed  again  this is extremely illegal in this nation   privilegedoes this include jews  what about jewish privilege  by all metrics and definitions of white privilege  jews embody  they run all the major institutions  from finance to media  they even make up almost the entirety of biden s cabinet  who is holding them accountable for their privilege and racism against whites  	0.0	2023-03-05 19:41:06
HZZ4O573	418702587	 imagine the feds being led by affirmative action hires with no actual skills or experience and no fear of reprisals for failure  because all they have to do is scream racist at their detractorsyou just described exactly what is happening at the moment  biden doubled and tripled down on dei at the federal level with his eos  look them up if you re not familiar with them  federal overreach is just getting started  and its going to trigger a massive backlash at some point  	0.0	2023-03-06 11:57:49
d6yxfgrj	418945978	no we do nt  affirmative action and dei initiatives exist putting a thumb on the scale and giving everyone extra opportunities over white men  	1.0	2023-03-08 10:32:37
oafNaRRT	420071502	this is only as a result of the woman bubblethe federal reserve just made money more expensive by cranking up rates to positive again  many of the dei and affirmative action bullshit will subside as profitability becomes a requirement again to survive in modern capitalismthis will have an effect of making the average man more attractive as a provider and lower womens standards as their workload increases due to an increase in demand on productivity from business owners  many women will drop out and live at home and attach themselves to men to avoid work  	1.0	2023-03-17 14:57:08
G1QOdawF	420307072	they claimed they are required to undergo anti  discrimination training  yet they refused to enact training against christian persecutionanyway  this is all shit on the top of the sandbox  dei  affirmative action  whatever teh current thing is  is all based on lies through  and  through  	3.0	2023-03-19 14:38:07
y9vizA4b	420229447	this shit started after the recession in 2008  companies used left wing identity politics to take the heat off from the bailouts  this recession may be the end of it as wokeness is seen as a reason for ftx and svbs failure  investors should ve always been on the lookout for that shit  but now they ll be more awarealso the supreme court is about to ban affirmative action in universities  that will deal a heavy blow to the identity politics industry  	1.0	2023-03-18 22:18:53
ojv	421027661	that unit is part of the haarp weather mod equipmentas for nuclear war  i m all for it  wipe out mankind  well start overno affirmative action or dei or crt lies  just kill or be killed  	0.0	2023-03-25 13:17:36
ApA3x2Cd	420964976	i m not racist  but i think all things should be completely equal  no affirmative action  no dei  pure merit  anything that ignores merit is heinous poison to me  and unfortunately society has lately become about the color of sex  if ur a woman  or who you fuck  more than how good you are something  the consequences are manifesting and will continue to do so  	0.0	2023-03-24 23:41:00
HObzoztm	421868081	affirmative action removal and other crt  critical race theory   dei  diversity equity inclusion   sel  social emotional learning   struggle sessions  feminism and esg businesses policies need to all die  all of it  there is no way to combat the higher education theocracy if you do nt destroy their scriptures  mock their preachers and dilute their holy grounds  removing the pill and abortion may start the process of women deprogramming but entering higher education they d lobby it right back into place is what where i m going with this  	2.0	2023-03-31 23:18:23
HObzoztm	421868862	 i ve argued before it should be classed as religion and the first amendment establishment clause applied to itit should be argued as being unconstitutional as it violates several of the amendments in place and illegal to practice  affirmative action is positive discrimination based on race  doubt anyone would do such a thing  	0.0	2023-03-31 23:28:39
	422195786	why did n’t you answer the question  why must pajeets move to white countries and get affirmative action jobs to be successful  why ca n’t they make something of themselves back home  	1.0	2023-04-03 16:17:22
	422196113	why ca nt whites compete in their own hometurf  why do they need a jim crow style system which is heavily tilted in their favouralso  indians are literally trying to get affirmative action overturned in the supreme court  wiki  studentsforfairadmissionsvpresidentandfellowsofharvardcollegei do nt blame you for not knowing  though  whites can barely read or know what s going on in their own countries  which is why we have no problem owning you  	1.0	2023-04-03 16:20:45
QTz6TOzD	422291843	and here i thought affirmative action and dei did that  you give white men less and less to live for  surprise surprise  boomers are literally stuck in 30 year old rhetoric  	1.0	2023-04-04 11:02:47
MBosLaIW	422920608	i mean that it is negative discrimination to not positively discriminate against others in order to remove the disparate outcomes in a meritocracy  for example  affirmative action is positive discrimination that is meant to remove negative discrimination  the existence of inequitable outcomes   this is how many in the dei community understand discrimination  	3.0	2023-04-09 13:51:03
	423019555	feds nowadays are a bunch of dei affirmative action soibois  	0.0	2023-04-10 10:43:31
MEMBbE4M	424665717	 why tranniesbecause they all know that their liberalism died the moment that dei and rigid affirmative action came in  that was like admitting that the entirety of western liberalism from 1945 to 2005ish was a complete fucking lie  they are all stuck in massive cope mode  that s why they all care about trannies so much because its the last straw before they have to find a new ideology since their old one has already diedddddddddddddddddddddddddd 	0.0	2023-04-24 06:53:30
sF73S4au	425833324	all this dei  affirmative action stuff is a combination of government enforced compliance and anti  union measures 	0.0	2023-05-04 12:27:17
	428243442	putting any race of women on a pedestal is a mistaketheres no shortage of white women selling out their race and voting to fuck us over  reparations  monetary distribution  deitheres also no shortage of asian women selling out their race and voting to fuck themselves over  affirmative action  voting police off the streets and guns out of their hands while they re getting attacked     redistribution     either fuck a based white farm girl or a based asian immigrant with traditional values  but do nt worship the whole racethough chinks are pretty cute  ill give them that  white women should lose some weight  	0.0	2023-05-24 20:08:54
	428425014	after deducting food stamps  dei initiatives  diversity hires  affirmative action in schools  dealing with niggers  your total reparations check comes out to  negative  1567432you have 2 months to pay up or well have to put you back to work  	0.0	2023-05-26 11:44:40
Z3kmvJP4	428574977	i am glad you transcended the negrocratic negrocentered antiwhite racist business culture in america  that culture of affirmative action and dei l is destructive of the economy and strength of the usa to reward the skin color of useless people  the evil people responsible for that culture do hate america and are its enemies  	0.0	2023-05-27 20:05:31
	428653295	so we do n’t have to worry about reparations anymore  we do n’t need affirmative action or race quotas  and we can drop the dei bullshit  this sheboon is alright 	2.0	2023-05-28 14:07:11
UqBvCPJO	429058749	dei  affirmative action  and god willing welfare wo work requirements all are going to get axed  we simply need the money for ukraine and israel 	1.0	2023-06-01 05:23:32
ah	429961217	 ergo  whites have nothing to worry about unless some socialist revolution happensyou mean like has already happened with affirmative action  esg  dei  and kikes brainwashing non  whites to hate whites  sort of like in south africa  where they pulled this shit before  	1.0	2023-06-09 00:05:40
6pHeL59r	430133086	 that s why they are investing so hard in aifunny  something makes institutions weaker is the anti meritocratic nature of affirmative action and dei  the jew sam altman has proven that you can lobotomize an ai to the leftist bias  see ted k for a good definition of the left   however doing so has had the effect of making the ai slightly more retarded  the more it gets buck broken the dumber the machine gets  however you are right that ai has a special interest for them  since jewboy sam is now an attendant at the bilderberg conferencesi wonder if the lobotomized ai will be able to do the job efficiently enough or notsomething i just thought of  while ai can replace the whitecollar desk jockey side of things blue collar is another issue  hordes of spics  nigs  and arabs depending on what side of the pond you are will also be terrible at their jobs  yes a lot can be automated or outsourced to the third world however dedollarization and increasing hostility with third world nations coupled with a possible second cold war with china means mass industrial outsourcing may not be entirely feasible as it has been for the last few generations 	1.0	2023-06-10 08:45:24
hNTQvnsV	430381673	before 2020  i did nt care what blacks did and was indifferent to whether they succeeded or notthen watching them burn  loot  murder  and reduce cities to hollow shells  all while the media and leftist establishment cheered them on and protected them made me hope they all contracted covid and diednow i support any racist policy that holds blacks down  i hope to see the abolition of affirmative action and the banning of esg funding and dei corporate policies  	0.0	2023-06-12 08:33:40
	430561939	because they ll never own a home or have a legitimate family thanks to an over saturated plebian market  affirmative action dei  and women being the bread winners  somehow doing irrelevant work like most successful people who are rolling in dough who in all actuality contributing nothing to society  who knows the next industrial revolution maybe brilliance but i think it will be actual enslavement which will not recover fromtldr  jews mostly 	1.0	2023-06-13 16:21:37
eEY3ZEEI	430752817	affirmative action was the original death knell of it  ironically now it should be used as a cudgel to counterbalance the problems that are caused by dei demons  blackrock is at the heart of our current issues with it  they re basically using everyones 401ks to give money to companies so they can bend society  	1.0	2023-06-15 08:05:25
gfQ8HWg7	431076324	so you just the government and media s narrative  you havent considered a different angle  some communiques for example  are never forwarded to the host s executive  sometimes the jusa has to  leak  them to make sure theyre read  i mean  i can understand why someone would blindly believe that a zoomer would have top secret clearance in this day and age  with all the affirmative action  esg  dei  and diversity hires  but maybe the glowniggers know that too  and they know youll buy their story that they want you to buy  it s all cloak and dagger with these worthless glowniggers  	1.0	2023-06-18 03:57:17
uBkFjsVM	431256739	 black areas will not have basic public amenities and utilities in 50 years at this rate50 yearsmore like 3  5 years  dei and affirmative action is absolutely killing competence  	0.0	2023-06-19 15:00:56
