Poster_Id	ID	Text	Reply_Count	Date
ympAwsUK	463355204	i worked until i could i m not going to die for a country that would rather me be in poverty now that i m unable to perform at their illogical standards i have my own ideas for what makes someone productive simply working is that who and what you work for is very important if the business does not provide towards the benefit of the country then you may as well be jacking off all day i worked customer service management engineering and technical support i have no interest going back to those things when most of those positions have been outsourced most of the jobs in america refuse to hire within the country at all anymore you say you want white taxes to go to whites but whites are not being hired yes i am the faggot though right no i already worked and now i am disabled i am not speaking on my own behalf here however i am proposing a ubi aside from what i myself receive this is not a personal inquiry i believe citizens should reap the benefit that is currently being sent to already wealthy investment firms and ceos 1 controls half the wealth in the country when it should be going to those suffering from poverty poverty would not exist if the minimum wage was not well below poverty living in poverty myself i have come to understand what they go through forgive me for my lack of empathy for the ultra rich continue to suck on their teet though i m sure working yourself to the bone will make you just as well off eventually	1.0	2024-03-29 17:20:09
O	463342951	so you think it is the dei and not the mcdonald duglass merger and outsourcing of the manufacturing to break up the unions asstoot analassass there op faggot	1.0	2024-03-29 14:52:07
TsmKVR	463303842	shut up you faggot	0.0	2024-03-29 07:13:43
rGjlwRqh	463280444	affirmative action dei quotasop is a faggot anons who did respond with something similar are retards	0.0	2024-03-28 23:40:34
	463433996	you were steering this whole bridge accident towards a terrorist attack presumably done by said dei cunt we have archives we can see the narrative that was going tell your handler that 4chan has archives glownigger its time to update your government paid faggot glowpig fucking plutonium you get captured by russians or terrorists or some shit but biden chooses to swap an arms dealer for a drugged up lesbian dindu instead of you agent lite brite	0.0	2024-03-30 13:55:24
ktTRaI6M	463432341	you sound like a faggot i defending feminists merely calling out their role if jews orchestrated the war on white men feminists are the i was only following orders guy i was never implying they dindu nuffin	1.0	2024-03-30 13:33:52
	463384435	my instincts are telling me there will be a rug pull moment between now and 2030all the bullshit been happening with infrastructure energy and food production is not a fucking are well on their way to absolute zero agenda people are generally too retarded to piece it together because each individual thing can be made to appear dei competency media blitz to discourage travel regulations tearing down airports automobiles pricing out normies ev regs increased surveillance tech and immobilizers removal of used cars to outright bans energyshutting down most means of productiongreen faggot shit pricing normies out militarypurge of white men mass immigration of fighting aged men chinese infiltrators getting special treatment foodproduction destruction sabotage farmer regs land grabs franken food bugsi even want to go through all of it but my thinking on the matter is that there will be a rugpull the nigs and spics will be under the command of the chinks who are working at the direction of wef and china sitting ducking waiting to be culled but they know that they will win because if a grain silo in kanasas blows up you and your buddies going to storm davos and lynch globalists over it why they are quadrupling down on woke in games movies they are anticipating a future soon where white people even allowed to exist and all the history will be rewritten going to try to kill us all there will at least be an attempt bet me if you doubt me	2.0	2024-03-30 01:41:20
PZaT7Jw8	463381656	jew its not that both right and left wingers do the bidding of the jews either way but i think the people do know that there is a small rootless group that is controlling everything they just know its the jews yet jews know that they bit off more than they could chew and that the outrage will be so severe that the holocaust will actually happen why now corrupting the right since they know that the left is so retarded and unstable that when it inevitably drowns in its own shit they will be damned with them the left has done everything that it could to destroy itself the whole movement bites the hands it feeds on it relies on reputational emotional warfare the only thing it panders to is the managerial class and the insane they ca nt fight or defend themselves there are more examples of leftists getting slaughtered by the right than vice versa also i find it funny how leftists will always whine about negro faggot tranny oppression when we actively worship them and put them on pedestals when we point this out they always link to some random study about how negro faggot tranny oppression has risen by 6 gorillion percent since the last ice age authored by the same negro faggot tranny who will actively benefit from the system rewarding them for oppression all at the expense of the white man	1.0	2024-03-30 00:42:39
pchvG2Ad	463520684	kikes know they played their hand a bit too far with all the dei negro faggot tranny rights and so they have begun to hitch a ride on the rightist ship because they know that the leftist ship is sinking anyways	0.0	2024-03-31 11:46:06
0Fbq1f	463653721	i did both your questions were loaded and misleading i gave you the correct answer you pissy eyed faggot	0.0	2024-04-01 15:47:14
qrc9vF9q	463704745	buddy you guys are used to getting around censorship in creative ways because you used to get flayed back in the day for offending the wrong narcissistic faggot we live in the brave new world endless distractions but they re all dull and worthless i m sorry about the obnoxious spics on the board but irl americans are becoming quiet you all know what that horrible sign means we do want to be isolationist we want to do better we want to be involved with europe and the pacific rim the problem is that we truly are about to chimpout like we have several times in the past in ways that altered human history and we do want to take that out on the rest of the planet this was the real purpose of me coming to your thread today i want you all to know that you were correct about us people from all sorts of backgrounds are fleeing from here because we ca nt be polite anymore and wear that stupid fucking smile anymore i m sorry for being a part of the lie and for all the times i bad mouthed all of you when you were just trying to give us much needed advice something bad is coming	3.0	2024-04-02 03:53:29
eKdNj0QY	463683432	you ca nt be part of trumps cult unless you re said to take the vaxx and i did so how can i be in a cult and not do what the cult leader says faggot you going to start redefining what constitutes a cult now just to try to make the label stick	3.0	2024-04-01 21:31:59
	463885278	i m just thinking about going all in on pretending to be a nigger faggot even wear black body paint to the interview putting shitloads of benzocaine on my lips and getting a perm on my hair putting pronouns on my shit with fake social media only to show up to work as normal if i somehow make it through the vetting process	1.0	2024-04-03 19:29:22
	463872405	nick fuentes says f to whites he welcomes their downfall and said so on his last stream he does nt give a shit about white people cause he knows he s not white he d rather backpedal in order to not sound violent to his federal handlers on live stream by there s no aryans to be found doing what i m doing when plenty of us are he cares not about white plight because he is nt white and probably would nt give a shit if spics took over the entirety of america nick fuentes does nt care if white people wo nt get hired into positions of power because of dei or if any of his groypers lose their jobs climbing up the ladder as soon as white people fall off the totem pole he is a classist and if whites are no longer in his class due to dei well this is fine by him its white america first and even hitler knew this in germany nick wo nt say this part out loud because he s afraid of losing diversity hire cash and fed money in his superchat donations i like nick for talking about the jews but it stops there with this weasley faggot and he also kind of acts like a jew himself its whites first in america or you re just in the way	5.0	2024-04-03 16:42:57
352369t4	463881652	fuentes is a faggot psyop	2.0	2024-04-03 18:40:12
uL	463837740	he went through a mandatory 12 years of the explicitly hardest schooling he went through another 4 years of college to get a degree he went through even more grad school to get a masters or phd called a loser for thinking you could do something more with your did it all never did drugs never went to jail followed the law and the economy is destroyed dei feminism and immigration took all the jobs good luck faggot ca nt believe you fell for our he feels screwed over what a racist wtf why is there a competency a blithering retard and you deserve the hell you ve created for yourself	0.0	2024-04-03 10:35:05
QRCQrPid	463949253	this is an interesting update on the gender war like most anons i only caught wind of this after the gook anon post but i have to say i know if what saying is actually going to spread to every other country the way it has for you in the first place americans value their liberties and freedoms and while we already have rainbow haired feminists that actively subvert and destroy as many western values as they can their influence is still limited by the efforts of pissed off citizens the dei gamergate event unfolding right now is a great example of this as well as our budlight you can stop the majority of obese americans from chugging the number 1 beer in the country because they saw a tranny faggot shill for it you can bet that any woman getting to the point that your women have where they gleefully make posts stating how they wish to eradicate all men is a point where americans be bothered to care about your brand of insanity any more and i know this because there already are rainbow haired feminists that do screech all day on social media for the destruction of the put we already have your class of feminism i mean in the first place how many trannies do you guys actually see day to day i know it can not compare to us and yet we have a million or so of them already which is another point your population is of ours the significance of 900k feminists over there is greater than million trannies that actively support and push sexual behavior on children to the point we have gay sex manuals in some of our libraries and yet their abhorrent destruction of the fabric of society is all the appreciate the update but let me know when pastel demons go into your class rooms and tell your children that anal sex with their buddy is ok once that happens we can compare our degenerates but until then i believe the wef has already infected every country with feminism	0.0	2024-04-04 11:29:36
GG6oJhpW	463925789	fake culture warnothing fake about it you faggot jew lying little bitch	0.0	2024-04-04 07:17:23
7Gj4YCPE	464078230	at this point i consider all republicans faggot liberals or jews no functional difference to me between them and the commie	0.0	2024-04-05 15:45:02
suHtcMEv	464075457	why does biden need to dei fucking katanji brown jackson easily the dumbest supreme court justice who also does not understand the the borders wide open and trying to fight texas for defending their own the gayest possible pick for heading the the atf to criminalize hundreds of thousands of americans due to some retarded interpretation of stock brace on a could go on but i can feel you regretting your question from this side of the be a stupid faggot anon	1.0	2024-04-05 15:13:26
psAu7cyT	464003345	i m white you faggot	2.0	2024-04-04 22:39:49
MnCs60rW	464290279	holy shit trump gave money to fuck him i m voting for biden now who also gave money to israel flooded the country with violent illegal spics appointed jews as judges prosecutors etc who let criminals go free enacts dei policies to put retarded niggers into everything and had faggot she males do strip teases on the white house is totally based and trad	0.0	2024-04-07 20:06:58
f2rgFWwB	464204876	kek my sidesshut the fuck up faggot glownigger dei cuckoid retard your blue lives faggots are murderous pigs and that s all they are just mobsters with badges	0.0	2024-04-06 23:30:50
AmChWQ4p	464381085	yeah ok go blame ford for you broken taillight or radiater that cracks after 100k see how that works out for you faggot	0.0	2024-04-08 17:36:34
xTtL3cyf	464329543	i just do nt talk to anyone over the age of 30 at my job the boomers are like you said opinionated cunty faggots always looking for something to catch you on and blow up about or report to hr even their lifestyles are molded in order to be as edgy in a faggot way as possible i ve got coworkers that adopted a single nigger child in their family of 4 white sons and they first mention it to you and give you a snarky look daring you to smile or say shit about it bunch of fucking freaks	0.0	2024-04-08 07:45:02
pCXOAFAd	464429143	gen x find jobs guys it must be because a lot of the gen x faggots are the kind of useless person that went along with dei and return to the office because they sung to the tune of upper management what use does a company really have for such useless people during layoffs and a recession anyway who would re hire them during the you know what a gen x faggot would say if that happened to you care lol fuck them	1.0	2024-04-09 07:56:44
14HLyvy4	464446631	kike alertif we spent half as much time and money on new weapons programs instead of turbo faggot tranny and regular faggot diversity courses we d be better off	1.0	2024-04-09 11:17:23
qD	464421741	faggot ass boomer	1.0	2024-04-09 06:14:58
fBlKdl0	464422475	anyone who achieves any semblance of success is the opposite of what i dumb loser faggot sad	1.0	2024-04-09 06:25:23
s8bl8620	464586817	that faggot ernest khalimov almost went to hiding because you dirty brown midgets keep wanting to larp as him lmao	0.0	2024-04-10 19:03:07
	464576334	it always a faggot desk jockey clearly homosexual gleefully and honestly answering obvious trap questions and happily incriminating themselves to a stranger in are talking about a group of people who are stereotyped as sucking dicks that appear through a bathroom wall get infected with aids and monkeypox for the status and well pretty much just sampling every drug and dick they can find and you want to argue that they are not being duly cautious and safe and their employers you should be sussing out why dei was required and simplified this entire folks that build a future burst dam disaster do have any less information than the dams that last longer than the next convenient news cycle distraction	0.0	2024-04-10 16:34:02
wY0	464560230	oh its a liability fuck off faggot	1.0	2024-04-10 13:23:13
wY0	464561081	so many glowies get to post here quite literally the cool kids club but instead of cool its faggot and instead of kids its pathetic old men	1.0	2024-04-10 13:32:44
vlmUYxgM	464523287	well that s how much you can make as a shitskin the dei policies of the us military under faggot milley mean explicitly that the only white dudes that stand a chance at promotion are the ones that get that job is for you that s for a jew like the vast majority of general positions already are even though no jews exist in combat roles of any job they want for you is dying in a ditch	0.0	2024-04-10 06:03:03
8kNw6hoK	464529888	yeah bro take your covid shotshut up faggot	0.0	2024-04-10 07:36:06
	464508538	it was your faggot diaspora that pioneered dei and pseudo liberal policies like affirmative action open borders migration and lgbt the world war two generation literally preferred that hitler erase you than allow you to come here ahahahahahaha	1.0	2024-04-10 01:24:50
	464508858	not our fault you allowed godless marxist jews to dominate every sector in your fucked up faggot ass mutt of a country known better zionists were always on the right side of history the problem not only western country to prefer trump over benjamin netanyahu loves the european	2.0	2024-04-10 01:31:48
RTblzEgI	464682341	dude that faggot does this for over an year he must be a paid cia even has the same level of competency of a dei employee as seen in this old footage cant convert an mp4 to webm cant post a specific video when given simple instructions for a 1st grader know the telegram channels resorts to blatant lying when getting btfoim just annoyed the cia decided to hire this guy and not me i guess i have to be a little browner	0.0	2024-04-11 17:24:58
	464666649	the most honorable fbi head was a faggot cross dresser that kinda funny honestly	2.0	2024-04-11 14:33:59
3aL4SsAk	464667104	and even he refused to hire homosexuals and as we have seen from and that recent faggot glownigger it was a very wise move on edgars also hated communist and was not a fan of jews so plus three points for the ole bioluminescent bastard	2.0	2024-04-11 14:39:08
GbhKyLEV	464654689	you know nothing about some women who removed male chief chemists and are now running some of these a do bother to do water testing some do even have a plan or anything scheduled in the future portland leftist faggot and womens and incompetence	1.0	2024-04-11 12:24:05
Hh8Q8Vui	464636548	i know if he maybe he know what i fucking saw though a cop who shoulda fuckin better known better do the job right or fuck off so sick and fucking tired of lying ass corrupt cops you can still want tnd and not defend stupid or rotten not how you greentext faggot	2.0	2024-04-11 09:10:57
	464631837	muh stunt castingkeep coping stupid faggot its purely dei esg shit	0.0	2024-04-11 08:16:41
xwjCUVcm	464598333	bull fucking shit you colossal faggot network architect ccie jncp switching careers to tugs and merchant marine	0.0	2024-04-10 22:28:14
	464774172	an ancient nordic pagan shamanlmao nordic pagans did nt have shamans you fucking faggot retard what are you even talking need to contribute to the tribein todays world what does that mean working for dei companies what the fuck are you even saying now	1.0	2024-04-12 15:41:22
CIsBrS8t	464902245	glownigger faggot i used to be a captain come recall me to service try and see what happens just talked to a buddy the other day who quit the reserves because they promoted a tranny in his unithahahahah you wo nt do shit you fucking nigger dei faggot	0.0	2024-04-13 16:33:16
	464857483	esltired meme english maybe is even our third language you no school retardi thought it was a pretty good impersonation of a boomer co of a dei ridden suck some more dicks you filthy faggot	0.0	2024-04-13 11:25:59
AyMRCUyv	464853493	i remember this sort of being a joke when i was in the navy saying soon you will get in trouble for calling someone a faggot or that being gay will be preferable and then we d all laugh they still booted people out for faggotry at the time there was one actual faggot everyone knew was gay he got caught in a barracks room with a marine because marines and sailors shared one of the beqs on the base they both got general discharges that was a sign something was already wrong they should have both gotten bad conduct discharges big chicken dinners for faggotry they were already getting soft on them and the writing was on the soon being a faggot will be acceptable	1.0	2024-04-13 10:39:51
ignyMiOc	464987118	all deeply esg funded companies have dei you have to at least look like you are tolerant towards fags and nigs to get the job and maintain it if you want to be openly racist or be able to yell faggot at the top of your lungs at work go into the trades where you are most likely working with felons or nigs who would probably beat your ass talking shit your call want my advice just lie and say you are a giga homo nig muslim dike and once you are in just subvert work culture to your favor	0.0	2024-04-14 09:29:01
qDNuhd32	464986035	ignores the dei cunts getting laid off by the the hundreds of billions of dollars in lost revenue from a completely organic unorganized boycott of products carrying woke the biggest booze manufacturer going broke simply by putting a man in womens clothing on their cans of woke disneys worst year since the 70s due to woke the fact that the primary financier of sjw cuckery blackrock lost trillion b but muh fucking vidya you will never be a woman you delusional faggot	0.0	2024-04-14 09:16:16
ZCU0njUy	464982538	i m 32 with no college education and work a warehouse job and i m about to purchase my first house i worked a side job and my wife and i stopped eating out for 2 could do it if you were lazy and bitter about seeing other people to suck faggot enjoy no equity and monthly cuckpod payments i m willing to wager that you ca nt find a woman to sit on your cock and that s societys fault too everybody has an asshole most people have a dick and balls too go out and getcha a bag	34.0	2024-04-14 08:35:13
KgD6gG2N	464984200	no you re not dumb faggot you re about to get a home loan you will never pay off you will be renting at a higher price like a fucking idiot	0.0	2024-04-14 08:54:10
To9eFhkB	464991968	waaaaahhhh i did get to experience good timesneither did i faggot quit crying and fix it	2.0	2024-04-14 10:22:14
q2SNnQN	464986319	previous generations did this at 18 20 years old faggot	0.0	2024-04-14 09:19:28
X3dNLNxE	464987092	nobody gives a fuck what you think faggot	0.0	2024-04-14 09:28:43
F	464988143	i get enjoyment watching the young sufferimagine being this much of a vindictive impotent faggot lol	0.0	2024-04-14 09:40:20
ESkJnlTa	464970504	nigger boy we can do this all day it was nt in the original series you can not prove it because it did not exist i can think of several niggers from the games and none were bos and there was no woke or interracial project what you want and i refuse to accept it i will never watch your fo revisionist show okay faggot	1.0	2024-04-14 06:15:26
WLHhDoxB	464948896	whiter than you with your muttoid flag there is 100 chance you are a nigger or a h1b visa poonigger dei hired in cisco or other technology faggot companies	1.0	2024-04-14 01:07:09
ULN0DPe4	465117504	faggot	0.0	2024-04-15 13:09:30
ndL	465113746	some point when the dei fags at big companies decided that saying the word as in you guys they released from some glownigger funded non profit a list of appropriate language that gendered one of such words is and i fucking contain my anger when i see some faggot ass zoomer from the equally faggot midwest use the word fucking are by far the most subservient goycattle there is they will lose the whole region and i will go to the grave with a smile and enter into eternity peacefully	1.0	2024-04-15 12:30:34
aggITJ	465090829	already have a degree that taught me that dei niggers women faggots trannies and wetbacks makes it worthless op is a retarded faggot	0.0	2024-04-15 08:30:50
BY5YoJVx	465086933	nah this was across the board by the 2000s boomers loved giving out scholarships to knew english majors biology chemistry engineers etc all gaming the system it was just code monkeyseven the medical field which by the early 00s was dominated by the hindus and chang was because a hindu or chink doctor could be paid less than an american one paying a moron 400k vs 500k does add up overtime i for being mexicaned no as a engineer not but that does stop the dei train keeping everyone down for the token faggot or nigger nor does it stop the buisness guys trying to ai or automate everyone out basically the ground level of the great reset in why they talk about ubi or whatever because white or blue collar they re trying to replace literally everyone at once ai for the smart guys and robots for the manual labor	1.0	2024-04-15 07:43:49
6lq3UC9t	465191061	shut up faggot jesus is lord	1.0	2024-04-16 07:14:25
DvapK4PX	465190177	do call it dei you faggot it die	1.0	2024-04-16 07:01:21
6lq3UC9t	465190634	one of his armed mercenaries gets harmed by the dei shit a switch is going to flip in their headsthats what i m talking about you know hollywood has told a lot of lies but truth was told once in lethal using mercenaries for christs sake you want me to trust these fuckin once their blood money runs dry they ll just take what they i am not propping up faggot mercs as invincible or some shit just saying that they are murderers soon to be broke ass unhappy murderers	0.0	2024-04-16 07:08:22
an7j1aXp	465201343	i wonder whether this effect has a limited seeing the death throes as we speak the important thing to note that everyone seems to forget about is that fink is doing the financial equivalent of forcing a meme like that trust fund faggot on and that only sustainable in a system that has extremely low or zero interest rates on loans powell at the fed has not shown any interest in keeping interest rates low and his reason paraphrasing heavily is that he does want to see the world reserve currency shit itself harder than the weimar deutschmark interest rates go up free money spigot is gone companies legally obligated to increase profits must turn to only focus on things that bring in profit fuck the money pits see also youtube all of a sudden declaring war on adblockers when they were a problem for 15 years before this just to squeeze that little bit of cash they can get	1.0	2024-04-16 09:20:13
