Poster_Id	ID	Text	Reply_Count	Date
	464561025	silent genthis is highly under discusseed boomers are retarded because the greatest and silent gens bought in heavy to zog and weimerica they radically transformed the political structure to exterminate germany and firebomb half of europe this was done all so that jews could rule through the ussr and usa led a b tests greatest silent gens reaped the anomalous material wealth that the usa enjoyed it was sort of a bribe to go along with the radical breaking from the past which came in successive phases anyone who thinks that the bulk of greatest goys silent were opposed to the social revolutions is delusional they went right along with all of it maybe some complained but many at the end of the day what mattered most was money and material gen is just as bad as boomers when it comes to not helping their families imagine if you were laid off from an engineering job because dei and unlimited jeet spawning is the new corporate religion imagine trying to explain that hundreds of job applications go no where that as a white man you really need someone with an in imagine your combined wealth is north of 50 million and they tell you well good luck crwzy world out there but they have to casually drop on some nigger scholarship understand the boomer you have to get to the greatest and silent gens mad men fairly accurately captures the selfishness and insulated society that these generations enjoyed a degenerate and weird jewish power fantasy but nonetheless shows what the era was like and how debauched people were in post wwii usa i want to note that this is region specific americans in the south by and large were not like this tried to resist so called desegregation and were imposed upon by pro faggots and urbanites from the north and west so as with everything naxalt applies indeed in my personal observation silent gen is just as hateful to family as boomers	1.0	2024-04-10 13:32:10
jv9Zv1i9	464563857	if boomers had spine there would be white israel built in montana like thirty years ago they are cowards they prefer cuban spics in goyrida with their retirement villages where they have aids orgies with their spic golems slave work force squatemalans	1.0	2024-04-10 14:04:55
	464565318	there is not much you can do other than survive there are billions of niggers that boomers all fed with their goycorn they single handed negrified an entire planet with population fed on their gmo like india and sub saharan africa they sent the entire civilization to slaughterhouse i hope chinks are smart and learn from this	1.0	2024-04-10 14:22:05
jv9Zv1i9	464567696	yes i know these are supposed to be our good times sort like boomers used to have i am not demoralized future situation is just ridiculous almost surreal like a weird david lynch movie	0.0	2024-04-10 14:50:19
lmX6PUal	464538488	adjustable ratesonly retard boomers do this it litearlly is a scheme by jews that you and many people fell for i know zero people below 45 with adjustable spacingkill yourself	1.0	2024-04-10 09:22:11
9FQZH6JA	464533238	now that you spent 30k on this degree go chase this new new degree for 100kpretty soon mexicans will replace the nurses too they happily change boomers shit and piss bags for 3 an hour and not complain about it	1.0	2024-04-10 08:18:59
kgB2A6rZ	464497163	for some reason they teach the glowniggers to say that russians are commies its like propaganda that should be targeted at facebook boomers but for some reason they use it here	1.0	2024-04-09 21:31:26
	464605243	saaar dei is really much limitedfuck off you shitposting liar i worked at an international engineering company and the top management made the decision to go turbo in with not hiring white guys firing predominantly white men and jeetifting everything they said that the transformation was necessary to ensure promises made to wall street this is a company that makes medical diagnostic equipment and they have disgusting literal morons in india poking around the engineering changes think of that next time you go for a blood test and dr shekelfarb wants to chop your balls off due to test results article the own data shows that raw job growth since 2019 has been entirely foreign born a good test of how fundamentally decent or selfish a boomer is is to show this data if they dismiss it it shows that they do not have a desire for truth for many boomers jewish journos are idols that they worship	0.0	2024-04-11 00:47:40
dBLcw3	464756279	my son is drinking beer doing drugs getting in fights is extremely violent and then he dies while vanguard and blackrock spread dei nooooo its the drunk engineer boomers of of course that would happen duhits like george lucas wrote backwards star wars prequel	0.0	2024-04-12 12:19:24
	464985930	32 with no college education and work a warehouse job and about to purchase my first house i worked a side job and my wife and i stopped eating out for 2 think this guy meant this to sound awesome but year old first time buyer when boomers were buying in their buying a 400k house instead of a proper starter home likely for lack of to work a side job to get there boomers to stop eating out for two years to get there boomers is the happy slave so happy making it that not thinking about whether he had to do this to make it and think how high the probability is that this guy missed the ladder no college education so what were his chances at a decent steady job that never lays him off what are the chances he finds a woman willing to put up with this what number of guys like this are we survivership biasing out of our math when he says easy you just got ta man up and tighten your belt	2.0	2024-04-14 09:15:07
To9eFhkB	464989918	no i realize that its bullshit but bitching about boomers and being mad about it wo nt change anything for me its fucking mega gay that i have to pay north of a million after interest etc to buy a house but at least ill have a house to complain about niggers boomers and jews while you shitpost while cutting your landlord a check every complain about how boomers did leave anything for the next generation but you are totally content passing on nothing more than shitposts and cun crusted socks you are unironically worse than them you fucked up hard times are supposed to create strong men not complaining faggots	1.0	2024-04-14 09:59:56
vG3t5Vxc	464990576	you complain about how boomers did leave anything for the next generation but you are totally content passing on nothing more than shitposts and cun crusted socks you are unironically worse than them you fucked up hard times are supposed to create strong men not complaining kind different though the stereotypical boomer experienced good times times change young people complain boomer lords over them constantly shits on them and acts like young people have it people now are more likely to tell future young people that everything sucks and it will most likely get worse boomers have zero empathy	1.0	2024-04-14 10:07:02
r	464986221	white boomers seem to believe it will be either competent whites helping them or friendly wise niggers like morgan freeman lmao	0.0	2024-04-14 09:18:26
XvD7dsxY	464983190	yeah boomers are like the celebrities who rag on donald trump even though you can see in their eyes they want to blow their brains out they do give a fuck about donald trump but they have to say what the card says or the jews are going to take all their money away and that s how these fucking boomers are they re still going on about jesus this and jesus that even though they turned their back on him back in the 80s or whenever they better pray that jesus is real all these opiate addicted losers that raped their own children growing up cuz they re definitely going to burn in hell	0.0	2024-04-14 08:42:32
9xPUR4wn	464997529	this guy still thinks that if you justthats vvhere the internet comes in some millenials have almost their entire lives vvorth of online interaction providing data for black hats and the satanic global mafia to fuck up their lives vvith the denial of this fact is deepening the rift boomers themselves are causing just post a fevv times on this vvebsite and you ll see vvhat i and millions others mean	0.0	2024-04-14 11:19:02
GzJAIVCF	465004056	also you got ta understand the boomers literally do have anything their only claim to fame was corporate success and that only justified if you worked hard for it	0.0	2024-04-14 12:23:12
wBmU7fOL	465005984	death to all boomers	1.0	2024-04-14 12:42:30
	465006675	they ll be dead within our lifetimes but jews will still have all the power and institutional control at some point you have to beat the people with power if you want to win there are plenty of poor old white people who have been chewed up and spit out by this system also the richest most spoiled white boomers do hold a candle to average jewish financial types when it comes to wealth the worst part about boomers is that they are even that well off to be defending this rigged system jews live like feudal kings to a man	0.0	2024-04-14 12:49:30
BY5YoJVx	465086933	nah this was across the board by the 2000s boomers loved giving out scholarships to knew english majors biology chemistry engineers etc all gaming the system it was just code monkeyseven the medical field which by the early 00s was dominated by the hindus and chang was because a hindu or chink doctor could be paid less than an american one paying a moron 400k vs 500k does add up overtime i for being mexicaned no as a engineer not but that does stop the dei train keeping everyone down for the token faggot or nigger nor does it stop the buisness guys trying to ai or automate everyone out basically the ground level of the great reset in why they talk about ubi or whatever because white or blue collar they re trying to replace literally everyone at once ai for the smart guys and robots for the manual labor	1.0	2024-04-15 07:43:49
BY5YoJVx	465088366	contribute to society define this they send a good chunk of their money home they are a corrosive element to the culture even hindus or chinks hinduspoint was by the early 2000s college was a free ride to foreigners of all sorts and boomers gave it out especially to non whites and never paid attention to the obvious abuse i have the debt issue but it is bullshit you boomer trash gave a free ride to a non american who cheated for 8 yrs to get a bachelors all while shitting on your own and giving them a crap loan doctors in big citiesyou boxed your own out again not like we have liked to have been doctors but again by the early 00s the fix was in on the white male chang pravin etc all got a leg up because white boomer loves his diversity and shitting on his own and paying everyone less the borderlive in the southwest watched us go from a mostly white society to bilungial to basically de facto mexico down here if paco really wants it as shitty as the us military is right now he could probably take it why because boomers got ta be traitorous assholes and dare pay their own a fair wage or worse they actually wanted to blue a few red the point was that we went to college because there was no blue collar work other than welder or joining the military in the early 00s the southwest was already dominated by illegals in blue collar work paco will live multiple families to one home we were told be failures if we did what justification does any generation have for bringing in disloyal culture changing frankly home culture hating or thousands of years of english french etc not betraying their own for another highly incomptabile race then the boomer comes along and thinks nah fuck that bring in paco mutombo hadjii sahib chang etc oh and make sure they have lots of radical commie lefties stirring them up	1.0	2024-04-15 08:00:52
zcy5UTLo	465192985	wasting billions on the dei thingits a scam you idiotthe money goes from the passive investors rich boomers to fund managers rich jews who dole it out to companies on the condition they hire dei people soon to be rich jews and work preferentially with other dei infected companies	2.0	2024-04-16 07:40:29
qblgtb0M	465317996	boomers literally believe thisall white boomers are communists at heart they just never admitted it	1.0	2024-04-17 13:03:13
SbgJWTc5	465318377	everyone in america under 40 is a commie boomers are the only decent people	2.0	2024-04-17 13:07:30
vS1Dsr0o	465317678	nah you can fuck right only got as far as it did because the provided alternative is boomers screeching about how the working class should have to beg for scraps	0.0	2024-04-17 12:59:38
Lg1kjKfP	465372945	it just so happens that about 40 of publicly traded companies have a negative profit of or worse these zombie companies stayed in business to to zirp zero interset rate policy among the central banks this free money just got cut off last month so now i am hearing of a bankruptcy here and there and major corporations are putting hiring freezes into effect this is just the beginning and it will take about two years to flush out the weak hands in the meantime in the us we should expect job losses around 3 to 5 million people over this period depending on how tge government responds with fiscal stimulus this could be as good as it gets as boomers retire they will for the next decade pull their money out of their 401k and stock values will be under massive selling pressure this means that for the last 10 years where boomers were playing catchup for retirement and we had 12 returns a year are history looking to the next ten years nobody is getting rich and we will even lose ground on things like standards of living grim really my advice is to be less materialistic enjoy nature and time with friends and family more not a lot of people will be able to afford what previously was considered the basics	0.0	2024-04-18 03:16:57
498Xrgzb	465475569	thanks to and the war on terror they stole 21 trillion and whine that birthrates are high enough and as boomers only have this to flipping working class neighborhoods for californians cheap apartments that burn to the ground in minutes like in the george floyd riots that they call and hipster barbershops gayborhoods that were inner city poor black neighborhoods skinny glass super talls in manhattanand tesla if you were tricked as a millennial or gen x to fight in wars over jewish buildings like the wtc or pentagon then you came home to where the boomers were republican under bush then flipped to democrat and demanded you worship niggers like when they all kneeled to niggers that burned down minneapolis during the george floyd riots then the jews wonder why no one wants to join the military or build this shit up or give them hope and change like their sissy faggot kids demanded that you use their pronouns and love black the 21 trillion they stole they also have to show for that woke and dei pride parades and drag queen story time	0.0	2024-04-19 02:11:45
dz1jAZc1	465477242	i speculate that if a draft ever occurs it ll not occur as a general draftyoure assuming that the draft will be universal all nato countries at once and not limited to certain regions that is the case in case of a war with russia the draft is gon na be limited to belter countries poland baltics slovaks romanians czechs the reasons for it are logistical no point drafting guys from arizone when you got guys in europe tactical us will have to maintain a large reserve force in case another conflict fired up and political draft fucks up the economy so they will want to limit it as much as probably gon na be looking at bunch of central eastern european countries drafting their men whilst the west sends in weapons instructors and specialists the issue here is that all of the ideologically motivated people liberals fags capitalists are military men and wo nt subject themseles to the draft fleeing across the border instead really easy to do in eu that will leave the elites with bunch of mostly unfit but patriotic boomers and a limited amount of fit militaristic young men mostly those too poor unfortunate to escape or those who have nothing to lose and at least want to do something cool those guys are largely anti system and often times even pro russian so this is what s gon na happen	0.0	2024-04-19 02:43:16
xMpz4gap	465463896	also woke and dei because the boomers do have to deal with retarded niggers they use as useful idiots to keep millennials or zoomers from asking too many questions about what happened to all that money they stole with the war on terror	0.0	2024-04-18 22:42:06
Zw70d65	465631766	boomers imported foreigners and foreign ideologies leading to one identity crisis after another troons are just another rotten fruit of their dei egalitarian nigger loving beliefs	1.0	2024-04-20 12:45:13
b5b	465632025	everything you blame on boomers is your fault once you accept that your life will improve	2.0	2024-04-20 12:47:55
iNsMu2rT	465600702	kek telling boomers you do want to work because the juice is worth the squeeze and that you wo nt ever get the same standard of life they did really shows the boomers true boomer wants to inflict pain on its offspring and relishes in the end result of deliberately inflicting learned helplessness on its offspring every boomer a care home every care home unstaffed	1.0	2024-04-20 07:08:05
	465867419	kek so true only a loq iq mudshark faggot actually thinks russia is the enemy any high iq keeps looking at russia as a superior place to any country in the west with each and every day that like this prove that to be true every time i see this faggot senile ugly monkey boomers face in op	0.0	2024-04-22 17:18:59
je0BLEHE	465812278	53 of millennials own homes as of new years this year white millennials have exceeded white baby boomers in terms of educational attainment net worth median household income and buying homes gen z not working full time not having sex not buying homes or even renting but staying with their parents all niggers and spics inb4 deithat requires the non or shitskin get a college degree then forced into hr dei does exist outside of hollyweird and corporate america inb4 100 jobs in 2021all amazon warehouse and thrift mega store distribution centers	1.0	2024-04-22 06:51:22
J5EJ8G	465939545	what if googles top programmers and designers who are anti israel decide to abandon ship and go independent or join other companies that ll ignore the pro palestine going to happen because usa was the strongest in aerospace due to germany and the palestine question brings to light hitler to college students in usa then they realize their right of free speech is there for a reason and that israel has been the cause of their brainwashing so you all focus on nonsense while the professional class is still manipulating peoples memories until kids are smart and they revolt violently because we should have cylinder colonies by now since boomers sold us all down the line on the jewish command of making the entire earth a real estate mcmansion scam since they are still mad about rome giving the soldiers who put their yids on sticks countless real mcmansions in the prime of italy	0.0	2024-04-23 10:58:04
THWbB	466003998	former ab wildfire officer here quit during is all true our budgets were slashed but here the thing they targeted the layoffs on the most junior white male roles ie the guys who do most of the work we were already very top heavy with management now it worse and everyone they hired or replaced in the meantime has been a dei the quality of the seasonal hires who are the workhorse of the organization men with boots in the ash has dropped massively between natives who are these days more urbanized and less interested in working to the summer students being fewer browner more feminine either outright women or worse trannies and overall far less reliable their entire hiring practice is based on a soros model for excluding white males and hiring whatever brown trash slimes its way in and pikachu face when they quit or go keep in touch with a few of the scarce remaining good old boys and they tell me it an absolute nightmare people who ca or wo do their jobs people getting hurt and even dying because of the boomers in management only care about coasting to their pensions and getting out with their golden it going to get worse way worse	1.0	2024-04-24 01:56:26
zo2mqr7X	466157516	odd is how shocked many zoomers are despite this being boldly and proudly put forward to the public in the as one of the great benefits of globalization while millions of brits or middle americans may see some disruptions to their quality of life expectations millions of poles and indonesians would be lifted out of poverty and we would reach a utopian equilibrium no one can say this was unexpected which makes how unprepared many boomers were seem kind of pathethic	1.0	2024-04-25 12:04:34
wjIvRumS	466239211	americans will never heal until the boomers dwindle in population since there are more of them than the younger ones or if genz and millenials actually can outvote together the voting population of the 50 the older generations are not tuned into the cultural trends and effects of any policy since they are financial and socially secured the liberals among them want to promote things like dei and feminism since they grew up in a world where there was a lot more misogyny and racism and think men or whites should pay for their perceived wrongs and they feel good at rigging the system in favor of women and dark skinned people of color they are incapable of perceving the nuance and real effects of their own policies since they are blinded by the good feelings they get when they think they re the heroes and the good ones the conservatives among the older generations are focused on their wealth they convinced themselves that outsourcing and exploiting labor abroad was the free market and that they want to somehow perpetuate that type of economy that has negatively impacted america in all sorts of ways including its security against adversaries their view is that no one could possibly compete against them since they grew up in a time when the us was a dominant super power only but they only stewarded its decline and the rise of a competitor they never thought could possibly compete because they were in part racist the chinese will be the us main competitor this century and the older generations of americans ensured their rise to power	0.0	2024-04-26 08:37:38
	466340564	i think the the thing about boomer work ethic is that they made so much more money compared to people doing the exact same work now i think a lot of people today would work very hard for 25 35 or 45 per boomers had it awesome then as they got older they shipped all the manufacturing jobs overseas first mexico then china then they flooded the country with illegals to depress wages then they flooded the country with h1b visas to fuck the wages of tech workers and even doctors and like mike row just understand that workers today work 2x as hard for the money as people in the 50s 60s and 70s that work also includes education and student loan debt	0.0	2024-04-27 09:18:30
U3y	466460703	trump admin will be should be hitting the recruitment offices and combing through to get into federal positions in different agencies to replace our world will not accept a usurped let themselves go too much a lot of the fucked up issues in this country are the result of cold war policies gone horribly off the res and people coping after going over the cliff with a twelve axle doing 200 boomers and the silent generation have to focus on staying things are coming	2.0	2024-04-28 13:38:45
U3y	466461096	possible reconquista of northern mexico and yucatan hispanics in this country the pouring over the border is the absolute dregs of humanity genetic refuse and disposables to poison the blood of our country driven by domestic foreign spies useful idiots and egged on by the chinese iranian literally want boomers silent generation and greatest generation dead and west at their are existential enemies	1.0	2024-04-28 13:43:21
UlnLh55I	466698972	because everyone here already knows that biden is a complete shithead like you maga boomers that ca nt get it through your heads that trump is just as big a shithead as here cares if someone posts that biden is a jewish cocksucker but you maga get all pissy and defensive when someone posts that trump is a jewish entitled stupid piece of shit	3.0	2024-04-30 20:42:06
s7Ci6nWT	466708887	i would say they are much worse when it comes to israel the left has their own constitutes who pretty much see israel as another white racist country with the right there are boomers who actually do believe jews are the chosen people of god and you ca nt go against them no matter what they do because if they nuke everyone then its gods will so republicans take aipac money and vote easily with israel all day still find it fucked that we ca nt agree on securing our own border but pass a bill almost unanimously whenever israel or ukraine needs something done it just goes to show you who is really in charge of the country	1.0	2024-04-30 23:22:38
