Poster_Id	ID	Text	Reply_Count	Date
wn	456080967	literally left with no response and now has to suck his own dick  sadthis is why the taliban absolutely kicked your faggot teeth in  literally the military and low functioning faggots like this are just welfare cases now for the military which is just a big nigger day care now  	3.0	2024-01-22 12:00:59
rrkCzIuu	456081728	 this is why the taliban absolutely kicked your faggot teeth inthe military using special forces alone removed the taliban after a couple months in 2001 and had them hiding in the hills and pakistan like a bunch of cucks the entire time we were there  it was nt until we completely withdrew that they came back into power after we d literally signed an agreement with them that we d allow them to take it back over as long as they followed our rules  cucked   because we were tired of paying to babysit a bunch of double digit iq backwards pedophiles 	0.0	2024-01-22 12:09:03
	456072823	this is actually hilarious  americas dei hire for secretary of defense is goodified by the russiansi am actually totally okay with this  the united states government openly hates me and everyone i know as american citizenswhen can you get miley nextthe only sad thing is like biden  everyone knows this nigger is a worthless faggot puppet who does nt matter in the least  so they ll probably replace this nigger faggot piece of shit with some baboon lesbian nigger or some other symbolic diversity hire sub  humani no longer care and actively cheer on any enemy of the united states government  	1.0	2024-01-22 10:35:31
FZXxXSyR	456239270	shut the fuck up nigger  nobody here is falling for  bolts that hold the wing together missing is minor  and  landing gear tires fall off all the time   literally kill yourself glownigger dei faggot  	1.0	2024-01-23 20:04:11
f3osYGfX	456227241	in ten years you ll still be sitting here crying about this stupid faggot shit and waiting for a war to happen so your dumb life can have purpose beyond consuming tranny porn  	1.0	2024-01-23 17:46:48
9dY4oY	456200967	 the real problem is blacks are poor  not the fact that blacks can not raise themselves out of poverty  no matter what country they live in  no matter what resources they have available to themleftist faggot cope  wake up 	0.0	2024-01-23 13:07:11
Si2RYbYS	456206604	 problem is and always be class not race dipshityou can replace us  but you have to have lots of money firstkys lolbert faggot 	0.0	2024-01-23 14:08:35
FrMHMR4b	456207259	go back to plebbit you fucking faggot nigger 	0.0	2024-01-23 14:15:33
AqU1y	456186844	1  no they are nt  no they are not even in the fucking slightest  they re only actually turboramping it up2  none of us care what fake and gay nigger shit zog is trying to shill us3  it still would nt matter even if it was true  the die has been cast  the rubicon has been crossed  total nonwhite death or nothing  you will never get white men back into the kosher bottle  faggot 	3.0	2024-01-23 10:40:23
tGYDLvBz	456189592	ok  lmao keep waiting for someone to make the first move faggot  it ’s your race which is being destroyed  it ’s your daughters and mothers who get raped and murdered by niggers every day not mine  nobody is coming to save the white race  because they ca n’t even help themselves 	1.0	2024-01-23 11:10:40
qYvahmA2	456172384	nobody likes gayto you delusional faggot 	1.0	2024-01-23 07:56:28
qYvahmA2	456173269	shut the fuck up you dumb faggot  nobody wants your homosexual empire  its over for you fags  	0.0	2024-01-23 08:08:02
tcJzeNEI	456165852	niggers  faggots  trannies and women are nt the problem  anon  its just that you re a faggot 	0.0	2024-01-23 06:29:36
GOhs5B5z	456303712	white men are still doing all the jobs they used to before they created all these faggot jobs for women and immigrants  	0.0	2024-01-24 10:32:50
y3xCWSAH	456294921	and yet everyone fucking argues they re doing real merit  based  faggot  that s the fucking problem  everyone says its their motivating factor  and then nothing fucking changes because everyones just accusing each other of not doing real liberalism 	1.0	2024-01-24 09:03:45
eHyD5uOI	456295275	take your national socialist hogshit back to nsg you faggot nigger  	1.0	2024-01-24 09:07:35
GsdvUyoz	456294783	 blah blah blah i m black and gaycool story nigger faggot 	1.0	2024-01-24 09:02:20
btmgXPH1	456269575	nicely done parody of a stupid faggot  bro  910 	0.0	2024-01-24 04:00:25
TkgMfOtd	456457748	this is literally just them eliminating useless middle management    committees    and 25yo    writers     exactly the people that have been turning every potential good game into a horribly mangled dei disaster since 2012  faggot liberal sjws can all suck my dick and die  you ve spent the last 10  years infecting every single aspect of american culture with your pro  faggot  pro  tranny  pro  nigger propaganda and everybody is fucking sick of it  enjoy wallowing in despair for months  hopelessly swiping away for a savior on bumble as you burn your silicon valley severance away on funko pops and doordash and then starve to death in a fucking hole you worthless scum  npc  biden  voting braindead faggots  praise christ 	3.0	2024-01-25 15:43:29
KzRLzCeK	456413014	nice strawman  faggot  the issue is that average  functional dudes with proper hygeine are not valued by society  they work and do their best  yet they are passed over by women and unable to get married  their struggles are made fun of  and they are punished at every turn by dei  feminism  and court systems heavily skewed against fathers  the juice is quickly becoming not worth the squeeze to them  which is why men are dropping out and refusing to be as productive as possible  this is leading to the looming competency crisis and ultimately collapse of stable society  trying to shift the focus to subhuman losers is disingenuous at best and greatly understates the gravity of the issue  	1.0	2024-01-25 08:51:54
Hh2Vgdoz	456381627	not this new faggot bullshit dei and esg faggotry  	0.0	2024-01-25 02:07:45
	456375449	they can not afford intelligent shills or even good chatbots  always happens in the endgame times  the intelligent people figure things out and do nt work for khazar kikes  the kikes only have dei hires and their own anally raped faggot kind  who by nature are a bunch of fuck ups that literally can not stop exposing themselves  like that tranny biden hired for nuclear wasteoh  and all you shills on the payroll  the databases of your info are already floating around out there  you ll be thrown to the wolves  	0.0	2024-01-25 00:22:32
6f56qm0C	456596650	 backfirednobody is doing shit you lying faggot  there is no shitskin army rising to kill kikes  that s just your drug induced hallucination  	1.0	2024-01-26 17:56:40
fSyrsih	456688369	 be in the army or raf  sign up to tri  forces dei initiative  use platform to call the royal navys most famous hero a massive faggot  quit dei role  return to naafi  trebles all round 	0.0	2024-01-27 13:59:09
5AGiMxvO	456661632	jannies  take care of this faggot  	24.0	2024-01-27 09:07:46
mJExXYxb	456661807	jannies  where the fuck are you  can you ban this faggot bot already  	21.0	2024-01-27 09:09:33
prvtkxa6	456663789	you will die screaming faggot your resistance only makes my dick harder 	0.0	2024-01-27 09:31:18
ozLMZilP	456631192	i picked up his you ca nt hurt me book last year after seeing fags like you endlessly suck his cock over the internet  while his childhood story was tragic  i dropped the book as soon as he started telling his zogbot transformation story since there s literally nothing worth it in theremuh working out  muh running  muh studying  muh blackthere only reason he is famous is because of dei bullshit and judaism  now go suck his cock ever more  niggerlover  do you want someone contemporary to idolize and learn from  look into the life of keanu reeves  faggot  	2.0	2024-01-27 01:51:03
q0tkhwTe	456626895	i get the feeling op is the kind of faggot that  if i had told him ten years ago that donald trump would become potus  end afghanistan  kick troons out of the military and womens bathrooms  protect classical federal architecture  get rid of dei training for federal employees  lower everyones taxes  get rid of the niggercare insurance mandate  and appoint three justices to scotus that would subsequently protect 2a  overturn roe v wade  and obliterate the ability of federal agencies to make their own laws and courts  he d have asked how much i want to bet and bought me drinks while smugly talking about how delusional i was  	0.0	2024-01-27 00:36:57
1	456621208	 humanity ie dei going into space baahahahahayou know what s dumber than dumb  you nigger  you jokes can not even keep society going  your planes are breaking  your products are shit  the fucking south american jungle niggers can not even pick vegetables and fruit without fucking it up  do you lie to yourself when you look in the mirror to feel good about yourself for being a dumb fuck  you know that s hubris right  your doomed to fail  in fact  you already failed  and the curtain has already closed  refunds are currently being given to keep the crowd from burning the place down  quite the show you morons put on  to bad saturnalia is almost over and your inversion of untouchables thinking they are brahman is nearing the head  ps  you re not quite as cute as your think you are you smug prick and one day someone is going to wipe that retarded look off your faggot face  and when it happens i will be there to laugh at your hubris  because in the end we always win  do you know why that is  i bet your subhuman demon mind will never know  no run along and tell your mom i m ready for my ball milking and foot rub and you can go right along and fuck off with your stupid self 	1.0	2024-01-26 23:03:31
	456938561	 promises to lower food prices  implements restrictions on farmingare these people complete fucking retards  or have dei niggers taken over government and media completely from the faggot jews  	1.0	2024-01-29 18:13:25
KRIT	457045003	 fed overseerfancy word for dei tard wrangler  faggot  	0.0	2024-01-30 16:50:05
z85VIEcg	457042575	faggot humble bragging itt whilst coping about having meme jobs that would n’t exist when shtf 	2.0	2024-01-30 16:23:34
	457026731	am i describing modern psychotic leftists  or am i describing lolberts   pro free trade  pro open borders  pro mass migration  browning of america  pro rampant lgbtq degeneracy  pro rampant hardcore drug addiction and abuse  pro defund the police  pro dei  esg  pro anti  white discrimination in hiring and college admissionsif you re not sure if a person who supports all this is a lolbert or a faggot tranny marxist freak  that should tell you all you need to know about lolberts  	0.0	2024-01-30 13:37:16
l	456997752	too late  shit is done  where were you  oh yeah  being a faggot in discord and sharing pics of your shaved legs which will be used to blakmail further pics of that faggot asshole  kek  	2.0	2024-01-30 08:40:20
l	456984533	what have you witnessed and who is responsible and how exactly  you mean dei and trannies  because yes russia implanted the shit seed that grew into that after ww2  are you a meme addled little faggot  little faggot  	3.0	2024-01-30 05:57:03
l	456985702	 russia did nt implant that shit  that shit originated from tumblrno little faggot it predates that the commies injected the mind virus into western civ post ww2 and it has grown into nigger trannies  you sad faggot 	5.0	2024-01-30 06:12:57
l	456994004	the goals listed in the nekkid communist in the 50s before that cia shit included making art ugly faggot  	3.0	2024-01-30 08:00:24
RzfmnlKf	457007173	 no little faggot it predates that the commies injected the mind virus into western civ post ww2 and it has grown into nigger tranniesyou forgot to mention widrow wilson who created the league of nations and roosevelt who festroyed the third reich and let jews take over the us  	1.0	2024-01-30 10:13:17
l	457007273	 1 pbtid  too many pbtidkek lil faggot can not keep it straight huh  	0.0	2024-01-30 10:14:18
l	456991645	 nothing but dick fantasiesanything else faggot  	1.0	2024-01-30 07:32:34
aeiSSUmY	456962285	defense is a core tenant of the constitution  department of education bureaucrats coming up with new dei trans faggot title ix initiatives and secretly turning your kids trans is not in the constitution  simple as 	0.0	2024-01-29 23:32:43
HwT	457171473	no one is impressed  faggot  tech is bloated  the shit you work on all day is mostly pointless  and ai is going to eat your lunch in the near future  make peace with this fact  ya fucking myopic nerd  	1.0	2024-01-31 19:08:41
iFparO2s	457171554	i do nt need to impress you  you replied to me  faggot  you wanted to try to boost your ego but you re too stupid to understand what s being discussed  like the retarded child at school hamfisting his way around  go dig ditches you retard  	1.0	2024-01-31 19:09:42
HwT	457171642	you re obviously an egotistical clown trying to wow us with your supposed insider knowledge  stay mad  faggot  	1.0	2024-01-31 19:10:40
sSijop9d	457104185	weird how mormons claim to be  white  and  based  yet they have huge stakes in all the faggot dei companies and refused to use their voice and power to get them to back the fuck off of white genocide and destroying young white men  	2.0	2024-01-31 06:50:40
LgOqKIXp	457294350	 considering the level communication around herei appreciate your cordialness  but i believe you have not yet appreciated the direct masculine poetry of this reality you have entered  let me try to helpnigger nigger niggerniggerfaggot kikesniggerniggerthem faggot ass nigger kikesits the jewsthe so called jews are the synagogue of satan the antichrist no hyphenits the jewsnigger nigger niggerjew jew jewkike kike kikeand all of us    forced together    are having a bad nightt  heil hitler 1488 	1.0	2024-02-01 20:59:42
4iN08ewm	457261682	everything is about to implode  and even faggot ceos and pozzed boards ca nt afford dei  	1.0	2024-02-01 14:34:02
UJpVpxXs	457252457	 once you again you just reveal yourself to be low  iqpsychological projection  ugly and retarded trannyany ideological movement that professes to have the absolute and final answers to everything including the universe itself  with zero fallibility is fundamentally and obviously a product of hypocrisymoronic  show me how you logically reaced that false pseudo  conclusion  ignorant midwit  use logically sound arguments   documented facts and logic only  make me laugh  faggot  	1.0	2024-02-01 13:01:11
	457255410	is literally the textbook definition of hypocrisy idiotit s all in your head and a strawman fallacy  hypocrite  show me where i or any other have made that retarded pseudo  argument  all you ugly anti  christianb tranny faggot  literally  is lies  literallytruth  in this instance is just a newspeak buzzwordtruth is truth  do you idiot argue that truth does not exist  if so  demonstrate it logicallyany real christian is incapable of arguing on a level plane with a non  believer since that would invalidate the justification of their belief in the first place which inherently in and of itself is just complete nonsense like illustrated in the picturelol  give me your best logically sound argument against christianity  low  iq and delusional faggot  again  have you even read and understood the bible  you are such a retarded and intellectually dishonest fagggot that you can not debate and only must retort to painfully false and pathetic atheist ape infographics filled with strawman fallacieshow low is your iq and do you have any academic training at all  you sound like a double  digit iq and uneducated loser  desperately trying to look smart  most people here on pol are high iq  educated or not  and you just stand out as a really pathetic midwit from plebbit  	0.0	2024-02-01 13:31:54
5hdK3EQv	457222895	this  threadand the rest encouraging is also faggot fed losers sucking dei nigger dick  	1.0	2024-02-01 08:06:32
iGBb	457215193	they ’re still on this list faggot and they are getting murdered too  death to all zogbots  especially law enforcement 	0.0	2024-02-01 06:40:28
	457209819	according to cnn no  but good news for you faggot  cuckolding makes you healthy  	1.0	2024-02-01 05:33:04
5XfmXC4o	457189891	this has to be a bait thread because those gender studies nobodies now run industry standard dei workshop bullshit and hr positions  they get paid a load to show up at conferences and spew their dumbass shit  fully paid grants for phds  including housing  monthly stipend  etc  the only people who think gender studies are n’t getting paid are boomers who have no clue what jobs are like now  they do n’t even know there is an algorithm that auto tosses your resume  cover letter because you did n’t use the same wording as the job description  people have to lie about experience or being gay to get an edge over a black woman with a gender studies degree  fuck you retards  boomers  mike rowe  and any other hard work faggot  absolute scam is what that is  	1.0	2024-01-31 23:54:12
SojFQ9ni	457381473	 i would nt mind watching one 10 second ad per video  as long as the ad does nt insult my intelligence or push some ugly faggot  nigger  woman shit onto my eyeballsthats a very good point  it makes you wonder just how much big corporations are shooting themselves in the foot with this woke dei advertising because people like you are having the same knee  jerk reaction and turning away completely  	1.0	2024-02-02 16:29:37
	457382603	to me the most insulting thing isnt having an adit s being advertised the worst slop or services  using the shittiest people or techniqueslike that stupid ad for manscaped with those  subtle  smooth black balls rolling aroundyou know fuck you youtube  i dont wanna be exposed to that literal niggerfaggotry  i dont watch channels that advertise that faggot shit  i sure as hell dont wanna see it as a pre  rolli can watch episodes of the price is right from the 80s and 90s  those are glorified ads  that show was one long commercial  but it was done in a tasteful fun manner that doesnt insult mei still dont buy the shit  but it doesnt annoy menever insult  annoy your potential customer you dumbass kike fools  	0.0	2024-02-02 16:43:33
1Si2ZuS0	457343291	white privilege is nt real  retard  there are systems in place that keep white people down  dei is discrimination against whites and asians  dei disincentivizes hiring white workers  a white or asian student applying to a university has to score substantially higher in testing to get into that school  being white has been nothing but a disadvantage socially and economically for years now  show your flag  faggot  	0.0	2024-02-02 09:35:12
Doy3aYF1	457340975	mate i ’m sitting here waiting  this ass are n’t going to lick itself you faggot  this was a special assignment that they were going to give to to the latest tranny dei hire but they were busy licking my balls alreadyhow does to feel to know that traitors get the rope first glow fag  	0.0	2024-02-02 09:06:32
veK8	457333694	because the stories we tell each other are important faggot  humans are the creators  a bunch of faggot jew aliens are getting too big for their britches and think this place is a dump  too bad for them they forgot that  love conquers all  im a nice guy depending on which reality you find me in  this is a fallen world bitch  love  is a  fragile little pussy  in what retarded kikes would call heaven  down here im a straight up gangster that has no problem resorting to cannibalism if i have to  ill peel faces off and wear them for shits and giggles if you sad clown faggots keep boring me like this  also forgot to mention that im a devout national socialist and a schizophrenic  so shut your whore mouth and bring my crack pipe and slippers  or you could show a little respect and we can drop this whole thing right now  i dont give a fuck either way  you really want to throw down let s go  immortality sucks ass  deal with it  	2.0	2024-02-02 07:33:00
veK8	457329722	nice try faggot  my son is dead  little cunts a freak though  hell sleep it off and be right as rain in a few days  i love that little bastard like you would nt believe 	1.0	2024-02-02 06:42:27
xSNgBVIt	457501030	stop using feminist buzzwords you faggot woman 	1.0	2024-02-03 20:00:55
CigbFqAY	457502274	 you once again are ignoring that the guy i am arguing with is ignoring logic and just ranting about how much he hates womanwhat fuckhead  stop using feminist terms dead weight faggot woman	1.0	2024-02-03 20:16:55
NbfHn8P9	457502393	 what fuckhead  stop using feminist terms dead weight faggot womanno 	1.0	2024-02-03 20:18:24
vwlcrz51	457474095	you re obviously a cock sucking faggot  its a censored book published in a foreign country  	0.0	2024-02-03 14:31:25
MnJkeT7J	457459825	 i will polish bootsyou sound like a submissive faggot  you still want to be a slave  you just want to change masters  what  a faggot  kek 	0.0	2024-02-03 11:47:49
Pg7HQter	457548104	if they crew actually does that faggot shit  the people in the engine room really do nt have time to participate  if you work in the engine room  or even if you re in any engineering role on the ship  your ass is in the plant either working or studying systems  the rest of the crew act like being in the military is college and they fuck off all day  flight deck guys work hard too though  	0.0	2024-02-04 08:37:23
ne0kCgfq	457513592	i own a house in michigan on a lake  why the fuck would i want a condo  you must be a faggot  	0.0	2024-02-03 23:20:42
xIpeNcN5	457710543	the tech layoffs because of the diversity  dei  affirmative action hires created only hiring idiots  women  niggers  browns  prajeetsall this dead weight finally toppled tech companies  took about 10 yearslets look ar reality  google search is shit  fakebook is glowies  microsoft is glowies and also prajeets made it shitapple is a womans and faggot company  develops pretty phones instead of tech  accessories  watches etcany actual tech companies in tech field right now  that actually do tech  	2.0	2024-02-05 20:11:45
ixDbOg	457650096	 am i schizo for being suspicious herejust a faggot who never saw it happening before i guess  	0.0	2024-02-05 08:31:58
	457636368	especially in the area i m at  they believe that dei faggot shit and refuse to hire white people  they are intentionally trying to systematically make whites poor    	0.0	2024-02-05 05:29:49
ZqXVQ2s1	457759765	you can go ahead and join antifa or pussy riot and ows queers if you want to larp at being a massive leftist faggot who does nt even bother to understand what responsibility and accountability means  likely because your parents were equally entitled  	1.0	2024-02-06 09:24:41
	457746198	 pull yourself by the bootstrapkill yourself faggot  that picture in my last post plus these links is the most i m willing to entertain your time wasting nigger ass  tnd faggot 	0.0	2024-02-06 06:51:12
	457719114	 they want to make the right seem unhingedthey control both sides of politics you cock sucking blue  pilled faggot  	2.0	2024-02-05 22:38:19
edvII2tV	457964686	 ca nt compete with the immigrants  you would nt have competed against the foreign companies they would ve worked for insteaddumbest  most braindead post i ve read all dayhey faggot  where are all of the foreign companies today  india and china both have a billion and a half more fucking people to spareoh  wait  there are no worthwhile foreign companies because every single person in every country other than the us  fr  de  en  pl  ru  and jp  maybe a few others  is a horrible liar  cheat  and lazy piece of shit  hence why the us has been exclusively carrying the world economy for one entire centurystop making excuses for genetic zones that have nt been able to form a functioning society in 55000 years 	2.0	2024-02-08 06:44:58
Pd5R1Qtl	457983149	what do i care about being a superior race  do you think this is about faggot quipsi do nt want to be discriminated against because i m white and all you people that want me to suffer because i m white are my enemies and the enemies of all white people  when you re harming peoples livelihood the thing you re engaging in is deadly serious and one day you re going to get what s coming to you  	0.0	2024-02-08 09:58:28
0pB0yk4U	458140985	my bad faggot  biden also claimed to have gone to penn and did nt  	1.0	2024-02-09 17:32:35
DOH	458247972	hordesholy shit autocorrect is a faggot  but seriously the single purpose of letting these masses of people from the third world is to reduce the native european population of our countries in order to reduce iq  increase consumerism  and create a slave class of people the elites can rule over from their shiny towers  its far easier to control a population of brown people as they are nt the revolutionary type to overthrow their tyrannical governmentsit is literally that simple  colleges and dei bullshit  the media are simply there to pull the wool over everyones eyes while they do the worst things imaginable to europeans  	1.0	2024-02-10 18:31:57
