Poster_Id	ID	Text	Reply_Count	Date
	398883849	 land ownership and violence  22here ’s an excerpt from an online forum popular with zoomer males  “ i ’ m going to own a house by the time i ’ m 40  if i ca n’t afford it  i ’ll fucking take it  i ’ll shoot someone and take their fucking house  i ’ m an american  and i ’ m going to own a piece of america  my ancestors killed and took land  if i ca n’t buy it legally  i ’ll do the fucking same  fuck black rock capital  fuck the government  fuck my faggot kike landlord and his bitch of a wife  i ’ m not a rentcuck  ” how many young men feel the same way  do they speak to each other  how many more politically peaceful chances do we have to avoid them enacting this fantasy  do wealthy americans of the managerial class understand that there are increasingly angry  deracinated  alienated young men with absolutely no incentive to maintain society as it is  the cia  fbi  and nsa have identified angry young men as the  1 terrorist threat to the usa  you should listen  unfortunately  the proposed solutions are  inevitably  of the managerial type  we need more censors  more anti  bias training  more government spying  more anti  racist educators  more control over publishing  more scrutiny of social media  more shaming of young men  more language policing  none of these solutions make even passing reference to why males are angry  who cares  will these solutions work  	3.0	2022-10-08 09:41:09
nGPWXhlc	398991910	19 posts  fuck off faggot  	1.0	2022-10-09 03:09:16
5aKPV3Eh	399278534	do you work for paypal  i do nt really give a shit about any of these faggot tech companies or the economy in general or all the misbegotten wealth accumulated by parasites over the years  time to take your medicine 	1.0	2022-10-10 20:24:02
NaMR3UvO	402958882	only because of the jewish anti  white agenda  esg  dei bullshit  white people are purposefully not being hired  so go suck some jewish masters  cocks faggot  	0.0	2022-11-04 20:19:50
ApoWWQuD	403236861	i would vote for fascists if there were any  you retards normalised this  you made your bed now lie in it faggot  	1.0	2022-11-06 19:10:19
	404189624	 the leftnigger are you referring to the capitalist liberals in the democrat party  because  hans  i think you know that the left is anti  capitalist  and therefore no corporate dei larry fink liberal faggot cocksuckers are part of the lefttheyre center and right  of  center  but not left  you had the benefit of a proper education  unlike mutts in the usa  do nt go filling their ears with bullshit just because you can  you lederhosen wearing fruit  all the good germans died fighting for the reich  	0.0	2022-11-12 20:25:33
	404172829	 nato memeflag is a huge faggot 	0.0	2022-11-12 18:04:33
	404160783	it comes off as boomer logic that misses a more important point  the kim jung un looking guy can probably say  i write code   but his self  importance makes him self  fellate about shit most people wouldnt even get  it s a real job  but he s being a faggot about it because he s insecure about his jobreminds me of when i was at some careers event at school and there were 2 people with literally the same job at a panelone was a roastie  tatted up  problem glasses  colored hair  etc  she was  a multi  platform creative interested in blah blah social justice blah blah for major clients to speak to culture   one was some chadeep who said  i make ads   both are real jobs  but the chadeep came off as someone who enjoys what he does and wanted to answer our questions  while the roastie was saying a million acronyms that i guess mean something to people in her industry but none of us caredyou see this a lot on linkedin  especially when people feel the need to drop like 20 different  jobs  next to their name  thought leader  dei influencer  senior whatevertheyactuallyare  bloombergs top 40 under 40  	1.0	2022-11-12 16:13:32
z1QWlG5q	404161402	 its a real job  but he s being a faggot about it because he s insecure about his jobright  that s the point too  they need to sound more self important to avoid their worse fear of having to sweat for a living  	1.0	2022-11-12 16:19:36
z1QWlG5q	404164867	copingcome work my job faggot  i want to watch you fall out and cry because you ca nt lift heavy things  	1.0	2022-11-12 16:50:30
ZRUojRAZ	404344952	racism does not exist  it ’s just kike linguistic warfarealso  glownigger kike faggot 	0.0	2022-11-13 23:59:47
jXd1QwWA	404544771	 bro your company will be like my cuck factorywe tried  we really did  its just not possible  i have a real job  not some faggot push  button sql bullshit  our workload actually doubled and we are getting annual bonuses  union pay matching nowmaybe you should look towards another career if you re so easily replaced  	0.0	2022-11-15 10:38:47
nVLTGUgg	404942405	you do nt know what i m doing  chink  but lets take a look at what jobs college opens up  engineering  this is a good one  happens to be my field  too bad a college degree is nt necessary for it  i can train anyone to be a civil engineer in less than half a year  if they have trade experience in surveying  it would only take a month tops  that s roughly  80k wasted on a job that is literally less complicated than being a farmermedical field  seems good  but too bad it has the same problems you think trades have  its actually being taken over by pajeets who have no verifiable college education  they just input symptoms into webmd and write you a prescription for an opioidscientist  okay  might seem like a good field  but is it really  nope  shaniuqua is now doing routine work on pharmaceuticals that could be done by a monkey  and so it is  but at least she can call herself a scientist  as for the actual scientists  there just is nt that many positions availablespeaking of pharmaceuticals  being a pharmacist requires a college degree  did you know  guess where they come from  well  one of the largest is famu  a black college  the oldest in the country  it takes them years to obtain 2 months worth of required knowledgewhats next  well  turns out the next is business degrees  something that only a few decades ago did nt require a degree  but somehow it does today  within that field one of the largest areas is  you guessed it  dei  social engineeringpsychology  does nt require a college degree because 95  of it is bullshitwhat else  what else is there  chink  that s your worthless college  for you  take in hundreds of millions of suckers and train them for tens of millions of possible careers  meanwhile you post the same disproven bullshit about trades over and fucking over again  because you re fucking jealous of themnow shut the fuck up  faggot  	1.0	2022-11-17 20:43:00
hGHw1DmT	405056759	no it means that he is a larping faggot 	1.0	2022-11-18 17:35:28
	405075561	go back to rebbit you faggot  	0.0	2022-11-18 21:02:25
gy1LrwE	405843467	 vox populi  voy deiwhat a cringey faggot 	3.0	2022-11-24 22:32:27
H1jgcrB7	406942489	us aerospace will soon be pozzed to shit like tech industry with poojeet and dei workers  say goodbye to space and military dominance  this is what you get for faggot  tranny  and feminist left wing politicians  	0.0	2022-12-03 10:03:32
MymgQp2X	410061823	what the fuck are you even talking about  you babbling retarded faggot   when elections roll around absolutely zero percent of the debate  or anybody ’s final vote  is based on considerations of fed monetary policy  because it ’s a perfect example of my point  what the fuck are you blathering about  focus and use your words  	0.0	2022-12-29 05:28:34
o3NVtlaw	410203238	motherfucker really took his fucking time to compile every damn replies to this thread for 1 fucking picture  there s literally walmart anon that single handily disprove your reddit portrait you dumb faggot  go back to plebbit  	1.0	2022-12-30 08:06:52
tmzdodcE	397566262	i m not envious i already said i m ok with people having a good life  but not with obvious bad people who do nt deserve it like yourself  you should be immediatelly get beaten up and get cancelled you do nt deserve riches for sureyou iterally have a bullshit tier basic ass job and earn massive salary from some faggot bachelor at 22 and shit on others  in other times you d be straight beheaded for this 	1.0	2022-09-29 14:57:29
456zZjt3	410354902	stop eating goyslopstop drinking the liquid jew  booze  wine  beerstop giving faggot die  dei  esg jew kike fink companies any moneyget out of debtget in shapemake your own food and have a decent amount of food in storage to deal with the bullshit the globalists are going to do to try and break your back  	0.0	2022-12-31 10:14:37
X3kxVjG1	411544818	faggot 	0.0	2023-01-09 12:15:24
aSdbpMwc	411840862	uhh anon … colleges are the beating heart of liberal faggotry  they have been pozzed dens of jewish faggotry most likely since their inceptionthey have also been a scam since the 90 ’s  once self congratulatory liberal faggot convinced everyone else that a “ degree is the path to prosperity ” it all became watered down bullshiteven engineering  which has always been relatively immune because of the rigorous academics  is falling pray to this  if they can convince engineering schools to lower standards to attract more woman and niggers nowhere is safe  	1.0	2023-01-11 17:17:20
	412142697	jew is a derrogatory term coined by saint john to describe the judean population who denied christ  you rave resolve  faggot  ill give you that  you would be fun to argue with longer if you did nt have the brain of an ape and the education of an americanad maiorem dei gloriam  	3.0	2023-01-14 02:38:30
	412143634	here  dump of why you re a faggot and need to hang yourself  	1.0	2023-01-14 02:53:22
	412143680	shitskin worshipping faggot 	1.0	2023-01-14 02:54:05
7MJDPDl1	412646258	you re a massive inbred faggot with literally no reading comprehension  i never said that progressivism is a good thing  only that the current efforts against it are ineffective because they are  i deal with is  not ought  and the reality is that progressivism has all the power in the west and formulating sophisticated copes to ignore reality helps no one other than the progs  	1.0	2023-01-18 01:12:17
dYKkfmE5	412897871	  the glory of god is to hide the wordinteresting quotei considered this  the world is designed to paradigm shiftbut jewish ego does nt want thisits the path of the pharaohand faggot masons and jews do nt want to accept woman  mother is divine  the world designed by him via quantum  proof of god  to hand the pyramids  strongest structure  off to  her2  1 in womans favourrepresentation is society would parallel heaven 	0.0	2023-01-20 02:27:10
SElb1Ka	413221586	you clearly could care less  you ve replied quite a few times and are very passionate in it apparently  its not that it could be true  its that it is true  i see them get hired constantly  granted were on freezes now but it was happening like gangbusters all last year  when you have over a million employees  you see quite a few come and go  i do nt live in sv  retard  you can work at faangs and be anywhere in the country  i m in texas for example and no  not austin  few of my fellow engineering folks are gun nuts as well and we joke about trannies and faggots all the time  you have a distorted view of what that world is because you only get fed info on the faggot office drones and women  who are mostly useless dei hires  	1.0	2023-01-22 14:53:45
hOz5pswZ	413220907	also  there s nothing wrong with people talking with their confidents in thier head and meditating on evil  cause evil makes more art  and sometimes people do nt meditate on the right stuff  so they further render a dispensement of shit on themselves  so they have no mercy  not realizing i stand in opposition to the sun  by saying you are nothing but a meek bug which is trying to eat dead shit for your own glory  there is no love for faggot sodomites  and they could not offer me any other lore aside me and my enemey are both god and i do nt actually hate people  i just think that labeling someone as autistic  is literally the damnest thing you could say to gods artist by being a cruel hypocrite in your own right  	0.0	2023-01-22 14:47:20
vlcT0cpp	413710429	 basically esg on steroidsnot quite  dei happens because its mandatory once you take the esg jews money  part of the fine print   t worked for a company that put a token faggot on the board because muh nasdaq rules 	1.0	2023-01-26 08:19:09
edSUBszY	413833079	all the traders know everything is fake  everyone above 120 iq knows everything is corrupt beyond all recognition  they know this guy is just a dei hire for his faggot black face  everyone knows it does nt matter cause he s a propi societies are so fucking dishonest now that no one believes any pretense that existed even 10 years ago  	0.0	2023-01-27 07:17:39
KAvVvHsP	413815183	faggot as soon as i saw this spacingslide 	0.0	2023-01-27 03:40:07
YswgL8Kb	413810417	 putting a gossipy faggot in charge of this shitdei  everybody 	0.0	2023-01-27 02:32:09
	413800658	picjust in case this faggot deletes tweet one day  	0.0	2023-01-27 00:02:50
9RlF6pCJ	413792725	these well poisoning shills  either kikes  discord trannies  some other libshit group  vaxxies in denial or corporate interests  this place is a battleground of information  wake up faggot  do nt give them  yous  that only enables them  	0.0	2023-01-26 22:05:19
uqVytVop	414612025	 option is to be a machiavellian asshole who secures the well  being of his immediate circleactually realistic and based  i am biased towards anyone that is white and not a faggot lefty  unapologetically soand pay no mind to those defeatist faggots like the one youve been replying to  they all crumble at the slightest pressure  look how hostile they react to any point made  i just laugh at themevery single  you wont do shit  poster  will not do shit themselves  they deserve to be ignored or ridiculed  because nobody should ever take them seriously  	1.0	2023-02-02 13:07:10
qimnzqmw	414884761	not if you have a brain  faggot  get vaccinated  	1.0	2023-02-04 14:45:01
7q0D	415802961	you are a faggot  that is an objective fact 	0.0	2023-02-11 15:31:13
TTbZipfj	416188620	you realise they ’re onto you  you realise they know you ’re still z and that fucking temporary visa you got by crying your eyes out like a faggot is gon na run out  and then you ’ll have to go to russia and explain to them where the fuck you ’ ve been since last september you pathetic subhuman cunt 	1.0	2023-02-14 12:02:14
OKwmoe7	416462217	following up to this in brief  this is exactly how i handled the crt crap at my company  ceo sent out a memo the next day cancelling future  dei  activities until a better understanding could be formed at the executive level of the content and character of the programswhat usually happens is these communist faggot lying kikelover activists will just lie to get permission for this kind of shit  execs will often just block stuff  but as soon as a rely all hits from a name theyre not expecting  they will actually engage with the material and realize  what the fuck is thisspeak up  youre not the only person who is pissed off at this crap  so just saying  anything  will have plenty of others  including people well above your paygrade  get the message  	4.0	2023-02-16 14:26:49
oOTFPd	416667430	 we should stand by allow the  system  to destroy people s livesthe only way to fix this is to start killing the enemy  but you are against violence coz youre a cucked faggot shill 	0.0	2023-02-18 07:04:27
4flATE1j	417091976	go fight for russia and die in a trench then faggot  	4.0	2023-02-21 12:28:45
4flATE1j	417092568	well i hope not  anonyou will never not be a faggot though  	0.0	2023-02-21 12:34:08
wyNBPLEX	417092782	eat shit you fucking nafo troon faggot  	1.0	2023-02-21 12:35:48
	417441315	are you really so fucking retarded that you do not understand that democrats and liberals are capitalists  soros  blackrock capital  vanguard  et al  they re all capitalists  literally private owners of capital  the woke dei faggot shit that has your entire country worshipping niggers and cutting off kids dicks  its capitalism  not one single aspect of it is from muh left  its all capitalism  this is the power of the free market  boomercon worldview is literally a bigger cope than reddit trannies thinking they re women  the rope awaits  kikebot  	3.0	2023-02-24 04:55:20
	418127170	then go to b  faggot  stop enabling these kikes  they are the same ones posting the garbage threads you mentioned and they stick around because you niggers keep replying to this shit 	0.0	2023-03-01 14:18:10
	418118937	now i see you re only here to derail  gtfo faggot 	1.0	2023-03-01 13:01:26
HVaIppC7	418305498	i work in it  faggot  everyone is a soiboy at my multinational and i regularly go abroad to meet other devs  	0.0	2023-03-03 00:35:06
ldzuF55a	418788246	lol listen to the cope and seethe of the baseless assumption i fly economy  i did not fly economy  i have while on dsp been to other parts of the world and there is no rule saying dsp kangs can only take one trip  all we need to do is have savings and we are free to travel as many times as we please  continue seething wagie  i assume your job permits you to awake at midday every day of the year no  aww poor wagie has to set the alarm  enjoy the dei training session faggot  do nt forget to watch your mouth at work wagie  no thought crimes are allowed especially during pride month you fucking mug 	1.0	2023-03-07 05:15:14
NrohdK2Y	419399926	i was n’t even given a choice for the psych meds cunt  the state just decided it ’s reasonable to shove ritalin  vyvanse  luvox  fluvox  and lamatrogine down a 5 year old ’s throat until they found out that only the vyvanse had the desired result  and apparently it ’s perfectly acceptable for a child to weigh no more than 30 kg in primary school  and then no more than 45 kg in high school  apparently it ’s ok for small children to pull razors up and down their arms because the medication they force feed you makes you feel numb and you desperately want to feel something  anything  that ’s real  and now i get the pleasure of looking after my father whilst he slowly succumbs to cystic fibrosis and there ’s nothing i can do about iti hope you faggot feds are here reading this because you created an extremely angry and extremely self  motivated man and when my father finally moves on from this disgusting shithole of a world i ’ m going to show you fuckers what it ’s really like to be abused  no mercy 	1.0	2023-03-12 06:57:15
6Dp	419862548	1  the    old kike    ofc2  the cripple  nobody needs a novelist anyway3  the accountant  another useless skill  and likely to also be a    kike4  the nigger  medical student  is less useful than basic first aid skills  even if he isnt just a token diversity enrolment5  either the faggot athlete or the spic  depending on whichever is oldest and unable to do physical workand that s 5 because i have better skills and genetics  so im going in the 12   woohookill kikes  cripples  druggies  and niggersmodern dei proves  nazi  eugenics were actually correct  	0.0	2023-03-15 22:03:34
0HSH1n0Z	420323091	sorry you re a dumb faggot  anon  	0.0	2023-03-19 17:28:28
NFTVFhkf	420566713	its die  not dei  do nt sanitize their bullshit for free you faggot  	0.0	2023-03-21 17:12:15
qxwTwz	420827412	if you wear a suit and tie i gushed you are a low iq low paid larping faggot  i do nt even work and make 100k  because my aryan blood is worth more than a hard working nigger in a suit  the company pays me for my charismatic precense  but i m not giving it out to bunch of monkeys in suits that get hired due to dei  i m charging a premium working from home  and i m not going to talk to women that are nt white or at the least a very exotic and sexy american born asian  	0.0	2023-03-23 20:01:38
fKhg6UXk	421126330	sounds like you need to speak with hr followed by several days of training with the massively equipped dei department  remember niggers  faggot and troons have more of a right to be there than yousigned  dick  sucking ceo 	1.0	2023-03-26 10:48:01
	421357784	i m a leftist anti capitalist and i just want to say that you will never be a real woman  keep your corporate sanctioned woke dei faggot shit out of my face  	0.0	2023-03-28 06:49:56
Sqstxy	421327566	kek how much do they pay you  faggot  is it  200   300  i guess its good money if the only other source of income is your disability gibs  which is like  200a bit of advice  change careers  	1.0	2023-03-28 00:00:29
OGnUdQGu	421524417	fuck hr cunts  vile racist communist bitches trying to take your livelihood away so their faggot friends can have your job despite neither having a degree  whenever i have to deal with one of these dei womanist bitches  they immediately go find a man to hide behind  some faggot cuck lawyer always steps in to white knight for them  but never addresses the pure bullshit and hate coming from hr departments 	0.0	2023-03-29 11:43:03
l924vTLf	421889823	fogbank was recreated  we still ca nt make cores because the faggot mutts the doe hires now ca nt into safety regulations  the issue is nt that they have problems the issue is that the scale of the problems gets worse because the age of the hardware and the incompetence of the worforce are both growingthings that were designed by 130 iq white men in the 80s are being maintained by 90 iq mestizos overseen by 105 iq diversity trannies  the us weapons stockpile is less reliable now than it was in the 90s  how much less reliable  great question that nobody wants to think about  	2.0	2023-04-01 04:44:29
LkAq5cBj	422193318	you must understand that the white man will never accept you as his peer  you will always be inferior in our eyes  even if it is the all so tolerant liberal down the street  they just hide behind the wrapping called systemic racism or whatever faggot term the american juden has invented now  why can you not just fucking leave us alone  we hate you so much  its unreal  if you crave  liberty  then fix your shithole mmkay  at the end of the day  what you really crave is to be around whites  but we hate the smell of you shitskin  you are like a leeches  	0.0	2023-04-03 15:51:46
UpnxFhLb	422157050	 the reason things are changing so quickly  is because peoples minds are being changed so quickly  by the algorithmthats some real intelligent shit there  as in no shit sherlock  the people most likely to throw all tradition aside and embrace radical change are the youth  because the youth have less life experience and their minds are therefore more malleable  tiktok targets the youth for indoctrination  the social contagions get promoted by the mass media and other institutions  single moms  and married moms with weak husbands  embrace the current thing  out of fear of being cancelled   so the manufactured opinions of brainwashed children are promoted by the multinational corporations that are owned by oligarchsoligarchs  deep state  inner party and of course the fucking kikes  not sure why you do nt mention the jews here   and these opinions accrue political power via the woke wine moms who are staring into their iphones all day  desperate to keep up with the rest of the herdif someone is nt doing real work or producing things of real value then this is what has replaced daytime tv from long ago   yuval noah harari was righthe is a faggot kike  so he is nt right about anything   free will is doneno its not  jew   humans are now hackable animalsso turn it offsimply stop using kike media  newspapers  fakenews  magazines  social media  movies  television  schools  colleges  universities  hr departments  esg  die  dei   pr   eating goyslop  big tech  advertising  medical  industrial complex  and censorship to make mass  formation  psychosis something they can trivially manipulatei do nt take in any jew mediai do nt watch kiked and nigger sportsballi do nt drink the liquid jew  alcoholi do nt eat the goyslop  steak  eggs  butteri am not weak  get fiti have prepped  get out of debt and prepare for bad timesnever plan to rely on the kike medical industry for anythingnothing here requires 130 iq  it requires discipline 	0.0	2023-04-03 09:57:27
Cy9BKtMx	422350985	i ve been posting on here longer than you faggot  	2.0	2023-04-04 19:24:05
4oTA25Ig	422469579	biden created like 3 dei nigger  faggot executive orders day 1 of his presidencyits not a secret the biden admin is doing it to appease the people who donate to his campaign  	0.0	2023-04-05 18:04:12
XvL0YX8S	422365186	oh shut up you stupid faggot  the demographics are fucked  that s why you ca nt win  they imported a bunch of subhuman garbage and these are the results 	1.0	2023-04-04 22:07:27
us848TFN	422552847	ffs  my initial post was in response to someone saying yuengling was not a part of coorsit is  they are partners  they are partners of a multinational corporation with hedge fund investors  esg  dei  and all the rest that goes with itofc  it is easier to use someone elses distribution  i was responding to your retarded hypothetical where yuengling buys coors distributionyou are an annoying faggot  enjoy your beer  	0.0	2023-04-06 11:30:35
