Poster_Id	ID	Text	Reply_Count	Date
D6E5g9ZF	472974364	a relatively right wing conservative like or support dei it is stupid unjust and harmful whoever is the most qualified candidate for the i believe that le jooz caused that for one you leave out all gentiles involved in anti white leftist stuff and only bring up jews when a goy is involved you just say le shabbos i acknowledge jews are overrepresented in well basically everything we can achieve a lot of evil a lot of good a lot of science and a lot of politics not trying to brag or be chauvinistic simply speaking about an objective phenomenon like pic i posted showed jews more or less made an entire modern political ideology on the right explain everything but jews tend to be smarter educated people from big white people of that demographic tend to be pretty leftist and antiwhite is a or without da comes from affirmative action which was started by jfk an irishman executive order 10925 inb4 muh shabbosmeme againokay i take antijewish things more negatively than antiwhite things jewish it is possible even in some aspect not seeing things 100 clear i am biased in favor of my people so are you what is wrong with i think genuinely you are overestimating and overracializing the role of jews in all continue to group me in with these people fink as if his acolyte or he is my best friend and we go out drinking together in reality i know who he was until just now	1.0	2024-07-03 12:55:06
nAl74ZeX	473065742	well that s the crux of the racism debate is it the fundamental liberal classic or progressive ca nt disenfranchise people for accidents of is the logic underpinning everything from the civil rights act to affirmative action to dei to feminism to gay rights to were willing to give this sentiment up in some fashion for some reason we will find ourselves plunging along our current trajectory to disaster no matter what else we think about anything	1.0	2024-07-04 11:08:16
	473175397	thank you for being objective the retards in this thread have blind faith in fail safes but do realize that imperfect beings are unable to create perfect systems and with our current dei affirmative action hiring processes and demographic trends most reactors will soon be headed by shaniqua jones rajput patel and pablo gomez in which case doom is inevitable and the remaining persecuted white people will be fucked along with all the retarded shit skins	2.0	2024-07-05 10:49:35
NzbNduEs	473151982	white women have benefited the most from things like dei and affirmative action at the expense of white men specifically not anyone else	0.0	2024-07-05 05:27:29
Cp80w	473251684	yes kike we do want them to be educated in anerian schools or american from affirmative action and now dei diversity hiring they have destroyed american white educational school system destroyed american colledge universities as they ca nt learn due to tiny brain but they are required by unis to be taken on free ride ca nt not take niggers due to aa and dei and have to flush them by 2nd are now massively destroying us gov institutions where they have gotten their hands on niggers are destroying science niggers are destroying corporations where they have been mass hired due to aa and deithats just besides them running illegal drugs	1.0	2024-07-06 06:56:27
1bD0Aa3W	473322421	yet they conveniently ignore the fact that they benefit from the amerikkkan system white people set up which awards people just for being from 1950dei affirmative action minority quotas and set asides the only systemic racism in the us today is anti white	0.0	2024-07-06 23:40:22
6A3zg9wq	473507795	everything stacked in your favorlmao unlimited immigration dei and affirmative action is really helping poor whites eh	5.0	2024-07-08 18:49:42
	473510775	white women are the biggest beneficiaries of affirmative action	2.0	2024-07-08 19:35:08
6kYujsy9	473600067	just white women things white men are actively being discriminated against in hiring but white women are not white women benefit the most from affirmative action and dei they go on to our earn you and fuck broke niggers in front of your face hope that belps	0.0	2024-07-09 17:02:51
fFaInX7k	473522768	what did dei replace affirmative action	1.0	2024-07-08 23:23:44
RULrwZJi	473801164	he had a shot like perot did until he went full retard on being pro nigger pro affirmative action pro dei and then pro israel	2.0	2024-07-11 17:44:15
s4J	473776675	blue haired retards have no political power without their pet has always been mentally unstable retards they never had migrants that tripled their perceived vote share they never had affirmative action and dei to remove the sane competent white men before this this whole thing a slow coup we are in collapse phase	0.0	2024-07-11 14:03:34
ppkjXPfN	473757726	affirmative action be le white evil man apply for job rejected second application change name from hunter davidson to laquan jackson get a job interviewdei contracting be le white evil man become transgender get lucrative govt contract directly without any competition	1.0	2024-07-11 10:07:52
yY30eBJX	473856834	only black elites who have benefitted from dei in white collared jobs fear project 2025 since it rolls back affirmative action and dei policies put in place by biden	0.0	2024-07-12 08:59:24
	473856364	the only time heard project 2025 mentioned was after the debate when a black lobbyist named bakari sellers was pushing it as a thing we need to stop because roll back affirmative action and dei go figure	0.0	2024-07-12 08:54:22
T6JLyfuI	473836084	they re not its revisionist history to make blacks more significantmusic history was the first victim of affirmative action i m not gon na call it black musicians who had relatively smaller presence in music history get to be put up on a higher pedestal because they were black	0.0	2024-07-12 03:57:04
X7ncbIar	473948655	this is the reality women are the gatekeepers and get to decide the gene pool going you ca nt cut it then feel free to clock out at any in an artificial economy women get dei preferential treatment at jobs and government gibs womens wealth and status is artificially raised at the expense of men so average women are under the illusion that they re too good for the average man and they do need men if we got rid of all the affirmative action bullshit and gibs women would quickly realize they do in fact need men and average men will suddenly look more appealing	1.0	2024-07-13 08:55:56
	474217368	nah you first know it so sad what you do to others but i think the worst of all is what you done to real african americans you call them uncle toms and whiteys when they the ones who managed to win your freedom rights and now all these dei and affirmative action benefits that you animals never this is how you thanked never deserved a single thing ever nor will you get another hand out or we even be able to keep all that you ill accrued no amount of clawing lying and will preserve it all you had was nothing but a glimmer of your ambitions and just like glimmers are fleeting so is all yours and you	0.0	2024-07-14 19:34:32
	474149672	dei tds affirmative action incompetence crisis shit like this its the perfect storm of retarded bullshit only in clown world	1.0	2024-07-14 10:51:00
vxYNpoLC	474117492	dei affirmative action that s women assigned to trump they ca nt guard his body because he s way taller than them	0.0	2024-07-14 07:00:26
	474085741	what if the normies are right and the white genocide thing is a conspiracy 80 years of full spectrum jewish propaganda was assume both i capitalize the word like both know for sure if we were in the middle of a do know for sure look at the demographics over time you have to be on some serious doublethink to discard that there is also a myriad of double standards affirmative action dei hiring practices intentionally demoralizing messaging in tv movies advertisements and videogames and finally you are not allowed to talk about this shit or you lose your job and maybe even your bank account	0.0	2024-07-14 01:53:47
9BOwc	474352815	white privilege affirmative action dei blm feminismall conservative movements right	3.0	2024-07-15 17:32:26
9BOwc	474354399	swedetake count of the foreign flags shilling appointed judges that took the first swing at affirmative action its something	1.0	2024-07-15 17:45:04
	474344447	articulate and brutal comment on the state of dei affirmative action feminism in the west	1.0	2024-07-15 16:25:38
4Br4hpuB	474356177	you were never looking for anyone to convince you attempt on assassination is just another boring tale of imbecile on imbecile action a retard tried to shoot drumpbf missed and the ss was counting potatoes like they do nowadays due to affirmative action devolving from sloppy job mossad to just sloppy job i still laugh when i remember the day the us military shot a friendly heli i think it was either british or the the iraqi war if i remember correctly in fact the us has a long list of it	0.0	2024-07-15 17:58:59
t4E	474284450	the bs jobs phenomenon is because mental labor exists its because of esg dei affirmative action critical race theory eeoc etc everything that purposely destroys meritocracy in the interest of promoting egalitarianism	1.0	2024-07-15 09:00:58
eD5jYxva	474266161	because they are being forcibly inserted into positions they did organically attain you ca nt have dei affirmative action initiatives splattered everywhere then not have questions when your products show up and start fucking up is another big issue women do handle criticism well the way men improve is iron sharpening iron constant judgement and criticism competition leading to self improvement and higher quality women on the other hand try to maintain these delusionally non critical working environments where no one is ever aware of their faults or shortcomings and nothing improves its a horrible dynamic for anything other than a daycare	1.0	2024-07-15 05:56:06
	474497474	the dei faggots already said they are just going to rebrand as something else when trump gets inthis is the same smokescreen they used with affirmative action in ivy leagues they do have to use merit for admissions so they will just circumvent the affirmative action ban by admitting blacks and others with different justificationsagain there is no actual recognition of whites as an interest group with separate interests from americans in the abstractmeanwhile you have trump bragging about black unemployment and dumping billions into capital investment specifically for blacks via the platinum planno republican will ever say anything remotely like that about whites	0.0	2024-07-16 18:38:55
gyTMyXx0	474496140	white women are the greatest beneficiaries of affirmative action and dei	1.0	2024-07-16 18:27:23
WGyJn3QY	474490408	say that affirmative action is government mandated while dei is market mandated	0.0	2024-07-16 17:34:40
	474490665	what s the difference between dei and affirmative action was to allow those who were actually discriminated against an opportunity to the job they were is the idea that jobs should go to people based on their gender race and sexual orientation not on their merit	2.0	2024-07-16 17:37:06
9q8D962q	474490731	affirmative action was to allow those who were actually discriminated against an opportunity to the job they were	0.0	2024-07-16 17:37:42
	474490988	affirmative action is the reason i use racism to select my asian doctors	0.0	2024-07-16 17:39:56
3H58z	474469470	equal opportunity affirmative action esg dei bridgewhen one shibboleth makes a bad name for itself they move on to shareblue actbluethey also tend towards the verbose and ridiculously meaninglessly abstract negro black african american person of color	1.0	2024-07-16 14:28:44
rPhb3akt	474457934	affirmative action was originally started as a temporary remedy to address past discrimination against black predictably like all government handout programs it became permanent and everyone wanted a spot at the no amount of discrimination could erase the massive ability gap between whites and pox men and now we have this esg dei hate whitey official attitude and a growing competency no not exactly a humiliation ritual just the intersection of government grifing and cultural marxism	0.0	2024-07-16 12:47:15
ihXE22LQ	474388442	rfk was viewed by the media like trump was viewed in 2015 they thought he was a joke or a spoiler then when he started resonating people by speaking over the target aside from his love of israel and niggers and dei affirmative action they blackballed him just like what the left did to bernie once independents and even republicans started agreeing with him bernie wanted to break up big pharma wanted to stop corporate loopholes and corporate inversions and offshoring wanted to break up is for a lot of things i do like but so is trump and trump is now blatantly compromised by the cia and mossad on top of all it at least rfk cares about the health of people and has spoken out against the horrors of the pharmaceutical industry the environment how pollution is harmful to human health etc rfk actually gives a fuck about things that directly affect our under trump environmental regulations and fda regulations were scrapped so our environment got shittier and our food quality went down that affects us all directly on the short term fuck that	1.0	2024-07-15 23:18:23
RO2fOMIk	474384481	the country moved more right under trump you have people openly attacking dei affirmative action initiatives serious talks about dismantling the administrative state no new wars deregulation but you faggots only single in on israel this israel that its either i pick the guy who will slow the rate of decay of america and attempt to bring in some semblance of order or i vote for the radicals hellbent on destroying america outright	3.0	2024-07-15 22:23:54
UzO97zL5	474583697	this is some of the starkest evidence we ve ever had regarding the potential danger of dei affirmative action we got to see the female agents on the ground look like inept idiots and nearly get him killed and we get to see the female director look like a smug inept idiot and perhaps most importantly take no accountability for something she is directly accountable for if she were trumps director of ss she would have been fired on sunday were she a man with any dignity or sense of accountability she would have resigned on monday instead she s a smug retarded woman that does belong there and she s going to continue smugly insisting she had nothing to do with direct organizational and operational breakdown	0.0	2024-07-17 11:37:13
HhJ	474572444	so you agree there is no need for affirmative action or dei	1.0	2024-07-17 09:53:27
aSQ4k	474553890	also seen them cite the scotus affirmative action decision but then right after that it came out that since covid the race of new hires in the us has been 94 non white and 6 white if they were making concessions you would never hear the part about almost every single new job going to a shitskin	1.0	2024-07-17 06:44:15
e4nS	474553731	i mean affirmative action was recently banned by colleges they are definitely doing something and it was becoming obvious before the post was made	2.0	2024-07-17 06:42:22
Kt	474736698	the paradigm shift is happening before your eyes porn being banned abortion banned affirmative action banned dei getting dropped by corporations trump surviving an assassination by what can only be described as luck of god moass bringing about the financial revolution and reversing all the purchasing power fiat leaches at the federal reserve have stolen for the last 100 years	1.0	2024-07-18 14:52:38
fEpMGll5	474689980	why is amy schumer working for the secret women jewish women are the biggest beneficiaries of affirmative action and dei	0.0	2024-07-18 07:28:49
3Ow3CIak	474663349	also what does it say abot mention of race is they really want to ban any form of affirmative action or dei it literally says dei satanic being said they want border control to be able to shoot and kill anyone that illegally tries to cross the border and calling for mass deportation and end of birthright citizenship unless at least one parent is american they consider anyone who attempts to illegally cross the border an invader and therefore an enemy combatant under international law	0.0	2024-07-18 01:04:57
bMWfwPRW	474656720	shanahan is pretty cool too slept her way upward in the world but is an anti vaxer even does nt like too much electromagnetic radiation etc and she is pro environment reducing pollution and reducing contaminants and trash in our food you want a real reason why people are nt into rfk here its because its anti gun pro dei affirmative action and is pro israel but he s still relatively against the deep state and against current ticket especially with vance is worse on all of those issues except for being anti gun vance is palantir trump pence is more pro israeli than rfkjr and they are pro war trumps last time in office also repealed tons of environmental and food regulations while pushing vaccines fuck that shit yes trump has changed his stance on vaccines however fwiw i think rfk is less anti gun these days	1.0	2024-07-17 23:24:18
	474652846	diversity equity and inclusion dei is the incorporation of critical theory race theory gender theory queer theory into hiring practices it replaces the typical affirmative action eeoc system of quotas with flagrant anti white anti male discrimination	2.0	2024-07-17 22:31:19
u94V	474653881	it replaces the typical affirmative action eeoc system of quotas with flagrant anti white anti male affirmative action is already flagrant anti white anti male discrimination	2.0	2024-07-17 22:45:16
	474655639	true but even under affirmative action you could still hire whites dei is no whites need apply with the exception of lgbtq	0.0	2024-07-17 23:09:42
p5UfYEeP	474906722	retake the ivyleaguesdei in education makes that impossible although the ussc is doing their best by outlawing affirmative action quotas	0.0	2024-07-19 19:56:22
hpZcbrmk	474894773	what enrages me is how they come from the most overpopulated countries in the world to ours where they can hop on the minorities bandwagon and benefit from dei initiatives the only reason they bitch about college admissions is because one of the few places treated like white males so not actually upset about affirmative action per se upset that not benefitting from it	0.0	2024-07-19 17:39:44
	474869714	drumphites better get ready for a stomping this novembertrump voter here who is registered democrat for primary funsies saying i support kamala because make them more confident in running a failed candidate i want the symbolism it provides in that it will truly encapsulate the end of the current says new age more than an american success story where a winner falls from grace yet still rises through all hardship just to curbstomp some stupid uppity dei hire nigress mercilessly for leadership remember kamala chosen because she was second best or anything she was chosen because she was a black female that even outshine joe fucking biden she is quite literally in that position for biden to say he racist and for ideological nitwits salivating over i need an exotic person in this role now to vote about to get a spectacle of all the miracles of why diversity quotas and affirmative action are complete failures of ideas	1.0	2024-07-19 13:21:48
PmlAEAMH	474866571	that dei took such a strong hold in the corporate world because geriatric white men wanted it to is a jewish invention building off earlier esg and crt jewery which builds off earlier affirmative action jewery etc etc	1.0	2024-07-19 12:50:58
veiMIzWn	474856268	when the tech elites start praising trumpnature is healing the tech industry is naturally libertarian leaning but was forced to take in tens of thousands of affirmative action dei hires in the aftermath of the fentanyl floyd saga	0.0	2024-07-19 11:09:54
3D	475020051	republicans should just literally become the party of degeneracy there is an obvious switch occurring where the democrats are conservative and the kikes homosexual republicans are becoming degenerate the problem is the boomers have no clue wtf is going on and they just blindly follow it thinking its the same as it was 50 60 years your meds you really think republicans are behind affirmative action and dei diversity equity and inclusion programs	2.0	2024-07-20 19:57:40
SWMIlRPU	474955398	this fucking beans are actually stealing jobs and sick of virtue signaling leftoids saying well at least working while in reality dei affirmative action gets them hired ahead of native whites in all sectors they work with stolen ssids or under the table they work straight up illegally see unlicensed food carts in nyc or the lime sellers that hold up traffic down here in majority of the money they make is sent in remittances so it even benefit the local economy	0.0	2024-07-20 08:28:22
u	475157393	rfk supports affirmative actionor rather the scripted character of rfk supports affirmative action in the tv show you call washington dcin fact he wants to double down on it you want more dei how many fucking planes have to fall out of the sky before you realize that s a bad the supreme court banning affirmative action in higher ed i know many americans feel that purely race based decisions are unfair kennedy tweeted however this feeling misses important context the effects of racist policies going back centuries are now self perpetuating action understands this and uses race based policies to undo the effects of racist policies he said that	3.0	2024-07-21 20:58:40
ueqWWtcK	475157779	the man is an old school democrat and when affirmative action was made it did have its place you had a massive poor black population with no real way to escape poverty what you have today is explicit discrimination against whites at nearly every level rather than a small helping hand for blacks we functioned just fine with affirmative action for decades it was not until the woke mafia came in and started outright rejecting white candidates by virtue of being white that a problem presented that he supports dei shit faggot	2.0	2024-07-21 21:03:16
KYh64goo	475158043	its very simple affirmative action was doing what dei is doing just the damage had accumulated enough to reach critical mass if you were to eliminate all the diversity hires and then scale back dei to just 90s affirmative action then we d just be back to where we are now in another 30 years	1.0	2024-07-21 21:06:19
ueqWWtcK	475158769	be reasonable for a second and think about what is best for the country and pretend that we are good faith have a large population of people who are stuck in poverty committing crime doing drugs and stuck in a cycle it is not good for the nation that anybody be in poverty both from a productivity and moral standpoint they will not get out of this cycle on their own so there has to be some kind of support for them this is the mentality behind affirmative action the dei system of today boldly rejects whites at nearly every turn it deprioritizes them in the workplace education system and forces them to humiliate themselves you say we will be right back to where we are now in 30 years but what if we what if we learn from am not woo woo affirmative action but it does in some ways make sense and you did not see this open discrimination against whites in the 90s for better or worse blacks are americans and a part of the population democrats today with their system have deliberately kept them in ghettos chasing their tails and blamed white supremacy the point is that he is not an anti white and that is a fact he has been the only candidate to even acknowledge white people that is worth something	2.0	2024-07-21 21:14:49
HRW5PtNU	475159129	when you consider the fact that harris is a wine mom who fucked her way into office and trump is under zionist control affirmative action is a relatively small hill to die on rfk has already proven that he s the best option aa or not besides aa was already declared unconstitutional by the supreme court so its not like hell do shit with it	1.0	2024-07-21 21:18:49
	475107990	why does hookup culture keep getting pushed more and more despite it being so degenerate and destructive for those that partake in profit and stock value for tinder bumble hinge etc as well as a host of other problem with early and durable monogamy is that it does produce as much profit as people dating dating means restaurants and days out while paying individual expenses utilities consumerism etc monogamy means shared bills shared utilities lower consumerism worst part about monogamy is that men get to exert an influence on household expenses which always reduces them men generally want to clamp down on spending while women want to spend even when monogamy was the law of the land women did the bulk of the spending getting women away from men and putting more money in their hands via affirmative action now known as dei means more spending which means more gdp and more taxes and more profit and higher stock value which are really the important things in our society	6.0	2024-07-21 13:53:56
QQp8yfA	475101699	dismantling pollution regsmaking industry great againno more dei m affirmative action outlawedsupreme court filled with young republican justices	0.0	2024-07-21 13:11:01
zKsSoEyC	475098479	she would have to promise to defund israel and ukraine promise to kill esg dei promise to push for universal healthcare promise to seal up the borders promise to abolish affirmative action promise to have zero tolerance on crime especially black looting riots and violence promise to go after big pharmaand promise to push for universal basic income for good measureand that s just to be viable as a candidate	0.0	2024-07-21 12:50:02
