Poster_Id	ID	Text	Reply_Count	Date
ilsox3wQ	473034539	yeah the people complaining loudly on 4chan and twitter are mostly lower class and in the average canadian lives in a nice house in a mostly white area somewhat isolated alot of white people are actually making quite good money right now as long as they avoid large events like canada day parades etc they mostly avoid yeah while the issues are obvious and getting worse things are that bad yet for the average white person plus there is a shit ton of brainwashing and boomers live in another reality attitudes are changing but it wo nt be overnight	1.0	2024-07-04 04:00:58
DIInnzDb	473034867	yeah the people complaining loudly on 4chan and twitter are mostly lower class and in the the people dealing with the immigrant problem firsthandand class does translate over well because the class divide is now young and old with unmortgaged property being the class distinction the average canadian lives in a nice house in a mostly white area somewhat has been true for a generationif you remove housing equity from the equation the amount of actual millionaires in canada drops off a cliff toronto actually has 20 fewer millionaires than a blown out shithole like chicago and vancouver has only 15 of the millionaires chicago doesthis country is much much poorer than it seems to be for all races alot of white people are actually making quite good money right what we have no white collar industries because we are uncompetitive tradies who actually get an apprenticeship are doing decently but that s because the market is gatekept and its entirely dependent on boomers borrowing against their equity to spend frivolously	0.0	2024-07-04 04:06:48
miYsR	473018945	carnival is likely plagued by the same short sightedness of many other publicly traded make more money now that all they care about covid wrecked their earnings and they been desperately posting deep discounts implementing payment installment anything to fill those boats boomers are dying out and the new middle class is becoming more black and female by the day carnival is thinking about the customers so much so that they are thinking about the future of their company in fact they might be thinking with the gutting of the middle class and the dying off of the boomers that they have no real future at all as a discount cruise service regardless of their thinking the end result is an increasingly bad vacation experience which at this rate will result in the kind of customer they should be catering to avoiding them altogether	0.0	2024-07-03 22:57:05
HASixWW8	473017666	they claim this endless immigration for all western countries is a requirement of capitalism depending on who you speak to people will talk about requiring the population to fill in for retiring baby boomers or needing more population to service the excessive debt loads that all the countries of the west have truth is this is only for the destruction of the countries our rulers who control government and the money casino have openly said they feel more comfortable in a mixed society for some reason they fear hate the white man but have no fear of black and brown men there is a thinking that whites could mobilize against the rulers but black and brown will be content to be ruled if whites ever did rise up against the rulers the blacks and browns would collectively gang tackle them this is the reason for the demonization of whites for the last 5 10 have a few more years down towards toronto but have land purchased north and will flee to be with my people when things get too spicy down south	6.0	2024-07-03 22:32:15
FAlW7tI9	473036101	checked requiring the population to fill in for retiring baby boomerthe worst justification of all frequently made in the context of japan is needing immigrants to work as the servants of retired boomers	0.0	2024-07-04 04:29:06
ZoxSl6Tl	473228976	american boomers will see these stupid memes and actually eat it up lolflat earth was a big hit with them	1.0	2024-07-05 23:36:33
5QGDE0rz	473410811	kike detected and then everyone started to clapi left out all the bs about dei and fag shit otherwise you might have believed me when are you joining them changi just might go over there and get a job running cnc have to learn mandarin though white btw what do you do for worki run cnc machines now the boomers all got to run one machine back in the 80s and got paid fifty bucks an hour back then millennials are lucky to get thirty five an hour to run five machines and 10x as many parts and they have a greater depth of programming and qc knowledge then any 80s boomer machinist ever needed to know	2.0	2024-07-07 20:36:22
	473419637	its getting more common to hold and use crypto as payment it ll take time but we will get there especially once the boomers die we had an actual nazi government that destroyed jewish banking i would be as interested in crypto tho remittances and inflation are a bitch atm	2.0	2024-07-07 23:07:37
XNbvU5yo	473424845	nazi flag let me explain getting more common to hold and use crypto as payment it ll take time but we will get there especially once the boomers die will take out western union that s all it will do in the near we had an actual nazi government that destroyed jewish banking i would be as interested in crypto tho remittances and inflation are a bitch the fedyes end the judenbake was a thing in 2012 you re late	0.0	2024-07-08 00:41:34
yKhPG	473563491	just use your precious only time on this gay earth to attempt to fix some boomers badly raised and heavily vaccinated daughterdude literally rather play starcraft eat my ass and balls nigger kill yourself	0.0	2024-07-09 09:58:09
	473540205	ca nt buy a home anywhere areas with affordable homes have no jobs every business is out there trying to cut back on workers tech trades etc have become 16month contractor jobs cost of living is sky rocketing jobs are still hiring retards to fill in dei quotas dating is impossible in most areas men are finding they can just barely survive doing side work for people and never report it to the government also finding ways to rip off boomers go back to work lonely underpaid men	2.0	2024-07-09 05:12:10
p2YedFXk	473540061	lead really did the boomers in	2.0	2024-07-09 05:09:35
lKkDuaE4	473543504	it really did that combined with big pharma combined with alcohol combined with big agriculture combined with a materialist culture it destroyed that generation and they act as if we crazy because we do want to follow their footsteps it either the path of the gods or the path of the ancestors the boomers betrayed the path of the gods and expect us to do the same nope i taking the path of the gods	0.0	2024-07-09 06:05:41
x3yFigwv	473653610	i do think continual growth is good either the lefties say b b but we need immigration because our population will decline while also pretending to care about carbon footprints and pollution or they say we need more people because who will take care of the boomers without realizing well in a generation or two we have to ramp up immigration again to take care of the people from the recent population a never ending cycle of growth for the sake of growth and unfortunately the expanding demographics are from shit countries we also have a big social safety net that requires tax dollars so bringing in refugees and menial workers will just drain resources not to mention actual canadians will have poorer access to medicine education etc because of all the browns in the queue who will never be net contributors	3.0	2024-07-10 08:34:20
br8gRqU	473794963	well with boomers dying and the middle class being raped to death you are going to see white guilt dry the fuck up in the not so distant futurepeople care about this shit because they can afford it and that all goes out the window when things get tuff	0.0	2024-07-11 16:57:11
DVkoEM48	473765682	the american government prints money then gives it to a jewish bank who then loans it to the american government the federal debt is essentially how much money is in circulation its owed to a small group of jews because they tricked proto boomers into signing away the ability to manage the nations finances under the premise that if bankers run the countrys check book then the country will never have inflation deflation or bank jews proceeeded to intentionally cause periods of inflation recession and bank runs but never got fired fined or penalized for what was essentially the nations first dei usa government pays jews to count their own money and they pay them the entire amount they count	0.0	2024-07-11 11:48:18
AYwnwMu5	473752350	we should be entitled to a free acre of land for every white american yes investment real estate should be banned immigrants and foreigners should be barred from dei home loans boomers should be only allowed 2 properties	2.0	2024-07-11 09:02:38
lJ2HgjXf	473892905	feds are all leftist homosexual faggot millennials that butt fuck each other up the ass with their black dildos while eating each other shit and dei hires these days they cowards and inept they could even take on a semi organized hick like ammon bundy with his group of armed can only kill old decrepit and dementia ridden boomers who spout off about biden on facebook by blindsiding two bit nigger thugs in dc regularly humiliate fbi agents and steal their cars and punk the faggots lmaoonce juice are dealt with fedfaggots will scatter and abandon their causeus military will be too busy getting killed off by chinese and russian military since all the generals are trannies or niggers now	0.0	2024-07-12 16:29:22
Pu9wij	473858967	the idea is less that kamala dei but more importantly she fits in by being not fucking old and able to articulate and mingle with the other leaders around her age if it were a younger white guy like beshear from kentucky also be pushed heavier if he were vp because of the fact that younger sharper and able to work with people around his age and older a figurative torch passing and refusal to do it and his admission to refusal multiple times is a problem and just goes to the idea that boomers and older refuse to move forward even if it means everything around them is destroyed as a result of their stubbornness to keep things the same when that work anymore	0.0	2024-07-12 09:23:59
j2qKInIW	473816820	the problem with a strategy like this is that whites are still something like 90 of the canadian tell me you have been to canada in a are everywhere now we are mayybe 60 70 white and a large portion of that are boomers about to croak under 40 its probably at least 70 one thing is true is that they all live in the cities whites own the countryside and the cities rely on very fragile infrastructure if you were to shut down essential services to a large city during the winter you would potentially kill hundreds of saying hypothetically in minecraft	0.0	2024-07-11 21:22:00
aX8d5dtw	473975601	you can see how they realized their mistake in the new ads full of white men willing to give their lives for was no longer the virtue signaling woke bullshit anymore the kikes realized that they needed the skilled patriotic conservatives again who would willingly risk their lives and safety to defend the usaexactly but its too late for that boomers zionists and associates can give their lives for israel if they need meat to be sacrificed let the jews send their own sons to fight the war no non jew of any origin has any part in that war	0.0	2024-07-13 14:57:01
B5g82ip3	473946401	i wish there was a good systems but all systems are subject to abuse social libertarianism already existed but it had been perverted and misconstrued by anti communist and anti nazi boomers anti communism is good but it got overplayed for a while and misuses should be directly involved but it should encourage people to spend on companies that support the social causes they want sorta similar to how things are now but without any govt intervention no govt pushing dei and your favorite companies going along and doing additional dei and then your money going to the bullshit dei campaign lassies faire with less mega corps	0.0	2024-07-13 08:24:39
niPrhpir	474225365	what for all the loser millennials gen z jobs corp if lucky iran if not equality achieved learn spanishus and dollar and hyperinflates gold repriced and debt gdp ratio drops to 80 down from 130 wages go and other markets drop after fed cuts rates emerging markets re industrializes learn a skill those military aged men let in across the border get drafted for citizenship just like starship and esg fall off nuclear is the new thing deadbeat welfare moms get the boot because the us is cuts social security and medicare medicaid do nt worry both were insolvent anyways boomers start dropping en masse due to unknown reasons definitely not related to the us currency is tokenized if you suck you lose purchasing power even if you spend nothing read that bible section about the parable of the talents sadly people seek above a ubi is instated but its for the poors initially after beta test is seems ok and expands can you serve saturn god fellow man if not sucks to be you will the slimey politicians tighten their own sides with brics if poland ukraine israel ca nt contain russia what s turkey still about oil even though nuclear grows like mad to supply ai data centers	1.0	2024-07-14 20:54:18
y9JBbAfA	474298265	team comprises of 6 shitskins and 2 whites shitskins get paid the same as you because dei laws shitskins always coming in late and really do not do any work boomers on say you need to be 100 because you re white and jew owners depend on ityeah no thanks never work harder than your average employee you will not get a raise from it and you will be given more workload	0.0	2024-07-15 10:53:10
	474321588	trump worlds most vengeful mangod you boomers are truly pathetic day of the pillow soon	0.0	2024-07-15 13:31:57
	474396753	no point in asking boomers or females who will not be anon everyone vote	2.0	2024-07-16 01:31:06
XGvp4jb	474387873	1 the glowies are out of touch boomers and deis they are truly clueless about how to run a good propaganda campaign they heard the hacker known as 4chan is into conspiracies and they think we will just run with the first conspiracy we hear they literally have no idea how truth and reasoning they did it they obviously did it and they are trying to slide the board to prevent information about their crimes spreading	0.0	2024-07-15 23:10:09
	474577084	nobody watches the rnc so i do think it ll make a difference we ve known that the republicans have been pozzed for awhile but i admit this actually was pretty bad i do really give a shit though its all just a bullshit show a bunch of out of touch boomers thought would broaden the parties appeal	2.0	2024-07-17 10:35:38
e4nS	474555897	college degrees are worthless now and white men can barely find jobs at all anyway with all the spics flooding in and boomers refusing to die	1.0	2024-07-17 07:07:32
TLFgxlhN	474554730	will they trump second term is shaping up to be entirely toothless in terms of his appeal to white men a full dei rnc walking back promises to reduce h1bs recruiting a vp with a poojeeta wife who is already saber rattling with iran sorry i do see any white men besides boomers being happy in this situation	0.0	2024-07-17 06:54:11
	474546333	i think trumps too much of a bitch to cut himself as demons do not like likely a blood capsule or packet as he is trained an actor and wrestling whole thing was a poorly executeded with trump telling his dei ss to hold on for his photo op as if ss would ever do that incase there s a second asf but boomers still eat it sure why globohomo even does this anymore just fucking pull the plug already	1.0	2024-07-17 05:06:10
zr7OayPO	474525599	white women are the real enemy the white women voted for open borders feminism etc the jews only were enabled by white women and boomers	2.0	2024-07-16 23:34:25
jcpHNaTV	474709008	4 with ethnic and gender quotas the white male boomers who refuse to retire are taking up space that would otherwise go to young mennone of this shit really matters in the end the us economy ca nt unfuck dei because ultimately dei is just the full expression of the civil rights act of 1964 and its going to destroy every single company of national importance	1.0	2024-07-18 10:35:52
0KNFyAA4	474706919	if you are a white man you will not get a high status high paying white collar job because of the jewish dei hiring practices the meta for white men is to learn a trade and start your own business shitskins have a bad reputation for doing garbage work and i get tons of boomers asking if my business is white or pajeet before hiring me	0.0	2024-07-18 10:15:20
ugHfyCXI	474701873	boomers passed dei laws so they could work with young girls all daymakes you think	2.0	2024-07-18 09:27:48
80ZivnfM	474702242	boomers are worse than kikes	3.0	2024-07-18 09:31:21
nTKpAYkU	474718990	boomers are kikes	0.0	2024-07-18 12:08:10
	474684866	hey the dei hires are at least trying if they were boomers they would be spamming gorges dam seems to be doing well if it us putting up with such a high vollume are the chinese seeding clouds or is someone down stream of them seeding clouds and saying its climate change	0.0	2024-07-18 06:28:38
aLkc3yj2	474670361	when everyone is poorer than ever is completely meaninglessit all depends on who you are there are some groups that are doing very well from our new world order dei hires in civil service jobs for one any woman or immigrant who works in the health care sector boomers in general wagies in a small number of niche sectors so it all depends in communist china they refer to the state sector jobs as a golden bowl in reference to the magic bowl of rice that never empties as we morph into a state led communist dystopia jobs in the government that includes rnhs will naturally become the benefactors of everyone elses suffering its to be expected	1.0	2024-07-18 03:03:11
	474669838	i just know this post will send the miga cultists boomers with eyeglasses into a hellish fury when they read it lmao lol	0.0	2024-07-18 02:54:34
T9otwpxo	474657141	as someone who actually steps outside his house everyday most zoomers can be turned into a fighting force even if an ineffectual one and yeah it would increase societal breakdown what were seeing now is the system in freefall and they re grasping at whatever tree limbs that they can zoomers do have guns either the firearm ownership in this country is mostly boomers or genxers who wo nt be drafted and largely are too selfish to protect the zoomers in their life they d probably help the draft officers	1.0	2024-07-17 23:30:14
0CXgNLEj	474887010	i hate using the term because overused and the original article was written by one of those no one wants to work anymore boomers but this is just a checkpoint along the trail of decline known as the competency crisis dei hires and mass outsourcing of labor to retard is the inflection point covid gave them the excuse to fire who they wanted and the remote revolution made it easier to outsource more jobs to shitholes like india they see all these companies as no longer capable of growth and they are reaping them all through these profit driven practices they are squirreling away all these resources for the long winter to come they will be despots in a spoiled world just as their book demands	1.0	2024-07-19 16:15:58
	474841870	its quite fucking hard when most common breach is caused by dei hires women and boomers literally open the fucking doors for those drop outs	0.0	2024-07-19 08:47:43
u15	474812003	boomers and diversity hires are about to get the world they fucks given	0.0	2024-07-19 02:34:12
3D	475020051	republicans should just literally become the party of degeneracy there is an obvious switch occurring where the democrats are conservative and the kikes homosexual republicans are becoming degenerate the problem is the boomers have no clue wtf is going on and they just blindly follow it thinking its the same as it was 50 60 years your meds you really think republicans are behind affirmative action and dei diversity equity and inclusion programs	2.0	2024-07-20 19:57:40
6wircrVe	475152091	i heard similar stories from other laid off white production staff alot of ex movie crew guys teamsters included hang around my place and tell me stories one of my customers told me how he got fired from a production with jamie foxx because he and his crew were too white but the worst is the lack of solidarity from the old white boomers they absolutely do not give a shit as long as they get theirs worse is the boomers actively snitch on younger white guys to get them fired boomers are absolute fucking boot lickers they actively want to be abused by whoevers in charge because like women spics and niggers boomers think that abuse of power equates to being strong with that power boomers want someone to hassle and harass and the only people they can do so without any blowback are fellow white guys i experienced it firsthand before when i used to work for citibank in the city itself	2.0	2024-07-21 20:02:27
mmSvbNFH	475165973	boomer lack of solidarityi ca nt stress this enough as an accountant trying to get a cpa all the white owned cpa offices are like 1 boomer and his 9 women boomers literally destroyed society so they could flirt with what would be your wife when someone tells me how hard some boomer who lost his business has it i have no sympathy because you look a little deeper and the faggot was only hiring women until they fucked things up too hard and it went under they are the worst scumbag generation in history and the best part is that they ll still scream its d c when they ve cucked you out of a life so they could keep partying into their 70s	0.0	2024-07-21 22:40:52
	475169491	zoomers will sell you out just as quick as boomers at least boomers usually get something out of it they sell you out for a raise or so they can hire women and flirt with them zoomers will ruin your life because you said mean words that offends their ideological beliefs	0.0	2024-07-21 23:33:23
	475413279	i do believe the same conditions that led to the collapse of the soviet union are starting to form in the us just manifesting in us have a much stronger and more stable oligarchy though so infighting is likely to take it down the way the soviet union came dei type policies have created a crisis of competency which is eating away our social underpinnings like termites we wo nt realize it until its truly too late have decided to hoover up every bit of wealth they can leverage it 100x and die at the top of a gilded mountain after pulling up all the trusts the government and rightly so because the government has been mismanaged into a playground for capital and actual literal psychopath generation in the middle of their productive peak millennials are still struggling and thus the largest source of manpower and motivation is giving upthe generations coming behind them are going to have it even worse and are going to implode as bad if not far worse gen z is functionally retarded vs previous generations and boomers have fucking brain damage from lead so that says biggest companies are treating the economy like a slush fund and labor as slaves which is creating a dozen different crises at every level of daily in america is gone there s no hope for housing no hope for jobs no hope for a future were all just holding on until next week then next just got ta make it through the even worse than the end of history its the long misery the eyes are not herethere are no eyes herein this valley of dying starsin this hollow valleythis broken jaw of our lost kingdomsin this last of meeting placeswe grope togetherand avoid speechgathered on this beach of this tumid riversightless unlessthe eyes reappearas the perpetual starmultifoliate roseof deaths twilight kingdomthe hope onlyof empty men	0.0	2024-07-23 17:44:08
voIWtyDo	475402063	things have been slipping for a good a ridiculous permissiveness out there in the professional world got thick boomers in charge by the sole virtue of the people who used to be in charge being too old now and so it was the turn of the greedier boomers who wanted power as opposed to the hippie slacker boomers that never took anything too seriously but will have a far more comfortable retirement than millennials or zoomers who worked twice as hard as problem is all these boomers want to be considered the good guy so the permissiveness never ends the way they bend over backwards to accommodate bames that can barely speak english but know how to play the victim are the people who are prepared to pay real money to dei jobs and not just dei jobs nor is it just money all manner of absolutely irrelevant email jobs given to idiots always women or bames even in the fucking private sector where supposed to actually be making money and then when the normies see the obvious favouritism they think well she does nothing so an idiot if i give a fuck about my job and yet that same lazy normie will have the union in and at your throat if they feel someone said something mean about their work not saying day of the pillow but i am saying we need to pack all of these boomers off to their comfy holiday homes full time as soon as possible while anything left to yes even the people who set out to poison everyone else are themselves being poisoned by it tards like kuenssberg and marianna have managed to maneuver themselves in to a position where some thick boomer who should be finding a smarter hatchetman want this girl to be upset with him they fall so far short of the likes of william f buckley who did a great job of impersonating a reactionary despite being a commie that just depressing but they get the job anyway	0.0	2024-07-23 16:03:20
