Poster_Id	ID	Text	Reply_Count	Date
	398946963	 missed exit 3   blm  22blm has no plan whatsoever for fixing the wealth gap  land ownership  or public stakes in businesses  it ’s primarily concerned with openly anti  empirical police and educational policies  which dramatically fail every time they ’re implemented  conveniently  blm is also strictly opposed to objective measurement and accountability  a sensible orientation that may allow it to endure for a year or two more than it would otherwise  critical race theory is fundamentally a faith  based doctrine  facts do n’t matter  only spiritual virtue  admissions of guilt  and celebrations of the word  unsurprisingly  the old atheist intelligentsia that castrated christianity for young millennials richard dawkins  sam harris  et al  absolutely loathe crt  presumably once people start realizing that defunding the police massively increases rape and murder rates and that abolishing standardized testing does n’t improve black literacy  there will be a backlash  from the public perspective  the best aspect of blm is a typical latin  american style “ ” ” socialism ” ” ” based on demanding a vastly expanded government bureaucracy to give welfare and handouts to an elect class of professional victims  even in this regard  it appears to have partially failed  blacks are no better off than before  blm  likely due to the extremely corrupt grifters in charge of the treasury of the organizationblm has  however  successfully increased the proportion of white  collar managers and nonproductive workers in every institution  and in this regard is a resounding triumph for the managerial elite  back in 2000  boomers used to joke  “ you ’ll never get a job with your degree in comparative african lesbian basket weaving ”  the average dei officer earns  122000  around four times more than what an average blue  collar  productive worker earns  is the joke funny now  are you laughing  	0.0	2022-10-08 18:23:25
Fs0xSdvU	399796003	 overton window has nt shifted far far away from the right  it really has nt  it does nt even seem that waythe mental gymnastics is real in this one  did nt you call me a boomer  because you surely sound like the most deranged of boomers  in fact you could be a politician  maybe were just talking past each other the whole time  but your neoliberalism is being advertised like communism for surethere is no place in mainstream media where victim  hood is nt propagandised as the most virtuous thing you can adhere to  meanwhile there is no place in mainstream media where hard work and effort to accomplish your goals is propagandised as virtuous  in fact its being propagandised as being the most toxic thing you can do  and you call that neo  liberalism  i think you re living under a rock and have nt engaged in media for that past 10 years at least  	2.0	2022-10-14 06:42:11
	401466493	 be good goy  college  grad school  get shit on frequently for being straight white male  ignore but stew angrily  get high paying job  dei department headed by literal tranny black  face constant shit tests from empowered wymen and minorities who know they have power over a whiteboi like me  fuck this  i quit  existential dread remains  find less competitive job  still pays pretty well  inflation destroying my paycheck  all media degenerate and insulting  whore roasties invade my safe space  weight room at gym   existential dread changing to deep  uncontrollable anger  ca n’t even play video games to escape the poz  even lotr is pozzed  stupid red vs blue zog circus making the boomers and libtards get all riled up again  country majority nonwhite  fucking trannies wandering the streets of my city like it ’s normal  obese tatted up lard asses waddling around every restaurant  racial sewer of mud sharks and smelly niggers and goblinosi’ve just about mcfucking had it 	3.0	2022-10-25 12:28:48
p1iOQ0CH	406203877	are n’t you assuming there are n’t elites in china that are tired of being ruled over by commie boomers who do n’t even have high school degrees  	2.0	2022-11-27 19:47:43
VPSvyqnq	411762169	 kikes  boomers turned the keys of america over to 80 iq savages who ca nt maintain even the most basic infrastructure  college educated whites and white women overwhelmingly vote for the dei  pill  it ’s duh boomers  	0.0	2023-01-11 05:27:58
zmaFCAHa	413304035	every fortune 500 company will spend millions on dei that in no way makes them more profitable  and these jews will not give up a penny even if it means helping support what they re supposedly fighting for  even if that penny is going to kids trying to be self  made who are blacklisting themselves from many jobs by  again  fighting for what the daily wire is supposedly fighting for  absolutely amazing  what s more amazing is boomers think dw in the right  	0.0	2023-01-23 07:41:36
tAnMnWbC	413715267	 sure  a newspaper that makes money is better than one that loses money  but as long as the money  losing paper gets in peoples hands and shapes their opinions it is accomplishing their main objectivenormies do n’t understand this  they have their heads so far up the ass of their 401k  that they ca n’t wrap their heads around something existing without the purpose of turning a profit  this should n’t surprise anyone  all boomers and half of gen x happily guzzle hollywood propaganda  and will tell you with a straight face that it ’s just entertainment for the sake of entertainment  	0.0	2023-01-26 09:07:52
tq3BDvS	414499813	you re off by one generation bro  but do nt let your ingroup approval seeking boomer rage stop on that account  dei efforts  boomers  oh my  	0.0	2023-02-01 14:42:56
K6Ear	415637692	 surely it had nothing to do with dei and hr kikes  commie boomers obeying whatever shit they re told 0 questions askedyea blame millennials with 4  of the wealth and even less mgmt rolespolitical respresentation  time to stop posting paco 	0.0	2023-02-10 09:41:47
xnWi	417190330	the world owes me  yes   f  fucking rightwingerslmaoexterminate boomers  	0.0	2023-02-22 07:33:50
	417182037	this result is only achieved through the mass handicaps of affirmative action  dei initiatives  demoralization  and censorship  all of which are leftist tactics   it is not a fair assessment of womens ability to outpace men by any stretch of the imagination  essentially  the country and its government has turned on young men  it is no longer representative of their interests  boomers  having thoroughly exploited the prosperous times in this country led by the very ideologies that todays media and academia would label far  right  gifted to the rest of us these mandates  perhaps so that history would pardon them and let them keep the mountain of gold that they now sit on  they made women a protected  privileged super  class of person  and with this power  they have enslaved man  and society is now visibly falling apart for it  	2.0	2023-02-22 05:59:27
4nHTY1gk	417441492	i ca nt wait til they put boomers into section ape housing  the day of the pillow draws near  	0.0	2023-02-24 04:57:26
pY5bhLs	417706277	please do steal it  its exactly what s most annoying about boomers  some young disillusioned white man is the problem they re focusing on  imagine if they showed half that fervor against mass immigration   free trade   gender dog shit  dei  and so on  unfortunately the problem solutions there are racist and sexist so the only safe group left to attack are white men  also the boomers over emphasize  hard work   the west was built by high iq children of an originally military nobility whose inherited wealth and genetics allowed them to pursure their passions  that led to art  philosophy  architecture  fucking the entire modern world  now everyone is forced by economic pressure into whatever makes the most money  imagine a world where high iq white men were nt forced into being economic mercenaries but could sit around and invent again  everything we have and work for was built by white dudes sitting around their entire lives  this is an objective fact  	0.0	2023-02-26 06:38:47
s8jqYdOh	419581187	no this is a very old communist playbook repeated in the us where the word  communist  doesnt play well  so they call it dei and suddenly boomers dont realize it s just communism so they tolerate it  	1.0	2023-03-13 16:07:22
joDhJr2V	419642238	1945  1965  boomers are born into poverty in a society devastated by war1972  nixon ends the bretton woods agreement stealing all the wealth boomers earned  boomers are the first generation to get screwed over with this freely printed debt currency boomers are ruined and have to start over from scratch70s  80s  boomers go to college  university paying full fare  they do nt benefit from tranny scholarships  dei programs  scholarships for retards  and other communities of color like future generations will  or they enter full time employment where they are guaranteed  135 per hour   205 in 2023   if they work hard  no food stamps  no tax credits  no mental health days  they work for life with no training and support  suffer 21  inflation and mortgage rates while paying up to 77  marginal federal income tax ratesdivorce epidemic ends nuclear families but boomers do nt give up like future generations do1972  2001  boomers suffer high inflation  low stock market returns and gasoline  oil and natural gas shortages and rationing  all so millenials can have it easy and not work  boomers happily suffered so future generations could have it easy and spend their days getting fat and complaining2001  economy shits the bed and has never really recovered  boomers screwed again  but boomers put their big boy pants on and saved america once again2008  the avocado toast binge has banks bankrupt and need constant bailouts to stay afloat starting with  700bn  millenials steal boomers pensions2019  millenials have orchestrated this regime of constant bailouts to keep their tranime figurines fully funded  boomers still working en masse because millenials have no skills except jerking off to sissy porn and buying trannies dirty diapers which they claim will fund their retirement2020  millenial get more stimulus spending to pay for luxury dialators2021  millenials require economic reset agenda 	3.0	2023-03-14 06:03:43
jwxx4bY8	419651879	 boomers are born into poverty in a society devastated by waryou mean boomers are the last generation to grow up in a non  fucked societyhang yourself nigger 	0.0	2023-03-14 07:54:26
	419758114	it has been   them   all along  boomers did nt do ww1 or ww2  or pass the 60s immigration and uncivil rights acts  or recognize zion  etc  but boomers were the first generation that could have stopped it  and they did nt  they took the money  the sex and the drugs that   they   pushed  and bought into the degeneracy  and then what happened  globohomo  dei  money printing  bailouts  miscegenation  constant war  lockdowns  etc  boomers are to blame  because they are the first truly complicit generation  and they turbo fuked everything  	1.0	2023-03-15 02:57:54
D7alfKbA	419758428	boomers were voting when the 1965 hart cellar act got passed  sure they were nt the majority in power since the older ones at the time were  but they absolutely participated in the decline of society  they even run up the credit of the country with shit like medicare part d to fund pharmakikes that their kids will be paying interest on  nothing more spiritually jewish than that  not that jews would do that to their kids  boomers are worse than jews really 	0.0	2023-03-15 03:02:44
	419901145	they wo nt take the day  sit down and really play out these scenarios in your headthe best thing you can do is to offer your labor to a farm for exchange of food9999  of all gun owners are larpers and middle age boomers  if there is combat  it will be militaries recruiting young people to fight and trainyoull be picking cotton to support the war  	1.0	2023-03-16 07:45:33
wlhaKSS2	420511723	1945  1965  boomers are born into poverty in a society devastated by war1972  nixon ends the bretton woods agreement stealing all the wealth boomers earned  boomers are the first generation to get screwed over with this freely printed debt currency boomers are ruined and have to start over from scratch70s  80s  boomers go to college  university paying full fare  they do nt benefit from tranny scholarships  dei programs  scholarships for retards  and other communities of color like future generations will  or they enter full time employment where they are guaranteed  135 per hour   205 in 2023   if they work hard  no food stamps  no tax credits  no mental health days  they work for life with no training and support  suffer 21  inflation and mortgage rates while paying up to 77  marginal federal income tax ratesdivorce epidemic ends nuclear families but boomers do nt give up like future generations do1972  2001  boomers suffer high inflation  low stock market returns and gasoline  oil and natural gas shortages and rationing  all so millenials can have it easy and not work  boomers happily suffered so future generations could have it easy and spend their days getting fat and complaining2001  economy shits the bed and has never really recovered  boomers screwed again  but boomers put their big boy pants on and saved america once again2008  the avocado toast binge has banks bankrupt and need constant bailouts to stay afloat starting with  700bn  millenials steal boomers pensions2019  millenials have orchestrated this regime of constant bailouts to keep their tranime figurines fully funded  boomers still working en masse because millenials have no skills except jerking off to sissy porn and buying trannies dirty diapers which they claim will fund their retirement2020  millenial get more stimulus spending to pay for luxury dialators2021  millenials troon out demand economic bailout 	1.0	2023-03-21 08:26:45
ntVB495F	420824625	not just immigration and fed reserve  companies are gaming the laws and getting government subsidies to meet dei quotas and employ useless makebusy work bitches  that and boomers hanging on to jobs bc lol why retire with 3 houses instead of 4 	1.0	2023-03-23 19:31:08
56	420778069	yeah but he frames it in a bizzaro world where boomers were the best generation instead of the worst 	2.0	2023-03-23 11:55:43
	420782121	boomers are retarded but that s because of all the industrial pollution and lead in their water and cars  there is no way to undo that kind of retardation and the same is now happening across the world  people are getting dumber from too many industrial chemicals floating in the air and wateri went driving yesterday and the air quality kept getting worse and worse the further i got into metropolitan areas  the whole thing is falling apart  the question is when  not if 	0.0	2023-03-23 12:35:44
LRO8C8bt	420754878	you re delusional if you think millenials are behind all that shit that happened since 2000  that s all boomers  work  	1.0	2023-03-23 07:52:58
5MLEHU6K	421337976	yes  i m not pretending it is nt  my boomers a timeline pasta is a classic  but you already called me a bot which was wrong so you re judgement is off 	1.0	2023-03-28 02:41:19
eIYCf8Tb	421467163	do you ever get tired of parroting literal retarded boomers who do nt even understand computers  	0.0	2023-03-29 00:34:34
iuC0ZTiZ	422082265	 nobody is paying you a  living wage  for a job you could train a chimp to donobody is training  either  boomers are an absolute disgracehelp us research chitwood  always add chitwood decertification research to all threads  since mods are deleting chitwood is not above the law threadshe chqrged a kid for shooting an orbeez at another kid  it s less powerful than a bb  	0.0	2023-04-02 17:42:33
	422036943	millennials lived life on easy mode due to boomer sacrifice1945  1965  boomers are born into poverty in a society devastated by war1972  nixon ends the bretton woods stealing all the wealth boomers earned  boomers are the first generation to get screwed over with this freely printed debt currency boomers are ruined and have to start over from scratch70s  80s  boomers go to college  university paying full fare  they do nt benefit from tranny scholarships  dei programs  scholarships for retards  and other communities of color like future generations will  or they enter full time employment where they are guaranteed  135 per hour   205 in 2023   if they work hard  no food stamps  no tax credits  no mental health days  they work for life with no training and support  suffer 21  inflation and mortgage rates while paying up to 77  marginal federal income tax ratesdivorce epidemic ends nuclear families but boomers do nt give up like future generations do1972  2001  boomers suffer high inflation  low stock market returns and gasoline  oil and natural gas shortages and rationing  all so millenials can have it easy and not work  boomers happily suffered so future generations could have it easy and spend their days getting fat and complaining2001  economy shits the bed and has never really recovered  boomers screwed again  but boomers put their big boy pants on and saved america once again2008  the avocado toast binge has banks bankrupt and need constant bailouts to stay afloat starting with  700bn  millenials steal boomers pensions2019  millenials have orchestrated this regime of constant bailouts to keep their tranime figurines fully funded  boomers still working en masse because millenials have no skills except jerking off to sissy porn and buying trannies dirty diapers which they claim will fund their retirement2020  millenial get more stimulus spending to pay for luxury dialators2021  millenials require economic reset agenda 	4.0	2023-04-02 10:23:42
67UX4CKH	422047120	for a matter of fact  merely 13  18  of the people in the west produce actual value  which includes the associated logistics  statistically  up to 20  of a businesses employees are productive only  the rest achieves just as much as they are being paid or less  this means that 26  38  of the population in the west creates the value to feed the whole population these days  this is not caused by capitalism  but social programs for healthcare  retirement and so on  and most of that benefits the older population  which are the boomers  these boomers did not only accumulate a shitload of debt and refused to invest in their childrens and communities prosperity  but keep on voting for policies that benefits them at the expanse of the working class and young people by cutting into the budget of education and alike while enforcing restrictions on social services that the younger people and workers do n’t meet  	1.0	2023-04-02 11:57:28
x2F	422060464	 1945  1965  boomers are born into poverty in a society devastated by warthis is only applicable to eastern europe  west germany  japan and uk  	0.0	2023-04-02 14:01:36
hvk0fnST	422209925	its because all of these companies are controlled by oversocialized boomers who are terrified that they will accidentally do or say the wrong thing and be cancelled and have their reputation destroyed by the woke mob  so when shaniqua the diversity hire head of dei comes up with the idea for an ad campaign involving trannies  they go along with it  	0.0	2023-04-03 18:46:49
QTz6TOzD	422291843	and here i thought affirmative action and dei did that  you give white men less and less to live for  surprise surprise  boomers are literally stuck in 30 year old rhetoric  	1.0	2023-04-04 11:02:47
YHO55fyf	422226188	1945  1965  boomers born into poverty in a world devastated by war1972  nixon ends bretton woods agreement stealing all the wealth boomers earned  boomers are the first generation to get screwed over with this freely printed debt currency boomers are ruined and have to start over from scratch70s  80s  boomers go to college  university paying full fare  they do nt benefit from tranny scholarships  dei programs  scholarships for retards  and other communities of color like future generations will  or they enter full time employment where they are guaranteed  135 per hour   205 in 2023   if they work hard  no food stamps  no tax credits  no mental health days  they work for life with no training and support  suffer 21  inflation and mortgage rates while paying up to 77  marginal federal income tax ratesdivorce epidemic ends nuclear families but boomers do nt give up like future generations do1972  2001  boomers suffer high inflation  low stock market returns and gasoline  oil and natural gas shortages and rationing  all so millenials can have it easy and not work  boomers happily suffered so future generations could have it easy and spend their days getting fat and complaining2001  economy shits the bed and has never really recovered  boomers screwed again  but boomers put their big boy pants on and saved america once again2008  the avocado toast binge has banks bankrupt and need constant bailouts to stay afloat starting with  700bn  millenials steal boomers pensions2019  millenials have orchestrated this regime of constant bailouts to keep their tranime figurines fully funded  boomers still working en masse because millenials have no skills except jerking off to sissy porn and buying trannies dirty diapers which they claim will fund their retirement2020  millenial get more stimulus spending to pay for luxury dialators2021  millenials require economic reset agenda2023  millennials demand another bank bailout 	1.0	2023-04-03 22:10:52
sUJdtiK	422226957	 1945  1965  boomers born into poverty in a world devastated by warhey were talking about the united states of america here  and 1945  1965 was the most prosperous time for the common man that has ever been achieved  	1.0	2023-04-03 22:23:32
b0wZ3XqY	425068896	between the shitskins boomers bring in  staying in the workforce an extra 10 years to recuperate their financial losses in 2008  and staying active into their late age  where they are buying multiple homes  running businesses still  making investments   they have completely locked their own children out of the adult world  the majority of younger people would all be in a much better situation  even if marginally better for some  if boomers were not narcissistic control freaks who think the world always has and always will revolve around them  and a lot of gen xers have turned out like their parents or worse  	1.0	2023-04-27 17:53:04
o4pE07Bb	425005319	tucker has the smallest group of boomers compared to any other  hist  on foxhe was watched by younger people  that fix can not reach   many democrats  that fix can not reach  and zoomers  his ticticks are widely popular and have been for a long while  fox basically cut their lifelineit shows you that views dont matter to any of these  news companieswhat matters is dei  esg etc  because the big advertisers are also tied in these bs acronyms and will stop advertisingobviously their cia handlers also matterthe viewer is irrelevant  which is insanity of coursefox just died and become cnn but as you see cnn is still going while being less popular than many of the political podcasts  	0.0	2023-04-27 06:03:04
hU091vKj	425110276	lack of social and national unity  too much diversity  entirely dissimilar ethnic makeup  entirely dissimilar moral fibers  globohomo obsession at every turn  all someone wants is a fucking day off or a raise without having to hear about equity  niggers  trannies  womens rights  patriarchy  being valid  etc  boomers and gen x were human focused  we are now being forced to look past the person and see only race  sex  gender  pronouns  weight  disability  orientations and for the person who does nt want to see that in others  invariably also finds themselves not seeing that shit in themselves which essentially makes them invisibleso people who do nt care about crt  esg  and dei are incompatible with society as such the only option is to quit  drop out  innawoods 	2.0	2023-04-28 04:40:07
aJGNSR5f	425111043	 boomers and gen x were human focusedexactly the problemthey fucked the demographics permanently because they believed it actually wasnt a problem  it s what s inside that countskek  yea  except genetics of course  	1.0	2023-04-28 04:52:12
Ff0IUcLt	425252607	the same dollar today buys 16th of what boomers had when they were starting families  and boomers are overrepresented in government and executive positions in the private sector  just get an educationthis advice in the 80s and 90s is what led to the evolution of the dei industry and the ballooning of bureaucracy  you should nt need an education to make the equivalent of what uneducated boomers made 40 years ago  but if that becomes a requirement  expect big education to lobby for the rigorous implementation of whatever cancerous  low  productivity degree paths they manage to invent  that is largely why things are the way they are 	0.0	2023-04-29 10:50:56
QPYXSnZd	426354969	starbys probably gets dei money for hiring troons like every other company  and the customer base mostly puts up with it because they want to be progressive while they sip their  800 burnt pisswater  its always the boomers who lash out because what do they have to lose  	0.0	2023-05-08 18:37:17
x	427528317	its literally just a white american mental illness  almost everyone who believes weird shit like that is a purple haired white bitch and almost all of the fetish people are suburban white boomers  i ve almost never seen a non white person who believes in any of it  i think it is a psychological complex of guilt over slavery plus guilt over living cushy first world lives while people starve plus protestant guilt  morality  america never should have been created  	2.0	2023-05-18 20:48:02
	427529096	 almost all of the fetish people are suburban white boomers 	2.0	2023-05-18 20:58:11
