Poster_Id	ID	Text	Reply_Count	Date
	475108269	the gayest fucking period in american history 2021 was peak leftist dystopia dei and corporate struggle sessions for whites pride month everywhere covid tyranny tens of millions of shitskins invading to replace whites etc they pushed on the gas pedal way too hard in reaction to blumpf and gave us a glimpse of what their faggot utopia would look like	0.0	2024-07-21 13:55:57
LB4h2E98	475102822	fuck you jewish faggot	0.0	2024-07-21 13:18:35
I8ls4Z0e	475076314	was a question faggot if this was real and these were the words ultra elite they d have iron clad private dei fed larpers but real security and this dude would have gotten near this is just a bunch of larpagen faggots in a public venue	1.0	2024-07-21 10:18:23
xZLJRdI9	475068873	210 pound goblina wearing 60 pounds of gear and a rifle bigger than she twink faggot on hormones jew inbred commanderseriously i know if they can even get out of their own way anymore	0.0	2024-07-21 08:53:03
	475064641	really bonkers after taxes these prestigious harvard graduates are taking less home than juan and paco who receive handouts free shit etc the irony being that for years these people have been inculturated to believe that anyone who a dildo shoving faggot was a hillbilly troglodyte racist worthy of extermination even more warped is that half of these feds are constantly berated and bullied by their quisling midwit femboss managers who they have to kowtow to out of fear of an hr issue half of dei is just mid level white men doubling down and trippling down on stupid policies just to appease their belligerant and conceited girl bosses	1.0	2024-07-21 08:00:25
3voAPgC3	475056373	i remember when this blackstone jew faggot created the whole world to go to shit these last few that trump is about to be president again the republicans do like will he make money	2.0	2024-07-21 06:16:02
KWSf4XqU	475054619	there is nothing you can do against mail in faggot the shaniquas who count those obviously fake ballots are not hardcore ideologues they expect to be paid	0.0	2024-07-21 05:53:09
NQu82uOy	475046647	how many people have you lost so less than you capeshit faggot	0.0	2024-07-21 03:48:07
	475031801	grifter go for the most profitable position and shills use such anti logical talking points because the truth is no on their sidehey faggot shillboy say it now is trumps campaign manage a pro dei faggot who tried to invoke the 25th amendment against trump after jan 6	1.0	2024-07-20 22:52:38
Z1	475032114	hey faggot shillboy say it now is trumps campaign manage a pro dei faggot who tried to invoke the 25th amendment against trump after jan asking me i do know	0.0	2024-07-20 22:58:34
OsOgGJg5	475027758	voting biden now biden is a faggot but he does put the jew who created dei in his own cabinet this is a special insult from trump fuck that loser nigger	4.0	2024-07-20 21:42:43
UPBpiAVL	475027486	by pumping in sea water into the salton sea in california from the pacific where it is desalinated at the salton sea that powered from nuclear power and pumped via aquaducts to lake mead oh you mean if the usa did have dei nigger faggot mutts constantly crying for gibs	0.0	2024-07-20 21:38:11
Ji8dS7yW	475272093	i think that a miscalculation on their is costing us the race with his terrible policies illegal attacks on trump dei shit and general incompetence quickly notice he is a dying old faggot and replace him with his own vp that parrots him as a massive the same dem policies still exist fuck why did it work	0.0	2024-07-22 16:51:15
rkQjA53d	475221010	because that faggot is the one who was reponsible for pushing dei which we all know has been an utter shit show for putting trained monkeys into positions they had no right being in considering their skill and discipline went from being unspoken standard to financial dogma so much so that every single person who depended on loans to push their business was approved or denied based on dei factors so basically all those money hungry hogs bent the knee as fast as they could and even held competition amongst each other on just how many truly useless jobs that were created to feed and house these useless cunts and fags and jeets and niggers and spics so that it could be further used to demoralize anyone working hard under their own steam	0.0	2024-07-22 09:32:55
	475209069	oh really faggot see this this is berlin you see russia does have these degenerate parades they are illegal there good for russia i wish the west were more like russia	1.0	2024-07-22 08:01:39
2Yzk7R9w	475185533	charlie kirk is a center left faggot the democrat party is far left faggot both hate white people	1.0	2024-07-22 03:41:39
2Yzk7R9w	475185785	your doing the democrat party hates and wants to replace white people by any means but the gayop wants to replace them are no political solutions faggot go get attacked by a mudslime gang you imporet or if a brown person instead leave germany	1.0	2024-07-22 03:45:24
	475174854	gay dorkdid you change your device your i d is just feel like after the rnc and shooting trump is shooksure thing retard it was biden that dropped out like a scared faggot he s literally fighting for his ahead in every poll biden dropped out if he ramps up the attacks much more moderates will run away in that case biden should have just stayed is opening the thread seeing that half the replies are one autist arguing with every single poster that is you are totally not samefagging	2.0	2024-07-22 00:54:19
	475175020	anon settle down i think you need a not joe biden i do nap and i do run away like a faggot	0.0	2024-07-22 00:56:37
v6dM95ru	475175891	rnc republican communistlol kraut moment if gon na call republicans nazis just do it faggot this is 4chan not reddit i love that you europoor have such a trash understanding of american politics that you think the fucking republicans with their brown endorsers are anything resembling the probably one of those faggots that rage and seethe about the rnc memes	2.0	2024-07-22 01:10:27
5QKshXmR	475169422	idk about that anon i ve been seeing spics pour into my town since he was elected he wo nt do anything again but whatever what can i do except laugh at the circus act the left will perform when he wins that s all i am really looking towards when he wins the left goes ape shit and riots when the left win they become comfortable and quickly turn the country into faggot dei shit so i d rather see constant riots from niggers and antifa	0.0	2024-07-21 23:32:25
	475455343	faggot unironically kys	0.0	2024-07-24 02:46:22
MYV20WHP	475427154	the ban approval came from ceo and when you re ceo you care about shareholders profit and company name you do ban your biggest streamer for something that is this was 2010 that would hold up faggot but in 2024 in the cult of dei profit means nothing social agenda means get that america is amazing to you as inspiring slavic tranny but doing illegal shit will get you thrown in jail he did nt do anything illegal	1.0	2024-07-23 20:00:25
P1C	475394822	retarded old hags chinx midget dei faggot old liberal we go beyond the the 12 already seriously can it get even worse	0.0	2024-07-23 14:56:42
	475379178	shitty construction with no tensile strength ai real ack quick blame this jew building code and dei shit on global is once again a faggot	1.0	2024-07-23 12:41:32
l8uFqzJw	475367889	i do support any fucking jew or shabbos christcuck faggot	1.0	2024-07-23 11:06:14
SQSmz7mt	475362507	you faggot cowards deserve what you tolerate	1.0	2024-07-23 10:16:58
	475368988	your gay ass copypasta tripe ca nt make me hate the left more than i already do there is no downside to holding both sides accountable and trump is a uniparty cunt people see it they call out both sides and you are a faggot good day niggerkike	0.0	2024-07-23 11:16:08
FMUkJkRI	475382318	baby fucker frum and faggot ass thiel	0.0	2024-07-23 13:09:37
as2w	475356347	in very theater of war get a massive stack system blasting faggot tranny nigger over and over again melt down and be running crying for their safe spaces in less than 10 and esg in the military diversity is their see them prove it	0.0	2024-07-23 09:23:32
eiyDxrlw	475355263	anon if kamala becomes president and turns donald trump into a milf and fucks him live on stage she wo nt let you call anyone a faggot or a tranny anymore she will be very mad if you use those terms and will likely send an army of dei groomer zoomer freemason mormon robotic birds to claw your eyes out	2.0	2024-07-23 09:13:57
U8Diue	475343165	ff is fantasy nice try dei faggot	1.0	2024-07-23 07:15:54
cCHT6cih	475346199	you call me a liar yet refuse to show flag are you ashamed of who and what you are faggot you lie by default kys	1.0	2024-07-23 07:47:30
aBWEG4wu	475319952	oh some blue check faggot said it must be true	1.0	2024-07-23 01:47:50
P5VrqAQ3	475550912	the ukrainian proxy army of zog has received more aid inflation adjusted than the ussr did during ww2 and it only slowed russia down for a while 7 km breakthrough recently btw snails pace my ass you lying tranny faggot	2.0	2024-07-24 18:32:12
	475551390	the monetary value is irrelevant what matters is what is actually sent the support given to ukraine is not comparable at all to what was given to the ussr the ussrs entire logistics train was basically american backed and while us aid in terms of tanks and planes was that big in the grand scheme of things it was far more than what ukraine gets now which is effectively nothing the americans sent a literal token tank shipment and 0 aircraft its not comparable to us aid to the soviets in the it was the russians have achieved any kind of breakthrough anywhere since the initial attack you are the lying ass tranny faggot you fucking subhuman orc monkey	1.0	2024-07-24 18:37:14
2x9JhTyi	475531104	yawn you are like a bernie bro fag from 2015 get with the is not an argument its nothing approaching an argument it is a statement of personal disapproval sans justification masquerading as an argument you are a nigger and a faggot	1.0	2024-07-24 15:29:33
8SOwfr0n	475537449	no one is buying your game faggot	1.0	2024-07-24 16:25:08
B4TFltSQ	475526989	no one gives a shit about your who opinion vance is a fat race mixing faggot with a hideous brown wife he against spending money to protect europe but really wants to spend money protecting israel it be tragic if both his and your kids were raped out of their dinosaur pajamas i might legitimately cry kinda like that fat faggot vance when he watches garden state	3.0	2024-07-24 14:52:50
	475491504	while matt walsh is a retarded faggot that works for jews i incredibly interested to see if he has the balls to talk about why africans never invented the wheel why black iq is always lowest etc i guessing because he works for jews this is going to be another self own wherein he tries to gotcha some white females who bought into dei instead of trying to figure out what really happening behind the social contagion i love for a real filmmaker with balls to tackle this but again all we have is this retarded faggot	0.0	2024-07-24 09:46:26
tCAqYyQi	475480733	they did tell her to get it they asked her about it and she jumped up and ran over to it like it was an unattended package on a doorstep let me ask you you pasta eating faggot if you were boiling water for a legitimate purpose and someone told you to stop momentarily would you start pouring it in the sink or just turn off the burner	1.0	2024-07-24 08:11:58
Bo4bL8fY	475446417	yep dei does mean nigger or tranny or faggot cocksucker or white know it all cunt liberal take your pick of the assortment of various cunts pretty much	0.0	2024-07-24 00:17:39
A6IwYW6j	475451965	ahahahah the ultimate cope just because the past uh what 500 years has been practically defined by western and east asian culture thinking niggers and spics invented our subcultures shows what a good goy you really are mainly when they claim we such great inventors so much they still have to revise history to attribute countless white inventions and cultures to shitskin races like every culture that seen as a joke internationally came from the west including the aussies and kiwis or east asia yet another group you wish you could be but talk shit about being superior invented the modern world and your worthless shitskin ass be here if your pathetic anestors use our technology cope cow fucking faggot	0.0	2024-07-24 01:47:21
zA	475434754	wonder if there was some kind of dei initiative that forced out all the old operators who monitored and tried to manage this competence intelligence and overal demeanor ofnthe fuckwits they have working it now is noticably inferior to their anon remember had some goodntimes undermining that faggot	2.0	2024-07-23 21:28:17
3X3ISuUk	475433805	op is a dei hire and a faggot	0.0	2024-07-23 21:16:44
nMDMTKfs	475678866	this is the results of dei dumbfuck oh lets take a bunch or retarded brown people that could create a civilization and give them jobs maintaining critical infrastructure in our civilization and replace the people that know how to care for and build civilizationwhat could go wrong you dumb faggot	0.0	2024-07-25 19:16:03
ZjVzzU46	475668499	how was the audio analysis analyzer a good one is like 40k and they need to be calibrated for accuracy every few years pirate flag faggot has no idea what he d talking about	1.0	2024-07-25 17:20:07
8OIoQAi0	475645788	how do you plan on co opting the astroturfers nah just gorepost it funny to picture some faggot or nigger being exposed to traumatizing images that make them spiral into depression they are built for this shit	2.0	2024-07-25 13:40:03
SRO7JOAD	475634900	your grandchildren are all going to be brownif she s a dei hire prove it by getting a white faggot who s better oh wait we fucking ca nt because she raised 300 million in three days while our vice raped a couch	2.0	2024-07-25 12:04:50
mezlW1j8	475625705	look it up that was their exact excuse when it all was happening i remember because i was a retard back then thought that was a smart idea the thought of them lying about that hiring cunts to ruin everything with dei faggot bullshit never crossed my mind	1.0	2024-07-25 10:40:07
b7SeXS91	475616401	one of the few jobs where dei should not applydei should not apply to any jobs you jeet cuck leaf faggot	1.0	2024-07-25 09:08:51
	475611649	the fbi is too busy with the dei hiring and faggot classes to find anything the fbi is useless	1.0	2024-07-25 08:21:44
	475606937	lol it is never the females fault always the manten years from now admitting you were a feminist now will be tantamount to admitting you are a thing now really ca nt have your dei bullshit without supporting your local kid fuckeris it wrong that all i want to do now is hurt weak faggot leftists	0.0	2024-07-25 07:37:43
mXbwgU9R	475807521	fucking bot nigger mass replier kill yourself fucking faggot bitch	2.0	2024-07-26 20:41:58
TBbbsbkD	475790608	this is also black pilled conspiracy bullshit what are you even talking about who has called for gun control because of the assassination for trump to say are afraid of your guns being taken away by the govt you are the one who is holding the gun faggot you can refuse to give it was obviously staged photo op its yeah i personally can refuse to give my gun up but that mean everyone else will	1.0	2024-07-26 17:30:52
zpidYtg5	475790367	shut the fuck up glowie we know you re just trying to poison the well by repeating the same fucking lines in every few threads word by word get a new script faggot its literally getting stale if were starting to recognise it fucking dei hires i swear	3.0	2024-07-26 17:28:11
cidXuU5T	475786838	and why did you say person of glow and not one of those things called jokes you dense faggot	1.0	2024-07-26 16:47:31
a	475752395	go inject some more hrt marxist faggot	0.0	2024-07-26 11:12:00
J0mxTIj	475742265	he s butt mad trump ditched his ass so he s just trying to stay relevant any way he can to continue the grifthes also a faggot so ofc he would like the dei nigger hire	0.0	2024-07-26 09:31:33
QCI5eVZS	475697957	unless this is just glownigger dei incompetence pulling the levers of white made tools or they are setting kamila up for a rapid rise and make me wonder like if the election were held tomorrow shed do better than she would have last week she might even win but only tomorrow by this time two weeks from now i expect shell be doing worse than biden was what were these nigger brained retards thinking should ve waited til end of september or even middle of october for this horseshit its already peaked and were months out god help her if there s another democrat scandal between now and november she s already used up her one free get out of the news cycle card a biden gaffe some d staffer faggot fisting on the floor after hours any of their senators getting caught smoking crack on camera lots of room for things to not go her way	0.0	2024-07-25 23:25:33
B3T6GRrN	475697876	forget that merit in the work place is gone that millions of illegal fill up job slotsforget that you will now work until you are 80forget that you are competing with machinesi want this faggot to dig ditches for 2 years just two then i will listen to his work till dead faggotry	2.0	2024-07-25 23:24:21
TB42vK	475698096	actions speak louder than words i stand by my opinion ok faggot word would have leaked if she was offered and rejected it all sources say that it was between rubio and burgum then idiots sons said no dad and he went with vance holy fuck what a retard he is	0.0	2024-07-25 23:27:43
	475701325	a scotts irish trailer trash millennial from armpit america as the vp pick is a very good choiceits the worst pick in history no one likes this faggot	0.0	2024-07-26 00:18:52
ESDz4guw	475863211	thisalso their choices for white guy are jew faggot californian not really 0 chance newsom accepts to be second fiddle to cuntala lol	2.0	2024-07-27 09:51:31
hfxk	475831762	nigga the latest rnc convention was filled to the brim with faggots and was all about inclusivity did you get the pete is a power bottom with an incredibly assured carriage him being an incredible orator and a deft spokesman for the biden administration makes him a perfect fit its not just about him being a faggot he is more or less a centrist with skills to debate even in such hostile environments as fox news he is arguably even less of a dei hire than kamala and kamala being with him on the ticket it might compensate for his lack of popularity among blacks	0.0	2024-07-27 03:02:36
WtW8zSwh	475829959	kys nigger posi hope the worst for ur family faggot	0.0	2024-07-27 02:29:37
pKDaYd7a	475816468	kys leftypol faggot lol	0.0	2024-07-26 22:40:59
y0mDbYXN	475813716	sure still not voting for this fat faced faggot who wants me to have less say than single mothers haha	2.0	2024-07-26 22:03:55
yCHT4HEK	476038302	lol no thanks keep your tranny faggot dei propaganda in blue states why do they even care about racist red state viewers when majority of sane people are leftist tranny supoprting democrats	0.0	2024-07-28 19:43:57
	476031723	umm actually that has been debunkedseethe more bitch faggot everyone believes its true so its true now he might as well fuck a couch on stage now because hell always be couch fucker man	0.0	2024-07-28 18:28:26
eCPIwSvU	476040780	trump is busy deepthroating israeli cockyou know what s really like to make jokes about this politician or that politician sucking jewish dickbut for kamala its not a jokeher husband is jewishevery night kamala sucks a jewish cock and drinks jewish semen not as a joke but in real lifeanyone trying to help her get elected actively or inactively is a cuckold faggot lol	0.0	2024-07-28 20:12:44
LzpIdZ0p	476019555	faggot was able to afford going to yale and law school idiotim pretty sure the bill ca nt cover a bill coming from those schools	2.0	2024-07-28 16:20:08
Iy81NzrV	476045166	woah when you put it like that he sounds like a fucking glownigger faggot	1.0	2024-07-28 21:07:00
OPW0emAf	475964352	as someone actually watching the olympics had to cancel the fucking parade of nations on boats because of rain no stadium in general because of pools for swimming are too shallow and causing choppy water meaning everyone is slower this year south korea introduced as north korea the equestrian teams just have enough time and so they all must update their performances to be quicker dei judo coach bitch called mate wait and the spanish fuck started to choke tje japanese dude who just dropped his guard she proceeds to not realize getting choked for four seconds and then gives the point and match to the spanish faggot olympic flag was raised upside down if the rain continues all the triathlon will be canceled because the disgusting french sewer backs up into the river ala india the roads for the cyclists have speed bumps and are causing crashes also genuinely low quality unkempt making them all fall on turns in the rainabsolute joke	1.0	2024-07-28 06:39:50
dT0SLWKe	475938548	official narrativethere such a thing since made up on anons you fucking frog faggot what would you say is the official narrative vs the so called narrative	1.0	2024-07-27 23:29:07
dt3bsOQa	475939748	can you worthless jannies van this faggot spamming every thread	1.0	2024-07-27 23:50:02
fcFt6qnF	475940635	everyone is so busy struggling with their own shit that they just stopped caring about the fact that we are literally living through a new chapter in a future history textbook every couple of not that they struggling you long winded faggot it that every person lives on their fucking devices like a terminally online loser and has fried their brains attention bitch	1.0	2024-07-28 00:05:21
xq8	476149367	she got there by literally sucking dicks you retarded faggot its well attested to	0.0	2024-07-29 17:08:19
	476151041	faggot libshits ca nt deny these digits	1.0	2024-07-29 17:24:10
Ts	476155666	peter thiel is a faggot therefore not based	1.0	2024-07-29 18:07:52
YIrM94e4	476132720	i should be used to it but i do think i ever will adjust to how blatantly these evil faggots never once spoken admirably of hannibal he uses him as a negative example of why we do want random lunatics coming across the border and loose on our disingenuous faggot bastards deserve to be lined up and shot	0.0	2024-07-29 14:46:44
XUML8r1Z	476131675	so who gives a that commie latino piece of faggot shit	1.0	2024-07-29 14:38:16
ufZ0mUVc	476134913	cope more commie faggot	1.0	2024-07-29 15:05:15
HlZWWp5d	476112339	that s why cia faggot vampire peter thiel loves him right could be their mutual love of cock and israel right	2.0	2024-07-29 11:35:47
	476112531	that s why cia faggot vampire peter thiel loves him right could be their mutual love of cock and israel thiel of the tiny hat tribe	0.0	2024-07-29 11:37:37
mCg	476128308	you can not be a christian and a faggot	0.0	2024-07-29 14:09:25
	476128213	thiel is not a big nose little hat he is a faggot that is funding this huckster to talk about christian values and rural whites while the huckster married a pajeet works with pajeets and only supports trump when convenient after previously calling him hitler as a negative talks about only people with children being able to vote when white people are already paying for black single mothers to pump out baby after baby for welfare check after welfare check i do trust jews but i also definitely do trust a guy talking about family values who is funded by a faggot and we know trump only took him in because big donations were attached	0.0	2024-07-29 14:08:37
f33JkuXD	476100329	you are a fucking racist but your the worst kind the kind that thinks its not racist yet perpetuates racism and thinks they are a progressive and inclusive you are why dei exists a total faggot	2.0	2024-07-29 09:40:43
H1Al2IOe	476096618	lol this gop faggot is spamming this pasta in every vance thread	0.0	2024-07-29 09:03:30
pWnOyRVw	476093500	he is a faggot who wears eyeliner and sucks dicks	0.0	2024-07-29 08:34:06
WoqEdhyN	476094135	why are you shilling for a race mixing faggot who constantly shits on rural white folks by saying how wonderful he is for escaping from them	0.0	2024-07-29 08:40:18
	476089265	look its blood its not like that can be fakedlol and if his full medical record was released trannies like deleted his own account and the faggot posted a photo from two weeks after the of stuff endearing him to the rightyou win an election with just the right and plenty of moderate republicans hate that do you think fox news was secretly helping obama by implying he was a gay socialist since that would endear him to the left	1.0	2024-07-29 07:49:43
LiLpnoXN	476079624	op and brazilian flag vpn who are the same person want you to believe that cops using ai to track gangbangers and cartels is bad because they are brown and meritocracy as envisioned by vance and his donors is bad because browns ca nt get ahead in a non woke dei a commie tranny faggot op brazilian flag are	1.0	2024-07-29 06:01:10
	476068123	did nt choose the only competent guy who is actually against the deep state and loyal to usa instead chose a gay fat faggot whose wife is a dei deep state implantyeah there s no hope for ameritards	1.0	2024-07-29 03:11:57
p2bK354K	476061676	i denounce the talmud hate kikes because they started this whole progressive that being said you are a fucking retarded cattle nigger you are a fucking cuck you are a fucking braindead faggot pretend to hate jews you play at being a nazi but you love trannies you love niggers you love faggots you are a degenerate that would and should get purged a 0 iq cock munching retarded bot that knows nothing about the world and got finessed by the most stupid communist psyop ever yourself nigger	1.0	2024-07-29 01:14:01
