Poster_Id	ID	Text	Reply_Count	Date
QPF7n9od	456192008	 because eventually  inevitably  someone actually intelligent has to keep everything running and do all the work  and after how badly they ve been dragged  they might not want to anymorei no longer want to  i do a ‘ responsible ’ job  ten years ago it was a tough job because it was complex  now it ’s un  doable because it ’s complex  and has layer upon layer of bullshit caked on it  people who have no idea how the job works have risen to a management level and created these layersi agree with every word of that complex systems crisis article  but what kills me is it was written by a guy who runs a hedge fund  the need to create constant growth for shareholders in a job that is n’t suited for it is one of the major causes of the bullshit stressors i facei am done  i ’m burned out and getting sick with stress  the causes are dei bullshit making the people i have to direct unmanageable  and the design of projects to accommodate it becomes impossible shareholders need growth so we are held to impossible targets while having budgets cut to the boneeven the non diverse newbs to the industry are n’t as good as the boomers  shit on boomers all you like  but they can do the job and they have a broad yet deep understanding of the why of the jobi do a sport with a guy who does something very critical with nuclear  when he talks about this stuff  it makes my blood run cold 	1.0	2024-01-23 11:35:55
rDBHx4fY	456169748	basedyoung white men are the only net positive tax paying demographicnot only do we have no political representation but everyone else uses theirs to fuck us overeveryone else is a parasite  the older boomers who will get social security  the women  the brown people  all a net drainwhite men have a duty to let the system fail and make these people starve for trying to be parasites to us while ruining our lives and futures 	0.0	2024-01-23 07:21:17
	456154582	that s why you need to type the following at the end of messages  that demoralize and attack kikes  posts that make them really seethe  since it s a topic that hurts them in real lifelike how usa dei diversity mutt troops wont fight to protect kikes  unlike the patriotic white males that they demonized  and got to leave the military  letting them know that the 80yr curse of the jewish state is real  that theyre at year 75 and yahoo and cabinet are so paranoid and freaking out about the curse  that they already put boots on the ground in ukraine  aka khazaria  5yrs ago  as their exit strategy plan b for when israel collapseshow only 51  of zoomers believe the holocaust was real  and their only real support is with boomers  that it drops every single generation  and boomers are dying off really soon  that with 2b muslims vs 17 m jews globally  and kikes seeing this war as a jewish prophesy of a holy war  that the numbers just arent there for the kikes  that theyll actually have to fight their own war for once  and kikes literally poopie and wee wee their idf mandated diapers when they come across a real enemy  that s not simply a child  baby or toddler palestinian civilian in warthat hey know the end is near  and the holocaust 20  the non  fake edition is upon them  were reaching the end of the weimar 20  and khazaria is what zelinsky already referred to as a  big israel  after the war is over  were coming on the right of the far right in europe and usa  as the pendulum swings from far left  to currently becoming the right  and soon will be far right like much of germany and some other countries are becoming  that nazi s 20 and hitler 20 will soon be upon usend the messages with redpills like these  withtikkun olamtkdkikes hate tikkun olam in this context  since they realize the world will heal itself from the jewish problem  	1.0	2024-01-23 03:47:40
CHD2cC8L	456334508	fyi 99  of those applicants are retarded  so if you are competent  and they actually need a competent person  and not just dei makework job  you will get the jobtrust me as someone with firsthand experience here  hiring managers are not enjoying the applicant poolwhen boomers say  no one wants to work anymore   they actually mean white men 	0.0	2024-01-24 15:56:18
	456277364	 this is why zog  globohomo is losing and wheezing its last breaths dyingunironically this51  of zoomers dont believe the holohoax liesdei diversity mutt troops already revolted at the thought of defending pissraelonly boomers support pissrael  and theyll be dying off soonevery other generation has been dropping their support of kikes  with only 27  of zoomers supporting pissrael and that was before  the noticing  and normie awakening  and all the pissrael kike propaganda crumbling in real time  imagine the real numbers now  	2.0	2024-01-24 05:45:15
v	456276961	as a former engineer working for a major us aerospace company  pw  who left to start his own business you are exactly correct  by the time i left it was literally ancient boomers who were union or diversity hires that were actually worthless  all the competent people  see white college educated men  either retired or quit years ago  all the trannies  strong women and immigrants ca n’t replace the few super stars who left and now the world can see it  	1.0	2024-01-24 05:40:25
PpJy8I1h	456479089	competency crisis  boomers are largely retired  gen x last generation to be unaffected by affirmative action  gen x is the smallest in number and dei is ensuring everybody else gets promoted over themagain   the closest thing they got to competency is the mormons who also got buttfucked by dei  their lower and middle management is completely rotted  their top is also rotting fast  	1.0	2024-01-25 19:30:47
DCwIRq65	456365841	yeah  no  western society is just plain fucked from generations of parasites leeching off the prosperity of the greatest generation  unfortunately you ca nt even blame the boomers anymore because they up and left right after covid  shit has gone down hill so fast with gen x in charge and us millennials trying to tard wrangle the zoomers that they backfilled all the vacant positions with  you are about to see infrastructure failures on a scale never before witnessed before and the thing is that putting an end to dei wo nt solve anything because there are simply no competent people left in this society that has rewarded incompetence for decades  	0.0	2024-01-24 22:01:16
A	456578936	 shit jobs will always exist  are you a fucking retardsure but there s a difference between a job that s shit because its hard and a job that s shit because its filled with spics who reduce the pay to absolute minimum  but cashier  lot boy  laborer  line cook server  barback  warehouseman  trucker  unskilled construction  tile  roof  rock  fence  landscape   or other general service insustry should be exclusively  24theres not enough manager or ceo jobs for everyone retard and those jobs were just fine before you retarded boomers opened the flood gates 	0.0	2024-01-26 15:04:46
	456661912	obama  however  gave out over  70 trillion dollars of whites current and future wealth to nonwhitespic related  we have 100 million niggers and spics  thanks  obama and dei  diversity policies  getting gov welfareon average  over their lifetime  60 mln spics will cost us  35 trillion  and another 40 mln niggers yet over another  35 trillionthat we do nt haveplus  35 trillion fed gov debt  makes our fed gov over  100 trillion in red  thanks  boomers  you are great  	1.0	2024-01-27 09:10:43
XZNvpMbn	456662586	boomers gave women and jews  who gave niggers  the power over our legal systemwhich made a mockery out of itlook at the ridiculous mockery of a cangroo fake court that awarded this fraud lady  83 mln against trumpit is a fraud and a mackery over our legal system when you have women and niggers as judges etcthey should not be allowed anywhere near a court roomnow  once this is fixed  and all anti  male laws that women installed are removed from the books white males will go back to marrying white women and reproducing againright now family law is even worse fake cangaroo clown anti  male garbage than this trump sharade  of course  no normal male with any funds would want to marry to have an extremely high chance of financial divorce rapewhites do nt reproduce because of this  fix this  and they will again  	1.0	2024-01-27 09:17:57
	456622006	 governments are shitting bricks all around the world because of a declining population  which will eventually lead to a stagnant economy where the hope of recovering is nilthis is utter fucking bullshit  this is the excuse that hyper  capitalist feudal kikes use to import millions of unproductive shitskins that will be a burden  not an assetthe workforce is over populated1  how many jobs at this point are corporate make  work fluff2  how many jobs are going to get nerfed by ai  automation in the next decade3  if job availability halved via ai  the wage of a single worker would double  and which in turn  would make 2 parent 1 income homes a possibility again  this would make it viable for women to opt out of the workplace in favor of childcare which would even further increase the wages of the remaining labor poolthe idea that we are  underpopulated  to support the economy is  and always has been  a globalist liewhat we will be underpopulated to support is social fucking security and the welfare that the gerentocracy that runs this country is dependent onguess what  too fucking bad  it s time that the boomers pay the piper and realize it s no one s fault but theirs for not planning for retirement  i shouldnt have to pay for the boomer s housing because they decided to sell the house they paid off back to a fucking bank for a reverse mortgage so they could blow the profit on casino cruiseswe have to stop burdening our generation and our kid s generation with financially supporting the boomers  i m in my late 30 s and ive already made sure that i planned and saved for retirement so that when i m 70 im not dependent on my kids  if anything  ill have money or property to pass down to them  instead of begging them for handouts ala baby boomersbaby boomers were given the single greatest society on earth and they fucking squandered it and destroyed the quality of life in a single fucking generation  	0.0	2024-01-26 23:16:38
Jg	456784679	if your boss cant tell the difference between actual work being done and a mouse being moved around  maybe the job is bullshit and doesnt need to exist  wfh is making boomers and gen x realize that most of these office jobs are not necessary and are clinging on to the fantasy of  office culture  so they can keep their fantasy going  	1.0	2024-01-28 10:53:25
MXTENzL0	456784879	 wfh is making boomers and gen x realize that most of these office jobs are not necessaryyeah  twitter figured it out  	0.0	2024-01-28 10:55:33
	456930612	that was the boomers and gen x gen x are the last compentent generation of glowniggers but they are severely outnumbered bunch of nilihistic degenerate hedonists who first got fucked over the boomers and than got fucked over by dei  they are not in the position nor numbers to handle everything that is expected of glowniggers  as for millennials and zoomers affirmative action and dei were always a thing for them so they are worthless  the best part is gen x is too fucking old to deal with field work anymore  so all the field glowniggers are the most incompetent there has ever beenthat is something they hate having pointed out to them  remember to always demoralize  make fun of  and post content that glowniggers can not counter  	2.0	2024-01-29 16:39:06
	457137920	competent people withdraw but they re also actively being gatekept from climbing up the ladder  not just by corpo dei red tape but also by spiteful boomers and hr roastiesthe whole deck is stacked up against us  and then some  	0.0	2024-01-31 12:53:57
5XfmXC4o	457189891	this has to be a bait thread because those gender studies nobodies now run industry standard dei workshop bullshit and hr positions  they get paid a load to show up at conferences and spew their dumbass shit  fully paid grants for phds  including housing  monthly stipend  etc  the only people who think gender studies are n’t getting paid are boomers who have no clue what jobs are like now  they do n’t even know there is an algorithm that auto tosses your resume  cover letter because you did n’t use the same wording as the job description  people have to lie about experience or being gay to get an edge over a black woman with a gender studies degree  fuck you retards  boomers  mike rowe  and any other hard work faggot  absolute scam is what that is  	1.0	2024-01-31 23:54:12
fiPJh9ze	457188544	having dei officers in hr necessitates having 100  recorded communications in the workplace  sorry boomers  you built and voted for this system  	1.0	2024-01-31 23:30:15
lNF8ybme	457329471	only if what you are busy with is constructive and fulfilling  getting yelled at by entitled boomers at a call center all day or filling out hr karen ’s latest dei report is hardly good for your headspace  	0.0	2024-02-02 06:39:15
hRUAqj1r	457325579	the dnc is coming up against the hard reality that they do nt have very many competent people after a decade of dei  its a bunch of boomers like kerry and obama trying to run things while fat black women lay around eating and tweeting about trump  they ve also been discreetly told that midnight ballot madness is nt on the table this time  at least not to the tune of 20 million votes  its like finding out your paper is due tomorrow  	1.0	2024-02-02 05:46:21
	457490713	 oi vey  that s racistthe world openly applies different standards to  god s chosenone of the worst redpills is realizing christianity is a big part of this  it is a slave religion for slaves  it enables this disparity to existoi vey  they know not what they do  turn the other cheek  goyimoi vey  you must forgive they who trespass upon you  goyimwhether it was this way from the start or not  i dont care  this is what it has been for centuries  and is one of the pillars that makes boomers such good goyim  	2.0	2024-02-03 17:55:42
Oz1tt4	457597141	it is 100  a white identity issue you retard  left wingers hate white people because school and the media told them to  youre an autist who projects his autistic thoughts on normies  like boomers who say  le based black men are getting off the democlap plantation     every single election  it s the same people who think that niggers and trannies are oppressed  	1.0	2024-02-04 18:11:05
	457550467	the answer is parentsbut the fact is if you have money to sit around all day  you probably have money to start a business  your parents might even be enthusiastic about it  as you are actually trying to do somethingmake a non  esg  non  dei business and tell us about it  people will buy itmake sure you follow all laws and keep your nose clean  they will try to shut you downinstead of getting salty at boomers  use their wealth to help us out of the mess  	0.0	2024-02-04 09:07:09
0sy1NLLg	457787644	 welfare state collapses  no more gibs  economy begins to shrink  no more dei money for affirmative action  flood the west with people  lower entry level wages to nothing  pay for boomers retirement  no more money for pensions  realize the road goes both ways 	0.0	2024-02-06 14:23:32
52S5pbYB	457976540	 demanded inclusivityi wonder why  boomers are in complete control of our education system that molded them into golems 	0.0	2024-02-08 08:52:55
dE3RbEqP	457973404	we ve been printing money for several decades and run the debt to its maximum   to increase growth and markets   now that boomers are retiring dei is needed to keep enough wagies for the growth  however the quality of products will be abysmal and the quality of life will drop  but markets will still perform  well   	0.0	2024-02-08 08:20:58
	458125778	post everything  i have some retarded boomers grandparents form germany that pushed for all the dei and esg shit  they deserve to suffer  	1.0	2024-02-09 14:34:25
yHNlKJrb	458242483	they want him to step aside so they can hot shot some dark horse  problem is the dems have no one who can beat trump because all the moderates are too white reeee and all the lefties scare the boomers  dei is a bitch  	0.0	2024-02-10 17:25:03
	458351567	i d prefer that the rich assholes in gilded mansions get murdered in their silk sheet beds then allow them to buy another megayacht with shitskins keeping wages low  but i m like you and do nt use door dash  uber or amazon  yet i survive but dumbass boomers  millenials  and zoomers want to spend all day on social media  larping as influencers instead of cooking kraft dinner 	1.0	2024-02-11 18:20:49
	458458178	 you ca nt know misery while you are high  but you can not know joy without experiencing miserythats why zoomers are so fucked in the headnog level lazy niggers  entitled as fuck  was used to participation trophies  getting shit that you did nt deserve  economy was booming  jobs plentiful  crime low  no losers for anything  pass school even if you failed and did nt go  the worst thing ever was simply just the fear porn put out by msm and dems about republicans  shitskins  alphabet mafia  and thing dei related got shit for no reason jobs  grants  scholarships  ebt money  section 8 housing prices  obamaphones  obamacare  etcgood times made weak menso when shit starts to get slightly tough  shit that our later 70s  early 1980s frens would have dreamt about  our little snowflakes have mental breakdowns for  like having to work to get a paycheck  or being told no for some stupid shit  or not winning  when you losewe need hard times to make strong menplus  boomers are dying soon and are gon na be giving their expensive homes and bank accounts to their millennial children  	1.0	2024-02-12 18:07:33
O3QScMR1	458459135	 zoomersboomers mate  i have immense sympathy for zoomers  they have no living mnemetic contact to realitythe boomers thought belief made reality  because they had everything handed to them  their children were neglected  possibly because their parents believed that everything just fell like mana from heavenmillenials were fed the same lies  but never got instruction because xer s believed they needed to land on their own feet and gave nonezoomers are living in a disjointed world  where everything is a simulacrum and they are reprimanded and judged if they even attempt touching grass  they are living purely under the weight of socialisation  its not human  and now we can see gen alpha are adapting to being inhuman by not realising it 	1.0	2024-02-12 18:21:40
qqaYAjY	458458680	 they also have some weirdly inflated sense of themselvesit comes with the coddling  they live lives where they never have to face the consequences of their action and where mommy and daddy will always be there to bail them out of any trouble and they develop severe cases of entitlement  this existed in all generations of course  my dad always had his parents there to bail him out of any fuck ups and it left him a deluded narcissist who genuinely thinks that he s above the law and never has to face consequences for his actions  but the problem with zoomers is magnified because xers and late boomers raised by the colder silents and ww2 generation parents overcompensated when it came to their own kids but that just had the result of making a generation of deluded  self  absorbed fags  	0.0	2024-02-12 18:15:16
gKcilBW5	458476246	there s no future in this corporatist globalist empire you fucking leaf  nobody gives a fuck because the only thing the elites at the top give a fuck about anymore is quarterly yield  not production  not actual things  just fucking bullshit on ledgers about a fake currency backed in unicorn farts and the goodwill of camel fuckers and chink gooks  so of fucking course everything is falling apart and everyone has a severe case of not giving a fuck  in fact  everyone has a severe case of lets fucking butcher kikes  chinks and fat rich boomers  then  after all that blood is spilled  maybe we can eventually get around to giving a fuck again  but i would nt count on it  	1.0	2024-02-12 22:58:54
R99ZjL5	458480597	boomers who do nt like  work from home  saying  return to office  is like boomers who do nt like netflix saying  return to blockbuster   that ship has sailed  office buildings are doomed to share the fate of 1980s90s shopping malls  	0.0	2024-02-13 00:31:52
vxOLFDww	458657121	literally was the second night on night shift after training on day shift at my new job  when the karen across the way started running her mouth telling everyone i was nt doing my job  so i called her over and politely showed her the work instructions for my job  which i was following to a t she does nt even work in my area either  she literally works on a line across the way from mineapparently this pissed her off so she went to my team leader who then came and said i had to do it this way  despite it being opposite of the work instructions we were told to always follow in training  and its not like they were invalid  since they were literally updated on 722021  but of course boomers got to stick together  so now just doing it the way i was told even though its wasteful and makes no sense  while already looking for something else  because honestly why would i stay somewhere where there is more active and supported bullying  when i just left a horrible environment like thati mean do these people just never grown up  just forever stick in the high school bully mentality about have to pick a fight about everythingbtw for anyone wandering i did message the dude above about updating the work instructions  he basically tried passing the buck to a position that currently has no one in it and never replied to me after that  	1.0	2024-02-14 15:14:19
5mY1EOsl	458637472	 its a genocide that pajeets are brought over to be coding monkeysno  its because native whites and asians get the better coding jobs and pajeets get the poiverty tier ones where you have to live out of your car in sf that nobody watsthat tweethow many white boomers retired during the pandemic  	2.0	2024-02-14 12:07:03
	458658637	  its a genocide that pajeets are brought over to be coding monkeys  no  its because native whites and asians get the better coding jobs and pajeets get the poiverty tier ones where you have to live out of your car in sf that nobody watsthat tweet  how many white boomers retired during the pandemic  	1.0	2024-02-14 15:29:54
uM8pqry	458943624	boomers are retarded and that s what they think they are going to be  except  everything does nt magically work like in a fairy tale  and collapses  	0.0	2024-02-17 06:32:27
MUD6opLF	459131491	h1b jeet engineers specd and wrote the software  below us  min wage street shitters in india tested it  white boomers allowed all of this to please jewish board members  lust for shekels  	1.0	2024-02-18 21:53:23
VkLfxiFx	459050788	they really do nt  well the black ones do obviously  but people like schumer and friends think its just like where they come from  there s grift and graft but otherwise its a normal government  they just assume blacks are poorer so the services are nt as good  every dollar that goes into a black municipal budget is stolen  there is no clever attempt at money laundering or scheming  they literally just withdraw it in cash from city accounts  this is why black school districts have the highest per pupil spending in the country  and yet their buildings are literally falling apart  and they have nt bought a textbook since the 80s  this kind of thing is unfathomable to the white liberal  and even to the jew  who knows to shave the coin not to just pocket the whole thing  it was at one point kept relatively in check by white liberals who acted as handlers of sorts  but those people were all purged in the obama years  rahm emmanuel was basically the last gasp of that ilk  so we get to today  where big fat black women eat well on the public dollar and report 110  voter turnout and everyones too terrified of being called racist to do anything about it  its starting to happen at the federal level as the white boomers retire and the dei people take over  dei is basically code for hire the fattest black woman you can  	1.0	2024-02-18 05:53:29
Qu8AD7BB	459345916	boeing and their ilk keep a few people to keep the place afloat  this has become the new american standard  old men with 40 years experience are retiring and shaniquisha is supposed to replace him some howthe boomers did nt do this  the kikes did  	1.0	2024-02-20 21:04:31
1Ff6hruE	459346241	 the boomers did nt do this  the kikes diddeiesgthey have to compete with a place like starbucks and every other company for investment and loans  nothing can save a company from the skill crisis  when a taco stand has a better esg rating than an engineering firm  	1.0	2024-02-20 21:10:05
nWbyuq4K	459275036	why work when all you get is some tranny calling you a racist nazi and destroys your lifewhy work for peanuts for mrjuden when some pajeet can easily replace youwhy serve  your country  when all it does is allow hedonistic geriatric boomers to pile more and more debtwhy die for  your country  when all it does is import millions of spics  chinks  negroes  arabs  and whatever other mongrel races there arewhy should we even put in the effort to study some field when you get dei memed by a literal monkey  	3.0	2024-02-20 07:32:36
