Poster_Id	ID	Text	Reply_Count	Date
1KiVXCVr	460389603	it multiple things the biggest is that the system has gotten too big for anyone to run it even without the following problems the crisis would be happening it just too big and too complicated and kept getting bigger and more complicated second is affirmative action dei combined with nepotism putting people in places they are not qualified for these are also used to deflect criticism of people who do a bad job you are just racist sexist transphobic yes boomers are part of it between them not stepping down from power not stopping back from the investment market and spading down their wealth in constructive ways and the lessons they leaned in the 80s about making oneself difficult to replace via not mentoring anyone the feeling the people are stuck is leading to a general not my problemization of society which was what they were always going to get with that stupid make everyone a renter project	0.0	2024-03-01 12:47:11
HHOyAcHh	460475428	imagine if people could achieve things themselves instead of needing things like esg dei affirmative action and other racially motivated hiring practices the only thing these do is lower standards and then throw into question if those people even deserve to be there or if they were just hired to tick a box which is often the case	0.0	2024-03-02 10:13:10
BR2r8FQn	460475586	clarence thomas got into law school through affirmative action himself thomas sowell is a self hating black man who is a useful tool notice that sowell is always used by whites to talk about race but not the economy even though sowells expertise is allegedly economics	0.0	2024-03-02 10:15:01
GOhZyZkO	460465646	supreme court strikes down affirmative action every college and business quickly reassures staff and students that prioritized hiring firing and promotions will be maintained simply under less explicit all begin coaching their staff on how to avoid running afoul of the law while still discriminating against is here to stay until it is made too legally perilous to risk for that to happen there will need to be a backlog of successfully prosecuted cases of whites winning lawsuits against employers and universities	3.0	2024-03-02 08:11:07
	460464364	i have seen nothing to suggest dei is being eliminated only that gamers are starting to boycott it even the supreme court banning affirmative action did stop colleges from favoring browns	0.0	2024-03-02 07:53:40
Y3wbpmuG	460460901	so now that dei is being eliminated notread moredo not against affirmative action in its original definition all things being equal give the nigger a when market makers dictate that a certain percentage of nonwhites must be insert high paying job no problem with wow of graduating pilots this year were black	0.0	2024-03-02 07:07:32
WpRUJovK	460460189	nigger do you even understand how dei affirmative action works it literally allows lower performing niggers spics into positions that higher performing whites would have taken literally lower the test scores niggers need to get into college my god you re fucking stupid	1.0	2024-03-02 06:57:45
	460460684	nigger do you even understand how dei affirmative action works it literally allows lower performing niggers spics into positions that higher performing whites would have taken of this is true there are still requirements for individuals to meet with dei dei just gives priority to specific underrepresented individuals if i allow a poor white kid from appalachia to apply for a job before with some rich legacy kid from harvard that s also dei the standards for the job still have to be met for an individual to get the job	7.0	2024-03-02 07:04:37
	460729245	do whites really think we are still bitching about the love this baseless fantasies that whites have about us when in reality were just quietly taking over your entire country while you wrestle with sure if you checked but were the richest and most successful people in your country you meanwhile need affirmative action and legacy admissions to get an education worth a damn	3.0	2024-03-04 20:06:07
X	460700792	something else is also going your workplace is filled with niggers and spics and jeets ahd gooks and jews dei affirmative action makes workplaces untenable for whites because there s too many uppity ninwhites making it shit but of course your dumb bokmer nigger ass is too dumb and boomer and nigger to see that so go fuck yourself niggeraccelerate	1.0	2024-03-04 13:57:00
	460789200	they re looking for a scapegoat as to why no one wants to join the ca nt be dei diversity affirmative action so what is it being unmarried is why no one wants to join the now there s a paper that says so	0.0	2024-03-05 11:27:46
J7n6zwHQ	460742140	so many retards itt they re dropping dei for 2 simple reasons state legislatures are now passing anti dei laws that apply to schools and corporations scotus ruling in sffa harvard that banned affirmative action in admissions and could be extended into the employment contextits as simple as trying to avoid lawsuits stop trying to infer some super secret plan its literally just about the bottom line as always	3.0	2024-03-04 23:50:28
J7n6zwHQ	460742838	bakke and grutter allowed affirmative action racial discrimination in the university admissions process sffa harvard effectively overruled those cases keep up with current events my nigger	0.0	2024-03-05 00:02:59
qUCpZM3g	461008402	dei bullshit was just an extension of affirmative action bullshit that was already struck down last year by the supreme court scotus has already decided those practices were illegal dei was trying to get around that by simply renaming the practices	0.0	2024-03-07 13:05:24
kogFURDy	461067654	its glowies initiative affirmative action crap there are contracts that provides government grants so long as a employee or consultants subcontractor that worked on the project satisfied the dei eeo quota fuck this follow the money on this case it wo nt disappear so long as legislature or funds are appropriated for this shit	0.0	2024-03-08 00:07:21
gVvDmee7	461165177	even with affirmative action dei media government universities on their side they still ca stop blaming the white man for their short comings	0.0	2024-03-08 21:35:48
G	461282035	an actual realistic political solution is ending affirmative action dei policies gibs affirmative action have the sole purpose of artificially raising blacks to economic positions that they never would have achieved with their own merit return them to where they belong at the bottom of the economic ladder this will indirectly resegregate society where more blacks will be economically forced to stay in their shithole ghettos slowly but surely niggers will fade from white society never completely but enough to put us on a good path for the future	0.0	2024-03-10 03:10:52
tgJFtBiT	461383707	diversity inclusion equity aka die as in die whitey die or dei esg environmental social governance basically orwellian kike constructs to discriminate against whites using money power leverage etc privatized affirmative action	0.0	2024-03-11 02:16:59
KdVOnBps	461550197	1 what will the money be spent on if its being spent on more affirmative action dei handouts or if its spent on anti white male education then how many americans know how much the rich are already taxed a lot of leftists pretend that the rich do pay taxes but the top 1 pays 10 of the taxes	0.0	2024-03-12 15:05:59
NbLQ1kZU	461522589	corporate welfare and subsidies are one of the ways in which the fed justifies forcing dei into the corporate sphere for example companies which receive federal funding are forced to have affirmative action and title ix policies	0.0	2024-03-12 10:09:04
GkX9dI5A	461502560	he himself know what he means by that social justice seem to mean anything at all maybe why now social justice instead of civil rights which as kiked as it was actually had meaning and real discrimination that they could point to they no longer have anything tangible equality equity positive discrimination affirmative action dei	0.0	2024-03-12 06:05:16
FzBZcwTq	461496130	no the government owns all the airlines after 2008 this is all the governments fault dei and affirmative action hires are to blame as well just more government	0.0	2024-03-12 04:31:37
	461632566	they are mentally inferiorthey have smaller brain than whites with smaller frontal lobes they are indeed retarded and inferior more violent 10x more crime unable to control emotions unable to be educated in white schools etc there are blacks smarter than exist pic related average nigger brain whites there are blacks with more money than youwhat is a monkey nigger is illegal preferences for blacks everywhere free cash free education free healthcare etc targeting blacks literally anti white government of all that there s very few blacks who are actually successful for real and not due to diversity affirmative action or mafia drug money	1.0	2024-03-13 10:34:45
mr8nM58a	461860600	the i think i told you is just the tip of the iceberg but people like you have already made up their mind and no amount of evidence will change what you regression is implying black people in the past were better and only become more violent which is untrue violence has been trending downwards in the entire country for the last few decades and black people today arguably hold higher positions of power and are more educated than their relatives of the affirmative action muh dei blah not worth continuing a conversation with someone who is as close minded as you	1.0	2024-03-15 12:24:49
	462054118	pretty much an accurate take on any job that not a companies are going to have their reckoning though when they realize 90 of their dei hires were never meant to hold a position of why the scotus affirmative action ruling happened the jews ca make their money if their workhorses are excluded from important positions	2.0	2024-03-17 10:03:45
d	462026549	yes your kind supreme court struck down affirmative action 6 3 wanna guess which religion voted what	1.0	2024-03-17 02:54:37
4kEb95Q2	462274447	like this one there is no engagement with these practices no suggestions for regulation or policy that could help just tangents about affirmative action	1.0	2024-03-19 13:17:13
XSaeenDT	462261748	my schizo theory is that the feds are using affirmative action and dei to gut the private sector while maintaining stricter admissions standards pseudo iq testing is still required for the military to guarantee their dominance	2.0	2024-03-19 10:51:02
0WIn7NAI	462262134	my schizo theory is that the feds are using affirmative action and dei to gut the private sector while maintaining stricter admissions standards pseudo iq testing is still required for the military to guarantee their the private sector is this bad the government is 20 times worse the faa is prioritizing autistic retards in their hiring process the feds are simply bringing everyone down to their level and the moneyed interests who actually rule us are making a fuckload of money doing it	0.0	2024-03-19 10:55:47
at6BsFcU	462487188	multicult diversity mass immigrationdei affirmative action type shitsocialist incompetencelowering iqwasting money on wacky radical leftist bullshitoff shoring gutted economydiversity and commies with their much higher tolerance for corruption	0.0	2024-03-21 16:05:37
	462468725	if you want whites to do better tell them to get educated get proper to university get rejected due to affirmative action apply for a job get denied due to dei initiatives try to start your own business bank denies you due to esg tugging at those bootstraps colonizer whoa wtf why are you getting radical help police becoming an extremist	1.0	2024-03-21 12:29:44
x9gzNF24	463064325	this is part of the problem to let ne er ending waves of foreigners take the blame for the affirmative action ajd civil rights ruin that were themselves a cover for the impoverishment created by the new deal and usery	0.0	2024-03-26 20:44:08
uoujUmiV	463057646	there is no conspiracy here this was caused by retarded hiring practices this is diversity this is affirmative action this is dei this is equality this is anti apartheid this is what democracy looks like	0.0	2024-03-26 19:10:22
FhCvRBkF	462956745	not sure i just know dartmouth for the most part you get the polarization at these schools on the one hand you have the crew and country club old money dynastic types who actually vote and contribute democrat even though they act conservative but their kids are conservative and then you have the affirmative action students on the other end of the spectrum	1.0	2024-03-25 21:06:34
UnrOw4jh	463158285	too many woke thugs in the inner city we need law and order and less welfare queens you people need to take personal responsibility and stop looking for handouts marxism socialism and affirmative action are going to save you just look at chicago or any urban area all it is is a bunch of critical race theory woke dei niggers	0.0	2024-03-27 18:10:38
epshK29o	463120217	their culture needs to change some people may come from historically poor backgrounds but they have just as many opportunities and then some as anyone else the difference is that society wo criticise the negative aspects of their culture long term sacrifice for short term gain negative attitudes towards education etc because that be rayciss and oppressive so we incentivise them to continue to degrade their culture by throwing money at them as this solves the imagined muh systemic racism the only real help that they could be provided would be to punish and subsequently erase these negative aspects of their culture and give them some direction this also relies on them being able to compete without things like affirmative action and dei of course what do you think the outcome here would they need help	0.0	2024-03-27 10:56:54
	463082684	or to put it another way everyone is still pretending to debate as or against 2000s bush conservatives where no one is allowed to complain about gay race communism directly or hate niggers you can only touch the topic with a 30 yard pole with ideas like meritocracy or fighting reverse racism affirmative action because racism bad or other similar things that were a result of democrat strongarming in the past to cuck republicanswhen your average libtard is calling you or whoever a nazi they have not actually internalized this as a serious thing they are doing polemics they truthfully still see republicans as these goofy jesus retard caricatures and they just use nazi and talk about extremism because this is their press to win politics button they actually view people like the evil stormtroopers from 100 years ago that they still quake in fear of despite being dead for so longjust look at how eager they are to call everything the larp how much they participate in fueling it even more than anyone on the right is they found the thing they wanted to find and amplified it every single one of them is the kind of person that probably watches young sheldon and thinks cutting edge commentary on american society and how just like the smart kid who reads books being put upon by the retard jesus why you get scenarios like pic related increasingly often why getting upset about the mayor dei comment even though not really revealing anything or even a mistake based on what the right intends with the attacks on dei but so many people are still stuck in this world where the rules of talking politics is everyone is antiracist and the topic is simply about which policy is racister and therefore bad this is in spite of the fact that been calling republicans nazis for decades because no matter how much they say it they never actually believe it	4.0	2024-03-27 02:29:01
AQe4avdb	463250280	i hate these thugs from the inner city who do not abide to law and order i just want to say hey you people need to stop welfare queening and get some personal responsibility so stop taking handouts and advocating for marxism and socialism by supporting affirmative action laws we need to clean the urban chigaco areas schools are woke on critical race theory and staffed by dei conclusion kill niggers	0.0	2024-03-28 16:19:11
gSVLJmGX	463236139	defeated the worst president our democracys ever hadbarack obama is the worst president we are going full brazil with 100 mln niggers and browns and open borders and other diversity dei affirmative action destructive policies the paris climate deal and world health organization nominated the first black woman to the largest infrastructure bill in decadescreated by trump were blocked by d until bidon all democrat mafia connected people stole billions of where is the infrastructure	1.0	2024-03-28 13:32:58
GUdZPM5k	463218234	your leftist is a lebanese careerist politician in the dominican republic a man who has to continue border restrictions against haiti to have any hope of a continued political career this exception is irrelevant to any white person and any white country the fact that you to look for an exception in a country with no whites and hardly an economy outside of tourism confirms my are no leftist who are against mass immigration and they are all for dei initiatives and affirmative action	1.0	2024-03-28 10:03:14
GUdZPM5k	463208028	nooo i ca nt survive in the world my politics created i need minorities to do the workmy politics did create mass immigration affirmative action dei or anything related to this bridge collapse or the market dysfunction created by jewish oligarchs that s all leftist and neocons	1.0	2024-03-28 07:59:06
	463354289	work for your money faggot people already get benefits for being disabled and all that we do need to subsidize failure or better yet instead of seeking work you could create work and start your own business we could also get rid of dei affirmative action and all that other shit like deporting the illegals i want taxes collected from white people to go towards white people	1.0	2024-03-29 17:08:39
rGjlwRqh	463280444	affirmative action dei quotasop is a faggot anons who did respond with something similar are retards	0.0	2024-03-28 23:40:34
1nW5thHc	463428886	its hard to keep intelligent blacks in the military anyway because they can make so much more in the private sector due to affirmative action dei initiatives that has been a problem for decades	0.0	2024-03-30 12:53:01
	463532109	who s protected who s the one we ca nt even call names or make fun of without getting canceled or maybe even tossed in jail for hate speech who gets affirmative action and dei from the government and big corporations collectively the fascist state kek i know you re baiting but ill play along my negro	0.0	2024-03-31 14:03:17
tXRqI6e4	463482161	steals your job also receives ebt subsidized housing university affirmative action dei etc blind	0.0	2024-03-31 01:44:48
vcki	463883671	do forget they also have much higher paying jobs than they would actually get on merit which gives them an even greater chance to impregnate impressionable white women all part of the jew niggers affirmative action and dei is definitely not an own it is state sponsored terrorism against white males and its very effective all are pussies for letting it happen in your own country even your women do respect you anymore you think its a larp or i m being disrespectful or whatever but i genuinely feel sorry for you guys at this point	1.0	2024-04-03 19:06:48
	463848321	this crap started back in the 80 with affirmative action totally down hill then this dei crap is hitting the gas at edge of cliff	0.0	2024-04-03 12:28:07
JQDHnAMY	463851162	outside of hollywood dei affect them the ones happily implementing these recent stance against affirmative action was less waaah jews not included and more leave loopholes for whites to get into princeton once we make them a minority	1.0	2024-04-03 12:55:28
8avqcUAx	463901396	yep decades of dei twitter fact checking and affirmative action have exactly helped status symbols of the past the final bullet in the head was ostracizing every doctor who did kneel during covid credential normalfaggots do realize how much thin ice they re on at any given time as their overlords can take their little graduation cap at any moment	0.0	2024-04-04 00:01:38
tuQJorVL	464084757	affirmative action dei initiatives by the people who own the pageants	0.0	2024-04-05 17:03:58
B	464075487	republicans do absolutely nothing about immigration do absolutely nothing about black crime do absolutely nothing about pro crime prosecutors das judges do absolutely nothing about blm rioters do absolutely nothing about affirmative action dei civil rights law do absolutely nothing about gun control do absolutely nothing about voter fraud do absolutely nothing about social media censorship elon musk 1 guy did more for this issue than every single elected gop official combined they are successful at passing this stupid shit	3.0	2024-04-05 15:13:45
6T	464338602	pajeets are more competent then most recent class of dei affirmative action niggers taking over the jobs on also remember that us wants to remove algebra from their middle school curriculum to not offend niggers	2.0	2024-04-08 09:37:58
Hqf4Em85	464451500	naggers starveno the government then uses your tax money to move the horde into your own and are a nomadic low iq subspecies of humans that culturally functions like a locust swarm before nature kept their numbers in check but now with industrialism and affirmative action equity dei and all that shit they have express entry to anywhere any school any hospital any job you can not escape the horde	0.0	2024-04-09 12:03:24
OygX6Gi9	464425439	russia does have esg or dei or affirmative action so yes indeed i expect they work in fact due to treaties we supervise aspects of their nuke production process we have proof they they did work the military is scamming and lying to the public would you like that airman huh shaves you	5.0	2024-04-09 07:06:14
U9nikjGs	464424456	and jews setup the whole being white and brown shit rofl and they got many of them light pigmentation and they setup white and brown so they could blame john in london for give me the money you took from indians and it went to jewish families rofl have to make jew and british then identical otherwise you ca nt smear john so whites it jews getting mega played by non europeans aswell with israel because then they say okay is now not a jewish state but a white supremacist apartheid state with white people oppressing browns lol jews lolyou should have never done any of this dumb shit now they got to roll back dei they got to roll back affirmative action and all this or jews will be targetted by that too because they rich and they got many of them light pigmentation they are european racially though they re jewish but in usa nomenclature of fraud setup by these buffons themselves they are whites infact super rich white people who now do not qualify in any way for dei infact they have to be kicked out so more browns can go in was supposed to happen wtf how did this ride a bike stick something in the wheel fall down is germans fault they done nothing but apologize to jews for 70 years rofl	0.0	2024-04-09 06:52:12
l38jDgKI	464564068	well said they are objectively unattractive with sloping foreheads snouts big bubble lips big gaping nostrils they all have black skin and pubic hair on their heads and black eyes as we all know by now even the bbc myth is untrue maybe they have slightly more athletic bodies on average then unintelligent and even feed themselves literally we have to give them affirmative action and dei and ebt cards here in the states and i can remember back in the 80s and we had to ship them food to africa just so they could survive long enough to clone themselves and later be shipped by the boatload to europe the divorce rate for bmwf is something like 90 the mutt kids are almost all ugly and stupid compared to the white side like you said it makes no sense yet white women swoon for them even the white women who fuck niggers seem to have to struggle against some inner desire to do it and they need some combination of a strong father figure good quality friends and probably not going to uni just to somehow miraculously emerge unscathed at this point the few white women who fucked a nigger kind of advertise it as a selling point like look at the willpower i displayed not letting a monkey stick its dick inside of me choose me special no upside and it be that much fun to fuck a nigger it just fucked every type of woman under the sun and i imagine being hung up on one of them like white women are on niggers an absolutely absurd phenomenon just crying out for an explanation and then a remedy	0.0	2024-04-10 14:07:24
knp4A9lh	464535730	with dei and affirmative action like programs the gap is probably widening	0.0	2024-04-10 08:50:26
	464508538	it was your faggot diaspora that pioneered dei and pseudo liberal policies like affirmative action open borders migration and lgbt the world war two generation literally preferred that hitler erase you than allow you to come here ahahahahahaha	1.0	2024-04-10 01:24:50
2Oup	464497867	why do we keep letting them change the language it was affirmative action for years now calling it dei same shit different name	2.0	2024-04-09 21:45:30
c05uAd5a	464498216	why do we keep letting them change the not letting them operated on pure force a was affirmative action for years now calling it dei same shit different still affirmative action dei their tricks do not hold the same weight they did in 2018 bear in unfortunately are at war with something that is a bit of a creation of our own the liberal world order the tunnel tribe be able to exist without the french revolution at least not in prominence that it is now	1.0	2024-04-09 21:52:00
